datatype,objectid,displayorder,forwardtext,invertedtext,remarks,effectivedate
previous_attribution,0,3,Follower of Cimabue,"Cimabue, Follower of",Bd. Tr. approval 5/2/1984,1984-05-02
previous_attribution,1,2,Follower of Giotto,"Giotto, Follower of",Bd. Tr. approval 2/1/1941,1941-02-01
previous_attribution,1,1,School of Giotto,School of Giotto,Attribution at time of acquisition,1937
previous_attribution,2,1,Gherardo Starnina,"Starnina, Gherardo",Attribution at time of gift,
previous_attribution,3,1,Gherardo Starnina,"Starnina, Gherardo",Attribution at time of gift,
previous_attribution,4,1,Gherardo Starnina,"Starnina, Gherardo",Attribution at time of gift,
previous_attribution,5,2,Workshop of Fra Angelico,"Angelico, Fra, Workshop of",Bd. Tr. approval 4/28/1988,
previous_attribution,5,1,Fra Angelico,"Angelico, Fra",Attribution at time of gift,
previous_attribution,6,1,Master of the Fabriano Altarpiece and Allegretto Nuzi,Master of the Fabriano Altarpiece and Allegretto Nuzi,Attribution at time of gift,1937
previous_attribution,7,1,Master of the Fabriano altarpiece and Allegretto Nuzi,Master of the Fabriano altarpiece and Allegretto Nuzi,Attribution at time of gift,
previous_attribution,8,1,Master of the Fabriano altarpiece and Allegretto Nuzi,Master of the Fabriano altarpiece and Allegretto Nuzi,Attribution at time of gift,
previous_attribution,9,2,Attributed to Masaccio,"Masaccio, Attributed to","Bd. Tr. approval 1/9/1964
",
previous_attribution,9,1,Masaccio,Masaccio,Attribution at time of gift,
previous_attribution,12,1,Matteo di Giovanni,Matteo di Giovanni,Attribution at time of gift,
previous_attribution,14,1,Neroccio de' Landi and Master of the Griselda Legend,Neroccio de' Landi and Master of the Griselda Legend,"Attribution at time of acquisition
",
previous_attribution,16,1,Masaccio,Masaccio,Attribution at time of gift,
previous_attribution,17,1,Domenico Veneziano,Domenico Veneziano,Attribution at time of gift,
previous_attribution,19,2,Antonio del Pollaiuolo,"Pollaiuolo, Antonio del",Bd. Tr. approval 2/1/1941,
previous_attribution,19,1,Andrea del Castagno,"Castagno, Andrea del",Attribution at time of gift,
previous_attribution,22,1,Botticelli,Botticelli,Attribution at time of gift,
previous_attribution,25,1,Pisanello,Pisanello,Attribution at time of gift,
previous_attribution,32,1,Giovanni Bellini,"Bellini, Giovanni",Attribution at time of gift,
previous_attribution,33,3,Follower of Cimabue,"Cimabue, Follower of",Bd. Tr. approval 5/2/1984,1984-05-02
previous_attribution,34,3,Follower of Cimabue,"Cimabue, Follower of",Bd. Tr. approval 5/2/1984,1984-05-02
previous_attribution,34,1,Cimabue,Cimabue,Attribution at time of gift,1937
previous_attribution,34,2,Attributed to Cimabue,"Cimabue, Attributed to",Bd. Tr. approval 1/9/1964,1964-01-19
previous_attribution,35,1,Byzantine 13th Century,Byzantine 13th Century,Attribution at time of acquisition,1937
previous_attribution,38,1,Antonello da Messina,Antonello da Messina,"Attribution at time of acquisition
",
previous_attribution,39,1,Andrea Mantegna,"Mantegna, Andrea",Attribution at time of gift,
previous_attribution,39,2,Paduan 15th Century,Paduan 15th Century,"Bd. Tr. approval 10/4/1984
",
previous_attribution,42,1,Attributed to Titian,"Titian, Attributed to",Bd. Tr. approval 10/4/1984,1984-10-04
previous_attribution,42,2,Titian,Titian,Attribution at time of gift,1937
previous_attribution,43,1,Titian,Titian,Attribution at time of gift,
previous_attribution,52,1,Rogier van der Weyden,"Weyden, Rogier van der",Attribution at time of gift,
previous_attribution,52,2,Circle of Rogier van der Weyden,"Weyden, Rogier van der, Circle of",Bd. Tr. approval 5/1/74,
previous_attribution,54,1,Sir Peter Paul Rubens,"Rubens, Sir Peter Paul",Attribution at time of gift,
previous_attribution,55,1,Sir Peter Paul Rubens,"Rubens, Sir Peter Paul",Attribution at time of gift,
previous_attribution,58,1,Sir Anthony van Dyck,"Dyck, Sir Anthony van",Attribution at time of gift,
previous_attribution,61,2,Follower of Johannes Vermeer,"Vermeer, Johannes, Follower of",Bd. Tr. approval 1/25/73,
previous_attribution,61,1,Johannes Vermeer,"Vermeer, Johannes",Attribution at time of gift,
previous_attribution,62,2,Follower of Johannes Vermeer,"Vermeer, Johannes, Follower of",Bd. Tr. approval 1/25/1973,2010-02-25
previous_attribution,62,1,Johannes Vermeer,"Vermeer, Johannes",Attribution at time of gift,
previous_attribution,73,1,Albrecht Dürer (?),"Dürer, Albrecht, (?)",Attribution at time of gift,
previous_attribution,80,1,Rembrandt van Rijn,Rembrandt van Rijn,Attribution at time of gift,
previous_attribution,81,2,Carel Fabritius and Workshop of Rembrandt van Rijn,"Fabritius, Carel and Workshop of Rembrandt van Rijn",Bd. Tr. approval 1/23/1992,""
previous_attribution,81,1,Rembrandt van Rijn,Rembrandt van Rijn,Attribution at time of gift,
previous_attribution,82,2,Rembrandt Workshop,Rembrandt Workshop,Bd. Tr. approval 1/27/1994,1994-01-27
previous_attribution,82,1,Rembrandt van Rijn,Rembrandt van Rijn,Attribution at time of gift,
previous_attribution,86,1,Rembrandt van Rijn,Rembrandt van Rijn,Attribution at time of gift,
previous_attribution,87,1,Diego Velázquez,"Velázquez, Diego",Attribution at time of gift,
previous_attribution,89,2,Circle of Diego Velázquez,"Velázquez, Diego, Circle of",Bd. Tr. approval 5/3/72,
previous_attribution,89,1,Diego Velázquez,"Velázquez, Diego",Attribution at time of gift,
previous_attribution,91,1,El Greco,"Greco, El",Attribution at time of gift,
previous_attribution,92,1,Francisco de Goya,"Goya, Francisco de",,
previous_attribution,93,1,Francisco de Goya,"Goya, Francisco de",Attribution at time of gift,
previous_attribution,94,1,Francisco de Goya,"Goya, Francisco de",Attribution at time of gift,
previous_attribution,95,1,Francisco de Goya,"Goya, Francisco de",,
previous_attribution,105,1,Thomas Gainsborough,"Gainsborough, Thomas",Attribution at time of gift,
previous_attribution,105,2,Studio of Thomas Gainsborough,"Gainsborough, Thomas, Studio of",Bd. Tr. approval 1/25/1973,""
previous_attribution,119,1,Donatello,Donatello,Attribution at time of gift,
previous_attribution,121,1,Desiderio da Settignano,Desiderio da Settignano,Attribution at time of gift,
previous_attribution,122,1,Desiderio da Settignano,Desiderio da Settignano,Attribution at time of gift,
previous_attribution,122,2,Style of Desiderio da Settignano,"Desiderio da Settignano, Style of",Bd. Tr. approval 10/1/1987,1987-10-01
previous_attribution,123,1,Agostino di Duccio,Agostino di Duccio,Attribution at time of acquisition,1937
previous_attribution,127,1,Giovanni Antonio Amadeo,"Amadeo, Giovanni Antonio",Attribution at time of gift,1937
previous_attribution,128,1,Giovanni Antonio Amadeo,"Amadeo, Giovanni Antonio",Attribution at time of gift,
previous_attribution,129,1,Luca della Robbia,"Robbia, Luca della",Attribution at time of gift,
previous_attribution,129,2,Atelier of Andrea della Robbia,"Robbia, Andrea della, Atelier of",Bd. Tr. approval 2/1/41,
previous_attribution,130,1,Luca della Robbia,"Robbia, Luca della",Attribution at time of gift,
previous_attribution,131,2,Andrea della Robbia,"Robbia, Andrea della",Bd. Tr. approval 2/1/41,
previous_attribution,131,1,Luca della Robbia,"Robbia, Luca della",Attribution at time of gift,
previous_attribution,133,1,Mino da Fiesole,Mino da Fiesole,Attribution at time of gift,
previous_attribution,136,2,Florentine 15th Century,Florentine 15th Century,Bd. Tr. approval 2/1/1941,2010-01-19
previous_attribution,136,1,Desiderio da Settignano,Desiderio da Settignano,Attribution at time of gift,
previous_attribution,137,3,Benedetto da Maiano,Benedetto da Maiano,Bd. Tr. approval 10/4/1984,
previous_attribution,137,1,Donatello,Donatello,Attribution at time of gift,
previous_attribution,137,2,Studio of Benedetto da Maiano,"Benedetto da Maiano, Studio of",Bd. Tr. approval 5/5/1976,          
previous_attribution,138,1,Giovanni Bologna,"Bologna, Giovanni",Attribution at time of gift,
previous_attribution,138,3,Attributed to Francesco Righetti after Giovanni Bologna,"Righetti, Francesco, Attributed to after Giovanni Bologna",Bd. Tr. approval 10/9/1986,
previous_attribution,138,2,Attributed to Adriaen de Vries,"Vries, Adriaen de, Attributed to",Bd. Tr. approval 9/29/1970,
previous_attribution,139,1,Jacopo Sansovino,"Sansovino, Jacopo",Attribution at time of gift,
previous_attribution,139,2,Probably Roman,"Roman, Probably",Bd. Tr. approval 10/1/87,
previous_attribution,140,2,Probably Roman,"Roman, Probably",Bd. Tr. approval 10/1/1987,""
previous_attribution,140,1,Jacopo Sansovino,"Sansovino, Jacopo",Attribution at time of gift,
previous_attribution,147,1,Antonio Vivarini,"Vivarini, Antonio","Attribution at time of acquisition
",2008-12-23
previous_attribution,160,1,Lippo Memmi,Lippo Memmi,Attribution at time of gift,
previous_attribution,160,2,Lippo Memmi (?),"Memmi (?), Lippo","Bd. Tr. approval 2/1/1941.  Change was to ""(?)"".  Closest CMS term is ""Possibly"".",
previous_attribution,161,2,Lippo Memmi (?),Lippo Memmi (?),"Bd. Tr. approval 2/1/1941.  Change was to ""(?)"".  Closest CMS term is ""Possibly"".",
previous_attribution,161,1,Lippo Memmi,Lippo Memmi,Attribution at time of acquisition,
previous_attribution,220,1,Pontormo,Pontormo,Attribution at time of gift,
previous_attribution,229,1,Domenico Fetti,"Fetti, Domenico",Attribution at time of gift,
previous_attribution,239,1,Jacopo Tintoretto,"Tintoretto, Jacopo",Bd. Tr. approval 10/4/1984,1984-10-04
previous_attribution,239,2,Dosso Dossi,"Dossi, Dosso",Attribution at time of gift,1939
previous_attribution,256,2,Attributed to Francesco del Cossa,"Cossa, Francesco del, Attributed to","Bd. Tr. approval 1/9/1964
",
previous_attribution,256,1,Francesco del Cossa,"Cossa, Francesco del",Attribution at time of gift,
previous_attribution,272,1,Master of the Life of Saint John the Baptist,Master of the Life of Saint John the Baptist,"This change appears not to have been passed by the Bd. Tr.; memos in the object file indicate John Walker directed the change be made in December 1956, and the change was finalized by June 1957.",1957-06-01
previous_attribution,272,2,Giovanni Baronzio,"Baronzio, Giovanni",Attribution at time of gift,1939
previous_attribution,283,2,Italian 16th Century,Italian 16th Century,Change memo 11/14/83,
previous_attribution,283,1,Venetian School (Possibly Giorgione),Venetian School (Possibly Giorgione),Attribution at time of gift,
previous_attribution,294,1,Biagio d'Antonio da Firenze,Biagio d'Antonio da Firenze,"Bd. Tr. approval 1/9/1964 not for a true attribution change, but for a change from using the name Giovanni Battista Utili, then thought to be a different name for the same artist, but now identified as Giovanni Battista Bertucci.
",1964-01-09
previous_attribution,296,1,Perugino,Perugino,Attribution at time of gift,
previous_attribution,300,2,Follower of Caravaggio,"Caravaggio, Follower of",Bd. Tr. approval 9/30/1981,          
previous_attribution,300,1,Michelangelo Merisi da Caravaggio,"Caravaggio, Michelangelo Merisi da",Attribution at time of gift,
previous_attribution,319,2,Andrea Mantegna,"Mantegna, Andrea",Original Kress Collection attribution,
previous_attribution,319,1,Circle of Andrea Mantegna,"Mantegna, Andrea, Circle of",Bd. Tr. approval 9/26/72,1972-09-26
previous_attribution,320,1,Giovanni Battista Utili,"Utili, Giovanni Battista","Attribution at time of acquisition
",
previous_attribution,321,1,Jacopo Tintoretto,"Tintoretto, Jacopo",Attribution at time of acquisition,1939
previous_attribution,355,1,Alesso Baldovinetti,"Baldovinetti, Alesso",Attribution at time of gift,
previous_attribution,359,1,Master of the Barberini Panels,Master of the Barberini Panels,Bd. Tr. approval 2/1/1941 (artist's name was formerly given as Carrand or Barberini Master),
previous_attribution,365,1,Giovanni Bellini,"Bellini, Giovanni","Attribution at time of acquisition
",
previous_attribution,372,1,Jacopo Tintoretto,"Tintoretto, Jacopo",Attribution at time of acquisition,1939
previous_attribution,399,1,Giorgione and Titian,Giorgione and Titian,Attribution at time of acquisition,1939
previous_attribution,400,1,Follower of Titian,"Titian, Follower of",Bd. Tr. approval 1/19/1971,1971-01-19
previous_attribution,400,2,Titian,Titian,Attribution at time of gift,1939
previous_attribution,401,1,Fra Angelico,"Angelico, Fra",Attribution at time of gift,
previous_attribution,405,3,Giovanni Bellini and Workshop,"Bellini, Giovanni and Workshop","See 8/17/1983 and 8/23/1983 memos on computer artist file
",
previous_attribution,405,2,Giovanni Bellini and Assistant,"Bellini, Giovanni and Assistant","Bd. Tr. approval 5/5/1971
",
previous_attribution,405,1,Giovanni Bellini,"Bellini, Giovanni",Attribution at time of gift,
previous_attribution,406,1,Jacopo Bellini,"Bellini, Jacopo",Attribution at time of gift,1939
previous_attribution,406,2,Attributed to Jacopo Bellini,"Bellini, Jacopo, Attributed to","Bd. Tr. approval 1/9/1964
",1964-01-09
previous_attribution,409,1,Andrea Mantegna,"Mantegna, Andrea",Attribution at time of gift,
previous_attribution,422,1,Filippo Lippi,"Lippi, Filippo",Attribution at time of gift,1939
previous_attribution,423,1,Perugino,Perugino,Attribution at time of gift,
previous_attribution,434,1,Simone Martini,Simone Martini,Attribution at time of gift,1939
previous_attribution,436,3,Sassetta and Workshop,Sassetta and Workshop,"Date of change unknown, but published with this attribution in 1985 summary catalogue.
",1985
previous_attribution,436,2,Sassetta and Assistant,Sassetta and Assistant,Bd. Tr. approval 1/9/1964,1964-01-09
previous_attribution,436,1,Sassetta,Sassetta,Attribution at time of acquisition,1939
previous_attribution,437,1,Pinturicchio,Pinturicchio,"Attribution at time of acquisition
",
previous_attribution,437,2,Master of Santo Spirito,Master of Santo Spirito,"Bd. Tr. approval 5/5/1971
",
previous_attribution,447,1,Sodoma,Sodoma,Attribution at time of gift,
previous_attribution,461,1,Annibale Fontana,"Fontana, Annibale",Attribution at time of gift,
previous_attribution,463,1,Giovanni Antonio Amadeo,"Amadeo, Giovanni Antonio",Attribution at time of gift,
previous_attribution,468,2,Andrea del Verrocchio,"Verrocchio, Andrea del",Bd. Tr. approval 10/4/84,
previous_attribution,468,1,Desiderio da Settignano,Desiderio da Settignano,Attribution at time of gift,
previous_attribution,470,1,Benedetto da Maiano,Benedetto da Maiano,Attribution at time of gift,
previous_attribution,471,1,Andrea della Robbia,"Robbia, Andrea della",Attribution at time of acquisition,1939
previous_attribution,475,1,Andrea del Verrocchio,"Verrocchio, Andrea del",Attribution at time of gift,
previous_attribution,478,1,Pyrgoteles,Pyrgoteles,Attribution at time of gift,
previous_attribution,478,2,Lombard 16th Century,Lombard 16th Century,"Bd. Tr. approval 10/4/1984
",
previous_attribution,486,2,Francesco Granacci,"Granacci, Francesco",Attribution at time of gift,
previous_attribution,486,1,Master of the Kress Landscapes,Master of the Kress Landscapes,Bd. Tr. approval 5/5/71,
previous_attribution,487,1,Francesco Granacci,"Granacci, Francesco",Attribution at time of gift,
previous_attribution,487,1,Master of the Kress Landscapes,Master of the Kress Landscapes,Bd. Tr. approval 5/5/71,
previous_attribution,488,1,Francesco Granacci,"Granacci, Francesco",Attribution at time of gift,
previous_attribution,488,1,Master of the Kress Landscapes,Master of the Kress Landscapes,Bd. Tr. approval 5/5/71,
previous_attribution,494,2,Florentine School,Florentine School,Bd. Tr. approval 2/1/41,
previous_attribution,494,1,Domenico Beccafumi,"Beccafumi, Domenico",Attribution at time of gift,
previous_attribution,499,1,Giovanni Bellini,"Bellini, Giovanni",Attribution at time of gift,
previous_attribution,501,1,Cosimo Tura,"Tura, Cosimo",Attribution at time of gift; spelling of artist's first name changed in NGA records November 1998.,
previous_attribution,501,2,Attributed to Cosmè Tura,"Tura, Cosmè, Attributed to","Bd. Tr. approval 1/9/1964
",
previous_attribution,531,1,Pontormo,Pontormo,Attribution at time of gift,
previous_attribution,570,1,John Singleton Copley,"Copley, John Singleton",Attribution at time of gift,
previous_attribution,572,1,Rembrandt van Rijn,Rembrandt van Rijn,Attribution at time of gift,
previous_attribution,577,1,Clodion,Clodion,Attribution at time of acquistion,          
previous_attribution,578,1,Clodion,Clodion,Attribution at time of acquisition,          
previous_attribution,894,1,Domenico Morone,"Morone, Domenico",Attribution at time of gift,
previous_attribution,985,1,Francisco de Goya,"Goya, Francisco de",,
previous_attribution,991,1,Francisco de Goya,"Goya, Francisco de",,
previous_attribution,1024,1,Clodion,Clodion,Attribution at time of acquisition,          
previous_title,1043,2,Distant Ely,,,
previous_attribution,1095,4,Anonymous Unknown Nationality 18th Century,Anonymous Unknown Nationality 18th Century,Change memo 11/14/83,1983-11-14
previous_attribution,1095,3,American School (?),American School (?),Bd. Tr. approval 5/6/64,1964-05-06
previous_attribution,1095,1,John Singleton Copley,"Copley, John Singleton",Attribution at time of gift,
previous_attribution,1095,2,John Singleton Copley (?),John Singleton Copley (?),Bd. Tr. approval 6/4/43,1943-06-04
previous_attribution,1096,1,Joseph Blackburn,"Blackburn, Joseph",,
previous_attribution,1099,4,Anonymous Unknown Nationality 18th Century,Anonymous Unknown Nationality 18th Century,Change memo 11/14/83,1983-11-14
previous_attribution,1099,2,British School,British School,"Bd. Tr. approval 4/30/69; list reads ""Artist Unknown"", but original change proposal was annotated by W.P. Campbell to read ""British School"".",1969-04-30
previous_attribution,1099,5,Style of Joseph Highmore,"Highmore, Joseph, Style of",Bd. Tr. approval 10/5/89,1989-10-05
previous_attribution,1099,1,Robert Feke,"Feke, Robert",Attribution at time of gift,
previous_attribution,1099,3,American School (?),American School (?),This attribution assigned at an unknown date.,
previous_attribution,1101,1,John Lewis Krimmel,"Krimmel, John Lewis",Attribution at time of gift,
previous_attribution,1102,1,John Neagle,"Neagle, John",Attribution at time of gift,
previous_attribution,1106,1,Gilbert Stuart,"Stuart, Gilbert",Attribution at time of gift,
previous_attribution,1107,2,American 19th Century,American 19th Century,"Bd. Tr. approval 4/30/69; list reads ""Artist Unknown"", but original change proposal by W.P. Campbell reads ""American School, possibly after Gilbert Stuart"".
",1969-04-30
previous_attribution,1107,1,Gilbert Stuart,"Stuart, Gilbert",Attribution at time of gift,
previous_attribution,1109,1,Gilbert Stuart,"Stuart, Gilbert",Attribution at time of gift,
previous_attribution,1118,3,Anonymous Unknown Nationality 19th Century,Anonymous Unknown Nationality 19th Century,Change memo 11/14/83,1983-11-14
previous_attribution,1118,2,European 19th Century,European 19th Century,Bd. Tr. approval 4/30/69,1969-04-30
previous_attribution,1118,1,Gilbert Stuart,"Stuart, Gilbert",Attribution at time of gift,
previous_attribution,1131,2,European 19th Century,European 19th Century,Bd. Tr. approval 4/30/1969; see various comments on original change proposal in object file in curatorial records.,""
previous_attribution,1131,1,Samuel Lovett Waldo,"Waldo, Samuel Lovett",Attribution at time of gift,
previous_attribution,1133,1,Benjamin West,"West, Benjamin",Attribution at time of gift,
previous_attribution,1138,1,Giovanni Bellini,"Bellini, Giovanni",Attribution at time of gift,
previous_attribution,1139,1,Giovanni Bellini,"Bellini, Giovanni","Attribution at time of acquisition
",
previous_attribution,1141,1,Francesco Bonsignori,"Bonsignori, Francesco","Attribution at time of acquisition
",
previous_attribution,1144,1,Canaletto,Canaletto,,
previous_attribution,1151,2,Follower of John Crome,"Crome, John, Follower of",Bd. Tr. approval 5/3/72,1972-05-03
previous_attribution,1151,1,John Crome,"Crome, John",Attribution at time of gift,
previous_attribution,1154,1,Gerard David,"David, Gerard",Attribution at time of gift,
previous_attribution,1155,1,Gerard David,"David, Gerard",Attribution at time of gift,
previous_attribution,1156,1,Gerard David,"David, Gerard",Attribution at time of gift,
previous_attribution,1175,1,Italian School,Italian School,Attribution at time of gift,
previous_attribution,1177,1,Lorenzo di Credi,Lorenzo di Credi,"Attribution at time of acquisition
",
previous_attribution,1181,1,Andrea Mantegna,"Mantegna, Andrea","Attribution at time of acquisition
",
previous_attribution,1183,1,Domenico Morone,"Morone, Domenico",Attribution at time of gift,
previous_attribution,1189,2,Pseudo Pier Francesco Fiorentino,Pseudo Pier Francesco Fiorentino,"Bd. Tr. approval 5/6/1964
",
previous_attribution,1189,1,Pier Francesco Fiorentino,Pier Francesco Fiorentino,Attribution at time of gift,
previous_attribution,1190,1,Pontormo,Pontormo,Attribution at time of gift,
previous_attribution,1197,1,Follower of Rembrandt van Rijn,"Rembrandt van Rijn, Follower of",Bd. Tr. approval 1/26/1995,1995-01-26
previous_attribution,1197,2,Rembrandt Workshop,Rembrandt Workshop,Bd. Tr. approval 1/27/1994,1994-01-27
previous_attribution,1197,4,Rembrandt van Rijn,Rembrandt van Rijn,Attribution at time of gift,
previous_attribution,1197,3,Follower of Rembrandt van Rijn,"Rembrandt van Rijn, Follower of",Bd. Tr. approval 5/2/1984,1984-05-02
previous_attribution,1198,1,Rembrandt van Rijn,Rembrandt van Rijn,Attribution at time of gift,
previous_attribution,1200,2,after Rembrandt van Rijn,"Rembrandt van Rijn, after",Bd. Tr. approval 5/2/1984,          
previous_attribution,1200,1,Rembrandt van Rijn,Rembrandt van Rijn,Attribution at time of gift,
previous_attribution,1202,2,Style of Rembrandt van Rijn,"Rembrandt van Rijn, Style of",Bd. Tr. approval 5/2/84,
previous_attribution,1202,1,Rembrandt van Rijn,Rembrandt van Rijn,Attribution at time of gift,
previous_attribution,1203,1,Follower of Rembrandt van Rijn,"Rembrandt van Rijn, Follower of",Bd. Tr. approval 5/2/1984,1984-05-02
previous_attribution,1203,2,Rembrandt van Rijn,Rembrandt van Rijn,Attribution at time of gift,
previous_attribution,1205,1,Rembrandt van Rijn,Rembrandt van Rijn,Attribution at time of gift,
previous_attribution,1205,2,Follower of Rembrandt van Rijn (Possibly Willem Drost),"Rembrandt van Rijn, Follower of (Possibly Willem Drost)",Bd. Tr. approval 5/2/1984,          
previous_attribution,1209,1,Rembrandt van Rijn,Rembrandt van Rijn,Attribution at time of gift,
previous_attribution,1212,1,Sir Joshua Reynolds,"Reynolds, Sir Joshua",Attribution at time of gift,
previous_attribution,1212,2,Follower of Sir Joshua Reynolds,"Reynolds, Sir Joshua, Follower of",Bd. Tr. approval 1/25/73,
previous_attribution,1215,1,Sir Joshua Reynolds,"Reynolds, Sir Joshua",Attribution at time of gift,
previous_attribution,1218,1,Sir Peter Paul Rubens,"Rubens, Sir Peter Paul",Attribution at time of gift,
previous_attribution,1221,1,Follower of Titian,"Titian, Follower of",Bd. Tr. approval 5/5/1976,1976-05-05
previous_attribution,1221,2,Titian,Titian,Attribution at time of gift,1942
previous_attribution,1222,1,Titian,Titian,Attribution at time of gift,1942
previous_attribution,1237,2,Circle of Johannes Vermeer,"Vermeer, Johannes, Circle of",Bd. Tr. approval 5/3/78,
previous_attribution,1237,1,Johannes Vermeer,"Vermeer, Johannes",Attribution at time of gift,
previous_attribution,1240,1,John Singer Sargent,"Sargent, John Singer",,
previous_attribution,1241,2,German 16th Century,German 16th Century,Reported to Bd. Tr. 5/4/1983,1983-05-04
previous_attribution,1241,1,Baccio Bandinelli,"Bandinelli, Baccio",Attribution at time of gift,
previous_attribution,1242,1,Bartolomeo Bellano,"Bellano, Bartolomeo",Attribution at time of gift,
previous_attribution,1242,2,after Bartolomeo Bellano,"Bellano, Bartolomeo, after",Bd. Tr. approval 1/14/1981,
previous_attribution,1244,1,Attributed to Gregorio di Lorenzo (Probably Master of the Marble Madonnas),"Gregorio di Lorenzo, Attributed to (Probably Master of the Marble Madonnas)",Bd. Tr. approval 1/28/2010,2010-01-28
previous_attribution,1244,2,Giovanni Bastianini,"Bastianini, Giovanni",Bd. Tr. approval 10/10/1991,1991-10-10
previous_attribution,1244,3,Benedetto da Maiano,Benedetto da Maiano,Attribution at time of gift,1942      
previous_attribution,1245,1,Bolognese 15th Century,Bolognese 15th Century,Attribution at time of gift,
previous_attribution,1246,1,Benvenuto Cellini,"Cellini, Benvenuto",Attribution at time of gift,
previous_attribution,1247,1,Clodion,Clodion,Attribution at time of gift,
previous_attribution,1249,1,Antoine Coysevox,"Coysevox, Antoine",Attribution at time of acquistion,          
previous_attribution,1251,1,Desiderio da Settignano,Desiderio da Settignano,Attribution at time of acquisition,
previous_attribution,1253,1,Donatello,Donatello,Attribution at time of gift,
previous_attribution,1254,1,Donatello,Donatello,Attribution at time of gift,
previous_attribution,1256,1,Florentine 16th Century,Florentine 16th Century,Attribution at time of acquisition,
previous_attribution,1256,2,Florentine or Venetian 16th Century,Florentine or Venetian 16th Century,Change memo 11/4/1947,
previous_attribution,1258,2,Attributed to Francesco da Sant'Agata,"Francesco da Sant'Agata, Attributed to",Reported to Bd. Tr. 5/4/83,
previous_attribution,1258,1,Francesco da Sant'Agata,Francesco da Sant'Agata,Attribution at time of gift,
previous_attribution,1259,1,Paduan School (Manner of Francesco da Sant'Agata),Paduan School (Manner of Francesco da Sant'Agata),Attribution at time of gift,
previous_attribution,1260,1,Giovanni Bologna,"Bologna, Giovanni",Attribution at time of gift,
previous_attribution,1261,1,North Italian 16th Century,North Italian 16th Century,Reported to Bd. Tr. 5/4/1983,1983-05-04
previous_attribution,1261,2,Classicizing Artist,Classicizing Artist,"Original Kress Collection attribution reads ""Greek 4th Century B.C.""; attribution on original NGA accession card reads ""Classicizing Artist"".",1942-12-31
previous_attribution,1264,1,Jean-Antoine Houdon,"Houdon, Jean-Antoine",Attribution at time of gift,
previous_attribution,1265,1,Jean-Antoine Houdon,"Houdon, Jean-Antoine",Attribution at time of gift,
previous_attribution,1268,1,Italian 17th Century,Italian 17th Century,Attribution at time of gift,
previous_attribution,1269,1,Italian 17th Century,Italian 17th Century,Attribution at time of gift,
previous_attribution,1270,1,Florentine School,Florentine School,Attribution at time of gift,
previous_attribution,1271,1,North Italian School,North Italian School,Attribution at time of gift,
previous_attribution,1273,4,Master of the Marble Madonnas (Probably Gregorio di Lorenzo),Master of the Marble Madonnas (Probably Gregorio di Lorenzo),Bd. Tr. approval 1/28/2010; this change reflects current scholarship that identifies the Master of the Marble Madonnas as Gregorio di Lorenzo.,2010-01-28
previous_attribution,1273,3,Master of the Marble Madonnas,Master of the Marble Madonnas,Bd. Tr. approval 10/1/1987,          
previous_attribution,1273,2,Tommaso Fiamberti,"Fiamberti, Tommaso","This change, made 8/14/1964 in a memo (in the object file) from Perry Cott to John Walker, was termed an ""identification of the artist"", and the memo was annotated ""Trustee's approval not necessary"".  At the time, it was determined that the Master of the Marble Madonnas and Tommaso Fiamberti were the same person.  The 1987 change of attribution altered that opinion.",""
previous_attribution,1273,1,Master of the Marble Madonnas,Master of the Marble Madonnas,Attribution at time of gift,
previous_attribution,1276,2,North Italian 16th Century (Probably Leone Leoni),North Italian 16th Century (Probably Leone Leoni),Bd. Tr. approval 12/13/47,
previous_attribution,1276,3,North Italian 16th Century,North Italian 16th Century,Reported to Bd. Tr. 10/31/1985,
previous_attribution,1276,1,Paduan 16th Century,Paduan 16th Century,Attribution at time of gift,
previous_attribution,1277,1,Andrea Riccio,"Riccio, Andrea",Attribution at time of gift,
previous_attribution,1278,3,Attributed to Agostino Zoppo,"Zoppo, Agostino, Attributed to",Reported to Bd. Tr. 10/10/1991,          
previous_attribution,1278,2,Agostino Zoppo,"Zoppo, Agostino",Reported to Bd. Tr. 5/4/1983,          
previous_attribution,1278,1,Andrea Riccio,"Riccio, Andrea",Attribution at time of gift,
previous_attribution,1279,1,Andrea Riccio,"Riccio, Andrea",Attribution at time of gift,
previous_attribution,1281,1,Antonio Rossellino,"Rossellino, Antonio","Attribution at time of acquisition
",
previous_attribution,1282,1,Italian 16th Century,Italian 16th Century,Attribution at time of gift,
previous_attribution,1282,2,Venetian 17th Century,Venetian 17th Century,Reported to Bd. Tr. 10/4/84,
previous_attribution,1283,2,Venetian 17th Century,Venetian 17th Century,Reported to Bd. Tr. 10/4/84,
previous_attribution,1283,1,Italian 16th Century,Italian 16th Century,Attribution at time of gift,
previous_attribution,1284,1,Jacopo Sansovino,"Sansovino, Jacopo",Attribution at time of gift,
previous_attribution,1289,1,Paduan School,Paduan School,Attribution at time of gift,
previous_attribution,1299,1,Italian 15th Century,Italian 15th Century,Attribution at time of acquisition,""
previous_attribution,1300,1,Italian School,Italian School,Attribution at time of gift,
previous_attribution,1301,1,Italian School,Italian School,Attribution at time of gift,
previous_attribution,1312,1,Mantuan 15th Century,Mantuan 15th Century,Attribution at time of acquisition,""
previous_attribution,1313,1,Mantuan 15th Century,Mantuan 15th Century,Attribution at time of acquisition,""
previous_title,1335,2,Faustina,,Title at time of acquisition,
previous_attribution,1335,1,L' Antico,"Antico, L'",Attribution at time of acquisition,2009-10-27
previous_attribution,1336,1,L' Antico,"Antico, L'",Attribution at time of gift,
previous_attribution,1348,1,Donatello,Donatello,Attribution at time of acquisition,1942
previous_attribution,1349,1,Donatello,Donatello,Attribution at time of acquistion,1942
previous_attribution,1350,1,Donatello,Donatello,Attribution at time of acquisition,1942
previous_attribution,1351,1,Paduan 15th or 16th Century,Paduan 15th or 16th Century,Attribution at time of acquisition,1957
previous_attribution,1352,1,Donatello,Donatello,Attribution at time of acquistion,1942
previous_attribution,1354,1,Dutch School,Dutch School,Attribution at time of gift,
previous_attribution,1356,1,Style of Fiamingo,"Fiamingo, Style of",Attribution at time of gift,
previous_attribution,1358,1,Flemish School,Flemish School,Attribution at time of gift,
previous_attribution,1359,1,Flemish 16th Century,Flemish 16th Century,Attribution at time of gift,
previous_attribution,1360,1,Flemish 16th Century,Flemish 16th Century,Attribution at time of gift,
previous_attribution,1363,1,Florentine School,Florentine School,Attribution at time of gift,
previous_attribution,1364,1,German 16th Century,German 16th Century,Attribution at time of gift,
previous_attribution,1370,1,Master IO.F.F.,Master IO.F.F.,Attribution at time of gift,
previous_attribution,1380,1,Italian 16th Century,Italian 16th Century,Attribution at time of gift,
previous_attribution,1381,1,Italian 16th Century,Italian 16th Century,Attribution at time of gift,
previous_attribution,1384,1,Italian 16th Century,Italian 16th Century,Attribution at time of gift,
previous_attribution,1387,1,Italian 16th Century,Italian 16th Century,Attribution at time of gift,
previous_attribution,1388,1,Italian 16th Century,Italian 16th Century,Attribution at time of gift,
previous_attribution,1396,1,Lautizio da Perugia,Lautizio da Perugia,Attribution at time of gift,
previous_attribution,1397,1,Leone Leoni,"Leoni, Leone",Attribution at time of gift,
previous_attribution,1398,1,Master of the Orpheus Legend,Master of the Orpheus Legend,Attribution at time of acquisition,1942
previous_attribution,1408,1,Moderno,Moderno,Attribution at time of gift,
previous_attribution,1418,1,North Italian 16th Century,North Italian 16th Century,Attribution at time of gift,
previous_attribution,1422,1,Paduan School,Paduan School,Attribution at time of gift,
previous_attribution,1423,1,Paduan School,Paduan School,Attribution at time of gift,
previous_attribution,1434,2,after Master AvB (Arent van Bohlen),after Master AvB (Arent van Bohlen),Reported to Bd. Tr. 5/4/83,1983-05-04
previous_attribution,1434,1,after Paulus van Vianen I,after Paulus van Vianen I,Attribution at time of gift,
previous_attribution,1436,1,French 15th Century,French 15th Century,,
previous_attribution,1439,1,Limoges,Limoges,Attribution at time of gift,
previous_attribution,1440,2,Attributed to English 13th Century,"English 13th Century, Attributed to",Bd. Tr. approval 12/13/47,1947-12-13
previous_attribution,1440,1,Flemish (Dinant) 13th Century,Flemish (Dinant) 13th Century,Attribution at time of gift,
previous_attribution,1441,1,Mosan 13th Century,Mosan 13th Century,Attribution at time of gift,
previous_attribution,1442,3,Probably Rhenish and Mosan 12th Century,"Rhenish and Mosan 12th Century, Probably","Reported to Bd. Tr. 10/10/91; duplicate report, perhaps in error, to Bd. Tr. 10/4/90.",1991-10-10
previous_attribution,1442,2,Rhenish or Mosan 12th Century,Rhenish or Mosan 12th Century,Reported to Bd. Tr. 5/4/83,1983-05-04
previous_attribution,1442,1,Rhenish 12th Century,Rhenish 12th Century,"Attribution at time of gift; published in 1952 by NGA as ""Mosan 12th Century"", but no official change from Rhenish is recorded until 1983.",
previous_attribution,1443,1,Flemish 13th Century,Flemish 13th Century,Attribution at time of gift,
previous_attribution,1443,2,after Nicolas de Douai and Jacques de Nivelles,after Nicolas de Douai and Jacques de Nivelles,Reported to Bd. Tr. 5/4/1983,1983-05-04
previous_attribution,1445,1,Milanese 15th Century,Milanese 15th Century,Attribution at time of gift,
previous_attribution,1446,4,"German or Netherlandish or French 16th Century (shell cameo), Italian or German 16th Century (setting)","German or Netherlandish or French 16th Century (shell cameo), Italian or German 16th Century (setting)",Bd. Tr. approval 10/10/91,1991-10-10
previous_attribution,1446,2,Franco-Flemish 15th Century,Franco-Flemish 15th Century,Reported to Bd. Tr. 5/4/83,1983-05-04
previous_attribution,1446,1,Italian 15th Century,Italian 15th Century,Attribution at time of gift,
previous_attribution,1446,3,German or Netherlandish or French 16th Century,German or Netherlandish or French 16th Century,Bd. Tr. approval 10/4/90,1990-10-04
previous_attribution,1447,1,Milanese 16th Century,Milanese 16th Century,Attribution at time of gift,
previous_attribution,1447,2,Franco-Burgundian 15th Century,Franco-Burgundian 15th Century,Bd. Tr. approval 12/13/1947,1947-12-13
previous_attribution,1448,2,Jean Penicaud I,"Penicaud I, Jean",Bd. Tr. approval 5/2/73,1973-05-02
previous_attribution,1448,1,Léonard Pénicaud,"Pénicaud, Léonard",Attribution at time of gift,
previous_attribution,1450,1,Couly II Nouailher,"Nouailher, Couly II",Attribution at time of gift,
previous_attribution,1450,2,Attributed to Jean de Court,"Jean de Court, Attributed to",Reported to Bd. Tr. 5/4/83,1983-05-04
previous_attribution,1453,1,Jean Courteois,"Courteois, Jean",Attribution at time of gift,
previous_attribution,1454,2,Italian 16th Century (Style of Saracchi Workshop),Italian 16th Century (Style of Saracchi Workshop),Reported to Bd. Tr. 5/4/1983,1983-05-04
previous_attribution,1454,1,Italian 16th Century,Italian 16th Century,Attribution at time of gift,
previous_attribution,1455,1,Italian School,Italian School,Attribution at time of gift,
previous_attribution,1455,2,South German 17th Century,South German 17th Century,Bd. Tr. approval 9/26/1973,          
previous_attribution,1456,2,"South German 16th Century, Freiburg-im-Breisgau, and Augsburg","South German 16th Century, Freiburg-im-Breisgau, and Augsburg",Reported to Bd. Tr. 5/4/1983,1983-05-04
previous_attribution,1456,1,South German 16th Century,South German 16th Century,Attribution at time of gift,
previous_attribution,1457,2,"South German 16th Century, Freiburg-im-Breisgau","South German 16th Century, Freiburg-im-Breisgau",Reported to Bd. Tr. 5/4/1983,1983-05-04
previous_attribution,1457,1,Italian or German 16th Century,Italian or German 16th Century,Attribution at time of gift,
previous_attribution,1458,2,Milanese 16th Century,Milanese 16th Century,Reported to Bd. Tr. 5/4/1983,1983-05-04
previous_attribution,1458,1,Italian 16th Century,Italian 16th Century,Attribution at time of gift,
previous_attribution,1459,1,Italian 16th Century,Italian 16th Century,Attribution at time of acquisition,
previous_attribution,1459,2,"Italian, Probably Milanese, 16th Century","Italian, Probably Milanese, 16th Century",Reported to Bd. Tr. 5/4/1983,1983-05-04
previous_attribution,1460,1,Italian 16th Century,Italian 16th Century,Attribution at time of acquisition,
previous_attribution,1460,2,"Italian, probably Milanese, 16th Century","Italian, probably Milanese, 16th Century",Reported to Bd. Tr. 5/4/1983,
previous_attribution,1461,1,Italian 16th Century,Italian 16th Century,Title at time of acquisition,
previous_attribution,1462,2,Ferdinand Eusebius Miseroni,"Miseroni, Ferdinand Eusebius",Bd. Tr. approval 5/2/1973,
previous_attribution,1462,1,Italian 16th Century,Italian 16th Century,Attribution at time of gift,
previous_attribution,1463,1,English 16th Century,English 16th Century,Attribution at time of acquisition,
previous_attribution,1464,2,"Netherlandish 16th Century, probably Antwerp","Netherlandish 16th Century, probably Antwerp",Reported to Bd. Tr. 5/4/83,
previous_attribution,1464,1,Style of Benvenuto Cellini,"Cellini, Benvenuto, Style of",Attribution at time of gift,
previous_attribution,1466,2,North Italian 16th Century (Milanese ?),North Italian 16th Century (Milanese ?),Bd. Tr. approval 9/26/73,
previous_attribution,1466,1,Italian School,Italian School,Attribution at time of gift,
previous_attribution,1466,3,Italian 16th Century (Probably Milanese),Italian 16th Century (Probably Milanese),Reported to Bd. Tr. 5/4/83,
previous_attribution,1467,3,Netherlandish 16th Century,Netherlandish 16th Century,Reported to Bd. Tr. 5/4/83,
previous_attribution,1467,2,"North Italian 16th Century, Florentine (?)","North Italian 16th Century, Florentine (?)",Bd. Tr. approval 9/26/73,
previous_attribution,1467,1,Style of Benvenuto Cellini,"Cellini, Benvenuto, Style of",Attribution at time of gift,
previous_attribution,1468,2,South German 16th Century,South German 16th Century,Bd. Tr. approval 9/26/73,
previous_attribution,1468,1,Style of Benvenuto Cellini,"Cellini, Benvenuto, Style of",Attribution at time of gift,
previous_attribution,1469,3,South German 16th Century,South German 16th Century,Reported to Bd. Tr. 5/4/83,
previous_attribution,1469,2,Spanish (?),Spanish (?),Bd. Tr. approval 9/26/73,
previous_attribution,1469,1,Italian School,Italian School,Attribution at time of gift,
previous_attribution,1470,1,Italian School,Italian School,Attribution at time of gift,
previous_attribution,1470,2,Attributed to Italian or Spanish 16th Century,"Italian or Spanish 16th Century, Attributed to",Reported to Bd. Tr. 10/4/84,
previous_attribution,1471,1,Florentine 15th Century,Florentine 15th Century,Attribution at time of gift,
previous_attribution,1472,1,Florentine 15th Century,Florentine 15th Century,Attribution at time of gift,
previous_attribution,1473,2,Probably Urbino district 16th Century,"Urbino district 16th Century, Probably",Bd. Tr. approval 4/30/92,1992-04-30
previous_attribution,1473,3,Castel Durante,Castel Durante,Reported to Bd. Tr. 5/4/83,1983-05-04
previous_attribution,1473,1,Cafaggilio,Cafaggilio,Attribution at time of gift,
previous_attribution,1474,3,Probably Faentine or Venetian 16th Century,"Faentine or Venetian 16th Century, Probably",Bd. Tr. approval 4/30/1992,1992-04-30
previous_attribution,1474,1,Sienese 16th Century (Maestro Benedetto ?),Sienese 16th Century (Maestro Benedetto ?),Attribution at time of gift,
previous_attribution,1474,2,Faenza 16th Century,Faenza 16th Century,Reported to Bd. Tr. 5/4/1983,1983-05-04
previous_attribution,1475,1,Sienese 16th Century (Maestro Benedetto),Sienese 16th Century (Maestro Benedetto),Attribution at time of gift,
previous_attribution,1476,2,Probably Tuscan or Faentine 16th Century,"Tuscan or Faentine 16th Century, Probably",Bd. Tr. approval 4/30/1992,1992-04-30
previous_attribution,1476,1,Italian 16th Century,Italian 16th Century,Attribution at time of gift,
previous_attribution,1477,1,Italian 16th Century,Italian 16th Century,Attribution at time of gift,
previous_attribution,1478,1,Italian 16th Century,Italian 16th Century,Attribution at time of gift,
previous_attribution,1479,1,Italian 16th Century,Italian 16th Century,Attribution at time of gift,
previous_attribution,1480,1,Italian 16th Century,Italian 16th Century,Attribution at time of gift,
previous_attribution,1481,1,Italian 16th Century,Italian 16th Century,Attribution at time of gift,
previous_attribution,1482,1,Italian 16th Century,Italian 16th Century,Attribution at time of gift,
previous_attribution,1483,1,Italian 16th Century,Italian 16th Century,Attribution at time of gift,
previous_attribution,1484,1,Italian 16th Century,Italian 16th Century,Attribution at time of gift,
previous_attribution,1485,1,Italian 16th Century,Italian 16th Century,Attribution at time of gift,
previous_attribution,1486,1,Italian 16th Century,Italian 16th Century,Attribution at time of gift,
previous_attribution,1486,2,Probably workshop of Maestro Giorgio Andreoli of Gubbio,"Andreoli of Gubbio, Maestro Giorgio, Probably workshop of",Bd. Tr. approval 4/30/92,
previous_attribution,1487,2,Deruta 16th Century,Deruta 16th Century,Reported to Bd. Tr. 5/4/83,
previous_attribution,1487,1,"Gubbio 16th Century, Deruta influence","Gubbio 16th Century, Deruta influence",Attribution at time of gift,
previous_attribution,1488,1,Italian 16th Century,Italian 16th Century,Attribution at time of gift,
previous_attribution,1489,1,Salimbene di Pietro Andreoli (?),"Andreoli, Salimbene di Pietro, (?)",Attribution at time of gift,
previous_attribution,1489,2,Salimbene di Pietro Andreoli,"Andreoli, Salimbene di Pietro",Reported to Bd. Tr. 10/4/84,
previous_attribution,1490,1,Giorgio Andreoli,"Andreoli, Giorgio",Attribution at time of gift,
previous_attribution,1491,1,Giorgio Andreoli,"Andreoli, Giorgio",Attribution at time of gift,
previous_attribution,1492,1,Giorgio Andreoli,"Andreoli, Giorgio",Attribution at time of gift,
previous_attribution,1493,1,Giorgio Andreoli,"Andreoli, Giorgio",Attribution at time of gift,
previous_attribution,1494,2,Workshop of Maestro Giorgio Andreoli of Gubbio; painting attributed to the Painter of the Three Graces,"Andreoli of Gubbio, Maestro Giorgio, Workshop of; painting attributed to the Painter of the Three Graces",Bd. Tr. approval 4/30/92,1992-04-30
previous_attribution,1494,1,Giorgio Andreoli,"Andreoli, Giorgio",Attribution at time of gift,
previous_attribution,1495,1,Giorgio Andreoli,"Andreoli, Giorgio",Attribution at time of gift,
previous_attribution,1496,2,Nicola da Urbino or Follower of Nicola da Urbino,Nicola da Urbino or Follower of Nicola da Urbino,Reported to Bd. Tr. 5/4/83,1983-05-04
previous_attribution,1496,1,Gubbio 16th Century,Gubbio 16th Century,Attribution at time of gift,
previous_attribution,1496,3,"Attributed to Nicola da Urbino, or a follower or close associate; probably lustered in the workshop of Maestro Giorgio Andreoli of Gubbio","Nicola da Urbino, Attributed to, Follower of, or a close associate; probably lustered in the workshop of Maestro Giorgio Andreoli of Gubbio",Bd. Tr. approval 4/30/92,1992-04-30
previous_attribution,1497,1,Francesco Xanto Avelli,"Avelli, Francesco Xanto",Attribution at time of gift,
previous_attribution,1497,2,"Attributed to Francesco Xanto Avelli and a collaborator, in Urbino; probably lustered in the workshop of Maestro Giorgio Andreoli of Gubbio, or by Vincenzo Andreoli, Urbino","Xanto Avelli, Francesco, Attributed to, and a collaborator; probably lustered in the workshop of Maestro Giorgio Andreoli of Gubbio or by Vincenzo Andreoli, Urbino",Bd. Tr. approval 4/30/92,
previous_attribution,1498,2,Francesco Xanto Avelli or Follower of Francesco Xanto Avelli,"Avelli, Francesco Xanto or Follower of Francesco Xanto Avelli",Reported to Bd. Tr. 10/4/84,
previous_attribution,1498,1,Attributed to Francesco Xanto Avelli,"Xanto Avelli, Francesco, Attributed to",Attribution at time of gift,
previous_attribution,1499,1,Italian 16th Century,Italian 16th Century,Attribution at time of gift,
previous_attribution,1500,2,Gubbio 16th Century,Gubbio 16th Century,Reported to Bd. Tr. 5/4/83,
previous_attribution,1500,1,Urbino 16th Century,Urbino 16th Century,Attribution at time of gift,
previous_attribution,1501,2,Nicola da Urbino,Nicola da Urbino,Reported to Bd. Tr. 5/4/1983,1983-05-04
previous_attribution,1501,1,Faenza 16th Century,Faenza 16th Century,Attribution at time of gift,
previous_attribution,1502,2,North or Central Italian 16th Century,North or Central Italian 16th Century,Bd. Tr. approval 4/30/92,1992-04-30
previous_attribution,1502,1,Italian 16th Century,Italian 16th Century,Attribution at time of gift,
previous_attribution,1503,1,Castel Durante,Castel Durante,Attribution at time of gift,
previous_attribution,1503,2,Duchy of Urbino,Duchy of Urbino,Reported to Bd. Tr. 5/4/83,1983-05-04
previous_attribution,1504,2,Duchy of Urbino,Duchy of Urbino,Reported to Bd. Tr. 5/4/83,1983-05-04
previous_attribution,1504,1,Castel Durante,Castel Durante,Attribution at time of gift,
previous_attribution,1506,1,Urbino 16th Century (Guido Durantino of Urbino),Urbino 16th Century (Guido Durantino of Urbino),Attribution at time of gift,
previous_attribution,1507,2,Attributed to Francesco Durantino,"Durantino, Francesco, Attributed to",Reported to Bd. Tr. 5/4/83,1983-05-04
previous_attribution,1507,3,Urbino or Urbino district 16th Century,Urbino or Urbino district 16th Century,Bd. Tr. approval 4/30/92,1992-04-30
previous_attribution,1507,1,Urbino 16th Century,Urbino 16th Century,Attribution at time of gift,
previous_attribution,1508,1,Urbino 16th Century,Urbino 16th Century,Attribution at time of gift,
previous_attribution,1509,1,Italian 16th Century,Italian 16th Century,Attribution at time of gift,
previous_attribution,1510,1,Italian 16th Century,Italian 16th Century,Attribution at time of gift,
previous_attribution,1510,2,Probably Urbino district 16th Century,"Urbino district 16th Century, Probably",Bd. Tr. approval 4/30/92,1992-04-30
previous_attribution,1511,1,"French 16th Century, Saint-Porchaire","French 16th Century, Saint-Porchaire",Attribution at time of gift,
previous_attribution,1512,1,"French 16th Century, Saint-Porchaire","French 16th Century, Saint-Porchaire",Attribution at time of gift,
previous_attribution,1513,1,"French 16th Century, Saint-Porchaire","French 16th Century, Saint-Porchaire",Attribution at time of gift,
previous_attribution,1514,1,Italian 16th Century,Italian 16th Century,Attribution at time of gift,
previous_attribution,1515,1,Milanese (Paolo dei Negroli),Milanese (Paolo dei Negroli),Attribution at time of gift,
previous_attribution,1516,1,Venetian 16th Century (Paolo Rizzo),Venetian 16th Century (Paolo Rizzo),"Attribution at time of gift and written this way on 10/4/84 report to Bd. Tr.  Written as ""Paolo Rizzo (Venetian, Middle of XVI Century"" on 5/4/83 report to Bd. Tr.",
previous_attribution,1516,2,North Italian 16th Century,North Italian 16th Century,"Reported to Bd. Tr. twice, 5/4/83 and 10/4/84.  See remark for former attribution to Paolo Rizzo/Venetian.",
previous_attribution,1555,1,Florentine 14th Century,Florentine 14th Century,Attribution at time of gift,
previous_attribution,1559,1,Italian 15th Century,Italian 15th Century,Attribution at time of gift,
previous_attribution,1567,1,Attributed to Jean-Henri Riesener,"Riesener, Jean-Henri, Attributed to",Attribution at time of gift,
previous_attribution,1568,1,Jacques Caffieri,"Caffieri, Jacques",Attribution at time of gift,
previous_attribution,1571,1,Joseph and Jacques Caffieri,Joseph and Jacques Caffieri,Attribution at time of gift,
previous_attribution,1572,1,Joseph and Jacques Caffieri,Joseph and Jacques Caffieri,Attribution at time of gift,
previous_attribution,1573,2,Jean-François Oeben,"Oeben, Jean-François",Bd. Tr. approval 5/4/77,
previous_attribution,1573,1,Attributed to Jean-François Oeben,"Oeben, Jean-François, Attributed to",Attribution at time of gift,
previous_attribution,1575,1,Style of Charles Cressent,"Cressent, Charles, Style of",Bd. Tr. approval 10/1/1987,1987-10-01
previous_attribution,1575,2,French 18th Century,French 18th Century,Attribution at time of gift,
previous_attribution,1576,1,David Roentgen,"Roentgen, David",Attribution at time of gift,
previous_attribution,1577,1,Style of Jacques Caffieri,"Caffieri, Jacques, Style of",Attribution at time of gift,
previous_attribution,1578,1,Style of Jacques Caffieri,"Caffieri, Jacques, Style of",Attribution at time of gift,
previous_attribution,1579,1,Bernard van Risenburgh II,"Risenburgh II, Bernard van","Bd. Tr. approval 10/1/1987.  Revised designation of original Widener Collection attribution to ""Bernard van Risen Burgh II"".",1987-10-01
previous_attribution,1580,1,Bernard van Risenburgh II,"Risenburgh II, Bernard van","Bd. Tr. approval 10/1/1987.  Revised designation for original Widener Collection attribution of ""Bernard van Risen Burgh II"".",1987-10-01
previous_attribution,1581,1,French 18th Century,French 18th Century,Attribution at time of gift,
previous_attribution,1582,1,I. E.,"E., I.",Attribution at time of gift,
previous_attribution,1583,1,Early Louis XV,"Louis XV, Early",Attribution at time of gift,
previous_attribution,1584,1,Pierre Migeon II,"Migeon II, Pierre",Attribution at time of gift,
previous_attribution,1585,1,Louis XVI,Louis XVI,Attribution at time of gift,
previous_attribution,1586,1,French 18th Century,French 18th Century,Attribution at time of gift,
previous_attribution,1587,1,French 18th Century,French 18th Century,Attribution at time of gift,
previous_attribution,1588,1,French 18th Century,French 18th Century,Attribution at time of gift,
previous_attribution,1589,1,French 18th Century,French 18th Century,Attribution at time of gift,
previous_attribution,1590,1,French 18th Century,French 18th Century,Attribution at time of gift,
previous_attribution,1591,1,French 18th Century,French 18th Century,Attribution at time of gift,
previous_attribution,1592,1,French 18th Century,French 18th Century,Attribution at time of gift,
previous_attribution,1593,1,French 18th Century,French 18th Century,Attribution at time of gift,
previous_attribution,1594,1,French 18th Century,French 18th Century,Attribution at time of gift,
previous_attribution,1595,1,French 18th Century,French 18th Century,Attribution at time of gift,
previous_attribution,1596,1,French 18th Century,French 18th Century,Attribution at time of gift,
previous_attribution,1597,1,French 18th Century,French 18th Century,Attribution at time of gift,
previous_attribution,1598,1,French 18th Century,French 18th Century,Attribution at time of gift,
previous_attribution,1651,2,Isfahan or Kashan 17th Century,Isfahan or Kashan 17th Century,"Change memo 2/25/1985; did not require Bd. Tr. approval as it is an assignment to a more precise local school within the existing attribution to ""Persian"".",1985-02-25
previous_attribution,1651,1,Persian Imperial Manufactory,Persian Imperial Manufactory,Attribution at time of gift,
previous_attribution,1652,2,Isfahan or Kashan 17th Century,Isfahan or Kashan 17th Century,"Change memo 2/25/1985; did not require Bd. Tr. approval as it is an assignment to a more precise local school within the existing attribution to ""Persian"".",1985-02-25
previous_attribution,1652,1,Persian Imperial Manufactory,Persian Imperial Manufactory,Attribution at time of gift,
previous_attribution,1653,2,Lahore 17th Century,Lahore 17th Century,"Change memo 2/25/1985; did not require Bd. Tr. approval as it is an assignment to a more precise local school within the existing attribution to ""Indian"".",1998-02-25
previous_attribution,1653,1,Indian Imperial Manufactory,Indian Imperial Manufactory,Attribution at time of gift,
previous_attribution,1654,2,Attributed to Agra 17th Century,"Agra 17th Century, Attributed to","Change memo 2/25/1985; did not require Bd. Tr. approval as it is an assignment to a more precise local school within the existing attribution to ""Persian"".",0185-02-25
previous_attribution,1654,1,Persian 16th Century,Persian 16th Century,Attribution at time of gift,
previous_attribution,1654,3,Probably Agra 17th Century,"Agra 17th Century, Probably",Change memo 10/9/1991,1991-10-09
previous_attribution,1655,1,Persian 16th Century,Persian 16th Century,Attribution at time of gift,
previous_attribution,1655,2,Herat 17th Century,Herat 17th Century,"Change memo 2/25/1985; did not require Bd. Tr. approval as it is an assignment to a more precise local school within the existing attribution to ""Persian"".",2008-08-13
previous_attribution,1656,2,Kashan 16th Century,Kashan 16th Century,"Change memo 2/25/1985; did not require Bd. Tr. approval as it is an assignment to a more precise local school within the existing attribution to ""Persian"".",1985-02-25
previous_attribution,1656,1,Persian 16th Century,Persian 16th Century,Attribution at time of gift,
previous_attribution,1714,1,Chinese Ming Dynasty,Chinese Ming Dynasty,Attribution at time of gift,
previous_attribution,1767,1,Chinese Qing Dynasty,Chinese Qing Dynasty,Attribution at time of acquisition,
previous_attribution,1769,1,Chinese Qing Dynasty,Chinese Qing Dynasty,Attribution at time of acquisition,
previous_attribution,1788,1,Chinese Ming Dynasty,Chinese Ming Dynasty,Attribution at time of gift,
previous_attribution,1838,1,Rembrandt van Rijn,Rembrandt van Rijn,,
previous_attribution,1839,1,Rembrandt van Rijn,Rembrandt van Rijn,,
previous_attribution,1841,1,Rembrandt van Rijn,Rembrandt van Rijn,,
previous_attribution,1842,1,Rembrandt van Rijn,Rembrandt van Rijn,,
previous_attribution,1845,1,Rembrandt van Rijn,Rembrandt van Rijn,,
previous_attribution,1846,1,Rembrandt van Rijn,Rembrandt van Rijn,,
previous_attribution,1847,1,Rembrandt van Rijn,Rembrandt van Rijn,,
previous_attribution,1849,1,Rembrandt van Rijn,Rembrandt van Rijn,,
previous_attribution,1850,1,Rembrandt van Rijn,Rembrandt van Rijn,,
previous_attribution,1851,1,Rembrandt van Rijn,Rembrandt van Rijn,,
previous_attribution,1852,1,Rembrandt van Rijn,Rembrandt van Rijn,,
previous_attribution,1854,1,Rembrandt van Rijn,Rembrandt van Rijn,,
previous_attribution,1856,1,Rembrandt van Rijn,Rembrandt van Rijn,,
previous_attribution,1883,1,François Boucher,"Boucher, François",,
previous_title,2538,2,"Pierre-Isaac Poissonnier
",,,
previous_title,2628,2,Suite d'estampes pour servir à l'histoire des moeurs et du costume des Français dans le dix-huitième siècle : années 1774 (volume I),,,
previous_attribution,2990,1,"Alexandre Chaponniere after Jean-Baptiste Hüet, I","Chaponniere, Alexandre after Jean-Baptiste Hüet, I",,
previous_attribution,3154,1,"Greek, 4th Century B.C.","Greek, 4th Century B.C.",Attribution at time of gift,
previous_attribution,3154,2,Attributed to Hellenistic School,"Hellenistic School, Attributed to",Bd. Tr. approval 10/4/1990,          
previous_attribution,3155,1,Middle Rhenish,Middle Rhenish,Attribution at time of gift,
previous_attribution,3156,1,Upper Rhenish 15th Century,Upper Rhenish 15th Century,Attribution at time of gift,
previous_title,3192,2,La Salute: Dawn,,,
previous_attribution,3200,1,Flemish School 15th Century,Flemish School 15th Century,Attribution at time of gift,
previous_attribution,3201,1,Flemish School,Flemish School,Attribution at time of gift,
previous_attribution,3202,1,"Ludger tom Ring, the Elder",N/A,Attribution at time of gift,
previous_attribution,3204,1,Ralph Albert Blakelock,"Blakelock, Ralph Albert",Attribution at time of acquisition,
previous_attribution,3206,1,Attributed to Samuel King,"King, Samuel, Attributed to",Attribution at time of gift,
previous_attribution,3206,2,Artist Unknown,Artist Unknown,Bd. Tr. approval 4/30/69,1969-04-30
previous_attribution,3207,1,Attributed to Samuel King,"King, Samuel, Attributed to",Attribution at time of gift,
previous_attribution,3207,2,Artist Unknown,Artist Unknown,Bd. Tr. approval 4/30/69,1969-04-30
previous_attribution,3208,1,Samuel Finley Breese Morse,"Morse, Samuel Finley Breese",Attribution at time of gift,
previous_attribution,3208,2,Artist Unknown,Artist Unknown,Bd. Tr. approval 4/30/69,1969-04-30
previous_attribution,3209,1,Samuel Finley Breese Morse,"Morse, Samuel Finley Breese",Attribution at time of acquisition,
previous_attribution,3210,2,Artist Unknown,Artist Unknown,Bd. Tr. approval 4/30/69,1969-04-30
previous_attribution,3210,1,Attributed to John Neagle,"Neagle, John, Attributed to",Attribution at time of gift,
previous_attribution,3223,1,Honoré Daumier,"Daumier, Honoré",Attribution at time of gift,
previous_attribution,3418,1,Clifford Isaac Addams,"Addams, Clifford Isaac",,
previous_title,3420,2,Demolition,,,
previous_title,3426,3,Venice - Bridge with Procession,,,
previous_attribution,3434,1,Heinrich Aldegrever,"Aldegrever, Heinrich",,
previous_attribution,3445,1,Heinrich Aldegrever,"Aldegrever, Heinrich",,
previous_attribution,3446,1,Heinrich Aldegrever,"Aldegrever, Heinrich",,
previous_attribution,3651,1,after Andrea Mantegna,"Mantegna, Andrea, after",,
previous_attribution,3753,1,German 15th century,"","",          
previous_attribution,4092,1,after Barthel Beham,"Beham, Barthel, after",,
previous_attribution,4097,1,Barthel Beham,"Beham, Barthel",,
previous_title,4486,2,Anais II,,,
previous_title,4601,2,Flock of Ducks Landing,,,
previous_attribution,5145,1,Sir Muirhead Bone,"Bone, Muirhead, Sir",,
previous_attribution,5275,1,Attributed to Philip Galle after Pieter Bruegel the Elder,"Galle, Philip, Attributed to after Pieter Bruegel the Elder",attribution confirmed in Galle New Hollstein (2001),""
previous_attribution,5276,1,Attributed to Philip Galle after Pieter Bruegel the Elder,"Galle, Philip, Attributed to after Pieter Bruegel the Elder",attribution confirmed in Galle New Hollstein (2001),""
previous_attribution,5277,1,Attributed to Philip Galle after Pieter Bruegel the Elder,"Galle, Philip, Attributed to after Pieter Bruegel the Elder",attribution confirmed in Galle New Hollstein (2001),""
previous_attribution,5278,1,Attributed to Philip Galle after Pieter Bruegel the Elder,"Galle, Philip, Attributed to after Pieter Bruegel the Elder",attribution confirmed in Galle New Hollstein (2001),""
previous_attribution,5279,1,Attributed to Philip Galle after Pieter Bruegel the Elder,"Galle, Philip, Attributed to after Pieter Bruegel the Elder",attribution confirmed in Galle New Hollstein (2001),""
previous_attribution,5280,1,Attributed to Philip Galle after Pieter Bruegel the Elder,"Galle, Philip, Attributed to after Pieter Bruegel the Elder",attribution confirmed in Galle New Hollstein (2001),""
previous_attribution,5281,1,Attributed to Philip Galle after Pieter Bruegel the Elder,"Galle, Philip, Attributed to after Pieter Bruegel the Elder",attribution confirmed in Galle New Hollstein (2001),""
previous_title,5949,2,Senlis,,,
previous_attribution,5979,1,Hans Collaert,"Collaert, Hans",,
previous_attribution,6468,1,Theodor de Bry,"Bry, Theodor de",attribution changed 28 November 1994,
previous_attribution,6469,1,Theodor de Bry,"Bry, Theodor de",,
previous_attribution,6470,1,Theodor de Bry,"Bry, Theodor de",,
previous_attribution,6471,1,Theodor de Bry,"Bry, Theodor de",,
previous_attribution,6472,1,Jan Theodor de Bry after Barthel Beham,"Bry, Jan Theodor de after Barthel Beham",,
previous_attribution,6473,1,Jan Theodor de Bry after Barthel Beham,"Bry, Jan Theodor de after Barthel Beham",,
previous_attribution,6475,1,Jan Theodor de Bry after Barthel Beham,"Bry, Jan Theodor de after Barthel Beham",,
previous_attribution,6476,1,Jan Theodor de Bry after Barthel Beham,"Bry, Jan Theodor de after Barthel Beham",,
previous_attribution,6815,1,Attributed to Wolf Traut,"Traut, Wolf, Attributed to","attribution updated according to ""Hollstein's German Engravings, Etchings and Woodcuts, 1400-1700."" Vol. XCIV (Wolf Traut, Dieter Beaujean, author). Ouderkerk aan den Ijssel: Sound & Vision Publishers, 2019, no. 25.",""
previous_title,6817,2,"Hanns Dürer, Brother of Albrecht Dürer",,,
previous_attribution,6948,1,Jean-Louis Forain,"Forain, Jean-Louis",,
previous_attribution,7413,1,Valentine Green after Charles Willson Peale,"Green, Valentine after Charles Willson Peale",,
previous_attribution,7471,1,Francisco de Goya,"Goya, Francisco de",,
previous_attribution,7739,1,Erich Heckel,"Heckel, Erich",,
previous_attribution,7740,1,Erich Heckel,"Heckel, Erich",,
previous_title,7740,2,Dance,,,
previous_title,7748,3,Portrait of a Little Girl,,,
previous_title,7749,2,Merci,,,
previous_attribution,8001,1,Daniel Hopfer I,"Hopfer I, Daniel",,
previous_attribution,8003,1,"Daniel Hopfer, Hieronymus Hopfer","Hopfer, Daniel, Hieronymus Hopfer",,
previous_attribution,8003,2,Hieronymus Hopfer,"Hopfer, Hieronymus",,
previous_title,8114,2,Lady with Shawl,,,
previous_attribution,8698,1,Workshop of Andrea Mantegna or Attributed to Zoan Andrea,"Mantegna, Andrea, Workshop of or Attributed to Zoan Andrea",,
previous_attribution,8699,1,Andrea Mantegna,"Mantegna, Andrea",,
previous_attribution,8700,1,Attributed to Giovanni Antonio da Brescia,"Mantegna, Andrea, Workshop of or Attributed to Giovanni Antonio da Brescia",,
previous_attribution,8700,2,Workshop of Andrea Mantegna or Attributed to Giovanni Antonio da Brescia,"Mantegna, Andrea, Workshop of or Attributed to Giovanni Antonio da Brescia",,
previous_attribution,8701,1,Workshop of Andrea Mantegna or Attributed to Zoan Andrea,"Mantegna, Andrea, Workshop of or Attributed to Zoan Andrea",,
previous_attribution,8765,1,Master NAR,Master NAR,"Updated attribution to reflect research by Yvette Bruijnen. _Jan Rombouts: The Rediscovery of an Early Sixteenth Century Master in Louvain_. Turnhout, 2011.",""
previous_attribution,9157,1,Otto Mueller,"Müller, Otto",,
previous_attribution,9157,2,Otto Müller,"Müller, Otto",,
previous_title,9500,2,Bucks County Farm House,,,
previous_title,9501,2,House in the Pine Trees,,,
previous_title,9567,2,Cabaret of Ramponneau,,,
previous_attribution,9807,1,"Cornelis Ploos van Amstel (editor), and Johannes Kornlein (printmaker), after Gerrit Dou","Ploos van Amstel, Cornelis (editor), and Johannes Kornlein (printmaker), after Gerrit Dou",,
previous_title,10319,2,A Cotswold Farm,,,
previous_title,10327,2,Place des Victories,,,
previous_title,10328,2,"Les Baux, Provence",,,
previous_title,10329,2,L'Isle de la Cite,,,
previous_attribution,10438,1,Sir Frank Short after Peter De Wint,"Short, Frank, Sir after Peter De Wint",,
previous_title,10438,2,Cottage with Harvesters,,,
previous_title,10454,3,Moonlight on a River (Lucerne?),,,
previous_attribution,10454,1,Sir Frank Short after Joseph Mallord William Turner,"Short, Frank, Sir after Joseph Mallord William Turner",,
previous_attribution,10467,1,Virgil Solis,"Solis, Virgil",purchased by Lessing Rosenwald with misattribution (by Charles Sessler?) to Virgil Solis.,""
previous_attribution,10591,1,Tsuneo Tamagami,"Tamagami, Tsuneo",wrong attribution due to clerical error,""
previous_title,10610,2,McBey - Profile,,,
previous_title,10611,2,McBey - Full Face,,,
previous_attribution,10760,2,Sir Anthony van Dyck,"Dyck, Sir Anthony van","
",          
previous_attribution,10760,1,Anonymous Florentine 17th Century,Anonymous Florentine 17th Century,Bd. Tr. approval 11/14/49,1949-11-14
previous_attribution,10819,1,Isack van Ostade,"Ostade, Isack van",,
previous_title,10844,2,The Bull Ring,,,
previous_title,10847,2,"Arc San Carlo, Naples",,,
previous_attribution,10860,1,Hans Wechtlin I,"Wechtlin I, Hans",,
previous_title,10912,2,The Title to the French Set,,,
previous_title,10913,2,Reading in Bed,,,
previous_title,10933,2,"Astruc, A Literary Man",,,
previous_title,11048,3,La Salute: Dawn,,,
previous_title,11156,2,Drouet,,,
previous_title,11157,2,Drouet,,,
previous_title,11198,2,"Gabled Roofs, Vitre",,,
previous_title,11232,2,A Portrait - Miss Howells,,,
previous_title,11240,2,The Sunny Smith,,,
previous_title,11261,2,"Study - Mr. Thomas Way, No.I",,,
previous_title,11262,2,"Study - Mr. Thomas Way, No.II",,,
previous_title,11278,2,Sketch of Mr. Henley,,,
previous_attribution,11283,1,James McNeill Whistler,"Whistler, James McNeill",,
previous_attribution,11285,1,James McNeill Whistler,"Whistler, James McNeill",,
previous_title,11285,2,"Count Robert de Montesquiou, No.III",,,
previous_title,11289,2,Sketch - Grand Rue Dieppe,,,
previous_title,11290,2,Sketch - Grand Rue Dieppe,,,
previous_title,11299,2,Nude Figure Seated,,,
previous_attribution,11308,1,James McNeill Whistler,"Whistler, James McNeill",,
previous_attribution,11309,1,James McNeill Whistler,"Whistler, James McNeill",,
previous_attribution,11310,1,James McNeill Whistler,"Whistler, James McNeill",,
previous_attribution,11319,1,James McNeill Whistler,"Whistler, James McNeill",,
previous_attribution,11353,1,Luca Giordano,"Giordano, Luca",,
previous_attribution,11354,1,Daniele Ricciarelli,"Ricciarelli, Daniele",,
previous_attribution,11355,1,Pontormo,Pontormo,,
previous_attribution,11358,1,Polidoro da Caravaggio,Polidoro da Caravaggio,,
previous_attribution,11359,1,Francesco Primaticcio,"Primaticcio, Francesco",,
previous_attribution,11360,1,Luca Cambiaso,"Cambiaso, Luca",,
previous_attribution,11361,1,Federico Zuccari,"Zuccari, Federico",,
previous_attribution,11363,1,Marten de Vos,"Vos, Marten de",,
previous_attribution,11364,1,Simon Vouet,"Vouet, Simon",,
previous_attribution,11365,1,Pietro da Cortona,"Cortona, Pietro da",,
previous_attribution,11367,1,Lodovico Carracci,"Carracci, Lodovico",approved 2/27/61,
previous_attribution,11367,1,French 17th Century,French 17th Century,,
previous_attribution,11369,1,Baldassare Peruzzi,"Peruzzi, Baldassare",,
previous_attribution,11371,1,Lucio Massari,"Massari, Lucio",,
previous_attribution,11373,1,Giovanni Antonio Pordenone,"Pordenone, Giovanni Antonio",,
previous_attribution,11374,1,Frans Floris I,"Floris I, Frans",,
previous_attribution,11375,1,Maerten van Heemskerck,"Heemskerck, Maerten van",,
previous_attribution,11376,1,Girolamo Muziano,"Muziano, Girolamo",,
previous_attribution,11378,1,Prospero Fontana,"Fontana, Prospero",,
previous_attribution,11379,1,Flemish 17th Century,Flemish 17th Century,,
previous_attribution,11380,1,Francesco Solimena,"Solimena, Francesco",,
previous_attribution,11381,1,Francesco Solimena,"Solimena, Francesco",,
previous_attribution,11382,1,Italian 16th Century,Italian 16th Century,,
previous_attribution,11383,1,Carlo Saraceni,"Saraceni, Carlo",,
previous_attribution,11386,1,Bernardo Castello,"Castello, Bernardo",,
previous_attribution,11387,1,Abraham van Diepenbeeck,"Diepenbeeck, Abraham van",,
previous_attribution,11388,1,Attributed to Pirro Ligorio,"Ligorio, Pirro, Attributed to",,
previous_attribution,11389,1,Gasparo Massi,"Massi, Gasparo",,
previous_attribution,11390,1,Gasparo Massi,"Massi, Gasparo",,
previous_attribution,11391,1,il Cigoli,"Cigoli, il",,
previous_attribution,11392,1,Domenico Ghirlandaio,"Ghirlandaio, Domenico",,
previous_attribution,11394,1,Flemish 16th Century,Flemish 16th Century,,
previous_attribution,11396,1,Annibale Carracci,"Carracci, Annibale",,
previous_attribution,11397,1,Flemish 16th Century,Flemish 16th Century,,
previous_attribution,11398,1,Parmigianino,Parmigianino,,
previous_attribution,11399,1,Luca Cambiaso,"Cambiaso, Luca",,
previous_attribution,11403,1,Andrea Boscoli,"Boscoli, Andrea",,
previous_title,11434,2,House in the Trees,,,
previous_title,11925,2,Cornelia van de Capelle,,,
previous_attribution,12099,2,Style of Andrea del Verrocchio,"Verrocchio, Andrea del, Style of","Bd. Tr. approval 1/9/1964
",
previous_attribution,12099,1,Andrea del Verrocchio,"Verrocchio, Andrea del",Attribution at time of gift,
previous_attribution,12102,1,Sassetta,Sassetta,Attribution at time of gift,
previous_attribution,12102,2,Attributed to Sassetta,"Sassetta, Attributed to","Bd. Tr. approval 1/9/1964
",
previous_attribution,12103,2,Attributed to Sassetta,"Sassetta, Attributed to","Bd. Tr. approval 1/9/1964
 
",
previous_attribution,12103,1,Sassetta,Sassetta,Attribution at time of gift,
previous_attribution,12118,1,"""Ugolino Lorenzetti""","Lorenzetti, Ugolino",Bd. Tr. approval 1/9/64,1964-01-09
previous_attribution,12118,2,Pietro Lorenzetti,"Lorenzetti, Pietro",Attribution at time of gift,1943
previous_attribution,12135,1,Giovanni Bellini,"Bellini, Giovanni","Attribution at time of acquisition
",
previous_attribution,12139,1,Ercole de' Roberti,"Roberti, Ercole de'",Attribution at time of gift,
previous_attribution,12139,2,Attributed to Baldassare d'Este,"Baldassare d'Este, Attributed to","Bd. Tr. approval 1/9/1964
",
previous_attribution,12143,1,Master of the Life of Saint John the Baptist,Master of the Life of Saint John the Baptist,"This change appears not to have been passed by the Bd. Tr.; memos in the object file indicate John Walker directed the change be made in December 1956, and the change was finalized by June 1957.",1957-06-01
previous_attribution,12143,2,Giovanni Baronzio,"Baronzio, Giovanni",Attribution at time of gift,1943
previous_attribution,12145,1,Botticelli,Botticelli,Attribution at time of gift,
previous_attribution,12170,1,Pietro Lombardo,"Lombardo, Pietro",Attribution at time of acquisition,
previous_attribution,12172,1,Antonio del Pollaiuolo,"Pollaiuolo, Antonio del",Attribution at time of gift,
previous_attribution,12173,2,Florentine 16th Century,Florentine 16th Century,Bd. Tr. approval 5/5/1976,1976-05-05
previous_attribution,12173,1,Benedetto da Maiano,Benedetto da Maiano,Attribution at time of gift,
previous_attribution,12175,1,Giovanni Antonio Amadeo,"Amadeo, Giovanni Antonio",Attribution at time of gift,
previous_attribution,12176,1,Antonio Rossellino,"Rossellino, Antonio",Attribution at time of gift,
previous_attribution,12178,1,Mino da Fiesole,Mino da Fiesole,Attribution at time of gift,
previous_attribution,12179,1,Andrea del Verrocchio,"Verrocchio, Andrea del",Attribution at time of gift,
previous_attribution,12180,1,Matteo Civitali,"Civitali, Matteo",Attribution at time of gift,
previous_attribution,12181,1,Donatello,Donatello,Attribution at time of gift,
previous_attribution,12182,1,Leone Leoni,"Leoni, Leone",Attribution at time of gift,
previous_attribution,12183,3,Attributed to Jacopo Albarelli,"Albarelli, Jacopo, Attributed to",Reported to Bd. Tr. 10/1/1987,
previous_attribution,12183,1,Alessandro Vittoria,"Vittoria, Alessandro",Attribution at time of gift,
previous_attribution,12183,2,Venetian 16th or 17th Century (Jacopo Albarelli ?),Venetian 16th or 17th Century (Jacopo Albarelli ?),Bd. Tr. approval 10/4/1984,
previous_attribution,12184,1,Germain Pilon,"Pilon, Germain",Attribution at time of gift,
previous_attribution,12185,2,after Gian Lorenzo Bernini,"Bernini, Gian Lorenzo, after",Bd. Tr. approval 1/19/1971,1971-01-19
previous_attribution,12185,1,Gian Lorenzo Bernini,"Bernini, Gian Lorenzo",Attribution at time of gift,
previous_attribution,12186,2,Jacques Prou II,"Prou II, Jacques",Letter to Kress Foundation 11/30/1955 requesting approval for attribution and title change was approved by Mario Modestini; there appears to have been no Bd. Tr. action on the attribution change.  Published with this attribution in the 1959 NGA/Kress catalogue.,1955-11-30
previous_attribution,12186,1,Antoine Coysevox,"Coysevox, Antoine",Attribution at time of gift,
previous_attribution,12189,1,"Florentine 15th or 16th Century, probably after a model by Andrea del Verrocchio and Orsino Benintendi","Florentine 15th or 16th Century, probably after a model by Andrea del Verrocchio and Orsino Benintendi",Bd. Tr. approval 5/1/1997,1997-05-01
previous_attribution,12189,2,Andrea del Verrocchio,"Verrocchio, Andrea del",Attribution at time of acquisition,
previous_attribution,12190,1,Lorenzo Ghiberti,"Ghiberti, Lorenzo",Attribution at time of gift,
previous_attribution,12201,1,Jean Siméon Chardin,"Chardin, Jean Siméon",Attribution at time of gift,
previous_attribution,12203,1,Hubert Drouais,"Drouais, Hubert","Attribution at time of acquisition
",
previous_attribution,12205,1,Jan van Hemessen,"Hemessen, Jan van",Attribution at time of gift,
previous_attribution,12207,1,Sir Peter Paul Rubens,"Rubens, Peter Paul, Sir","Attribution at time of acquisition
",
previous_attribution,12208,1,Jacopo Tintoretto,"Tintoretto, Jacopo",Attribution at time of acquisition,1943
previous_attribution,12210,1,American 20th Century,American 20th Century,,
previous_attribution,12241,1,E.J. Bird,"Bird, E.J.",,
previous_attribution,12252,1, ,,,
previous_attribution,12365,1,Vera Van Voris,,,
previous_attribution,12444,1,James Vail,"Vail, James",,
previous_attribution,12566,1,James Vail,"Vail, James",,
previous_attribution,12650,1,Marion Curtiss,"Curtiss, Marion",,
previous_attribution,12981,1,Marion Curtiss,"Curtiss, Marion",,
previous_attribution,13101,1,Marion Curtiss,"Curtiss, Marion",,
previous_attribution,15081,1,Marion Curtiss,"Curtiss, Marion",,
previous_attribution,15113,1,Marion Curtiss,"Curtiss, Marion",,
previous_attribution,15119,1,Marion Curtiss,"Curtiss, Marion",,
previous_attribution,15122,1,Marion Curtiss,"Curtiss, Marion",,
previous_attribution,15124,1,Marion Curtiss,"Curtiss, Marion",,
previous_attribution,15349,1,Marion Curtiss,"Curtiss, Marion",,
previous_attribution,15505,1,Marion Curtiss,"Curtiss, Marion",,
previous_title,15522,2,Mourning Picture,,,
previous_attribution,16404,1,Mario De Ferrante,"De Ferrante, Mario",,
previous_attribution,17754,1,Mario De Ferrante,"De Ferrante, Mario",,
previous_title,17933,2,Serving and Work Table,,,
previous_attribution,17973,1,Mario De Ferrante,"De Ferrante, Mario",,
previous_attribution,18130,1,Mario De Ferrante,"De Ferrante, Mario",,
previous_attribution,18396,1,Randolph Atkinson,"Atkinson, Randolph",,
previous_attribution,19989,1,"Edward DiGennero, Michael Lauretano","DiGennero, Edward, Michael Lauretano",,
previous_title,20303,2,Figurehead,,,
previous_attribution,20487,1,Marion Curtiss,"Curtiss, Marion",,
previous_title,20834,2,Bell Jar,,,
previous_attribution,20972,1,Angelo Bulone,"Bulone, Angelo",,
previous_attribution,20972,2,American 20th Century,American 20th Century,,
previous_attribution,21067,1,Mario De Ferrante,"De Ferrante, Mario",,
previous_attribution,21619,1,Robert Clark,"Clark, Robert",,
previous_attribution,21622,1,"Stanley Mazur, Olof Krans","Mazur, Stanley, Olof Krans",,
previous_attribution,21624,1,"Orrie McCombs, Olof Krans","McCombs, Orrie, Olof Krans",,
previous_attribution,21625,1,"John Koehl, Olof Krans","Koehl, John, Olof Krans",,
previous_attribution,21625,2,John Koehl,"Koehl, John",,
previous_title,21675,2,"Knife, Fork, and Spoon",,,
previous_attribution,24432,1,Mario De Ferrante,"De Ferrante, Mario",,
previous_attribution,24460,1,Mario De Ferrante,"De Ferrante, Mario",,
previous_title,25328,2,Apothecary's Pill Holder,,,
previous_attribution,26433,1,Mario De Ferrante,"De Ferrante, Mario",,
previous_attribution,27563,1,Marion Curtiss,"Curtiss, Marion",,
previous_attribution,27635,1,American 20th Century,American 20th Century,,
previous_attribution,28074,1,"Edward DiGennero, Michael Lauretano","DiGennero, Edward, Michael Lauretano",,
previous_attribution,28074,2,Edward DiGennero,"DiGennero, Edward",,
previous_attribution,28895,1,American 20th Century,American 20th Century,,
previous_attribution,29512,1,Marion Curtiss,"Curtiss, Marion",,
previous_attribution,30074,1,American 20th Century,American 20th Century,,
previous_attribution,30212,1,Honoré Daumier,"Daumier, Honoré",Attribution at time of gift,
previous_attribution,30212,2,Follower of Honoré Daumier,"Daumier, Honoré, Follower of",Bd. Tr. approval 1/25/1973,
previous_attribution,30218,1,James McNeill Whistler,"Whistler, James McNeill",Attribution at time of gift,
previous_attribution,30599,1,Robert Havell after John James Audubon,"Havell, Robert after John James Audubon",,
previous_attribution,30654,1,Nicolas Lancret,"Lancret, Nicolas",,
previous_title,30657,2,The Honorable Seth Hastings,,,
previous_title,30679,3,Apocalypse,,,
previous_attribution,32586,2,Follower of Canaletto,"Canaletto, Follower of","Bd. Tr. approval 1/21/1948
",
previous_attribution,32586,3,Venetian 18th Century,Venetian 18th Century,"Bd. Tr. approval 1/27/1994
",
previous_attribution,32586,1,Canaletto,Canaletto,Attribution at time of gift,
previous_attribution,32587,3,Venetian 18th Century,Venetian 18th Century,"Bd. Tr. approval 1/27/1994
",
previous_attribution,32587,1,Canaletto,Canaletto,Attribution at time of gift,
previous_attribution,32587,2,Follower of Canaletto,"Canaletto, Follower of","Bd. Tr. approval 1/21/1948
",
previous_attribution,32632,1,Sallenbach,Sallenbach,,
previous_attribution,32688,1,Jean Siméon Chardin,"Chardin, Jean Siméon",Attribution at time of gift,
previous_attribution,32690,1,Claude Lorrain,Claude Lorrain,"Attribution at time of acquisition
",
previous_attribution,32695,1,Antoine Watteau,"Watteau, Antoine",Attribution at time of gift,
previous_title,32733,2,William Henry Harrison: 9th President of the United States,,,
previous_title,32734,2,William Penn's Treaty with the Indians,,,
previous_title,32997,3,Album of Prints after Chardin,,,
previous_attribution,33246,2,School of Alessandro Longhi,"Longhi, Alessandro, School of",Bd. Tr. approval 5/4/48,
previous_attribution,33246,1,English School,English School,Attribution at time of gift,
previous_attribution,33261,1,Netherlandish 15th Century,Netherlandish 15th Century,,
previous_attribution,33265,1,Netherlandish 15th Century,Netherlandish 15th Century,Attribution at time of acquisition,""
previous_attribution,33266,1,Workshop of Limbourg Brothers,"Limbourg Brothers, Workshop of",,
previous_attribution,33268,1,Italian 13th Century,Italian 13th Century,,
previous_attribution,33269,1,Italian 14th Century,Italian 14th Century,,
previous_title,33563,2,Nassau Hall from Chancellor Green,,,
previous_title,33708,2,Figure Study,,,
previous_attribution,33747,1,Abraham Storck,"Storck, Abraham",Attribution at time of gift,
previous_attribution,33747,3,Style of Hendrick van Anthonissen,"Anthonissen, Hendrick van, Style of",Change memo 11/14/1983,          
previous_attribution,33747,2,Circle of Hendrick van Anthonissen,"Anthonissen, Hendrick van, Circle of",Bd. Tr. approval 1/19/1965,          
previous_attribution,33757,1,Jacopo Tintoretto,"Tintoretto, Jacopo",Attribution at time of acquisition,1947
previous_title,33766,2,"Prayer Meeting, No.2",,,
previous_title,33768,3,"Phaeton, or Chariot I",,,
previous_title,33818,4,The Pony,,"As per June Hargrove on 6/8/2021, work should not be titled ""The Pony""",
previous_attribution,33961,1,Rembrandt Peale,"Peale, Rembrandt",Attribution at time of gift,
previous_attribution,33962,1,Rembrandt Peale,"Peale, Rembrandt",Attribution at time of gift,
previous_attribution,33964,1,Thomas Gainsborough,"Gainsborough, Thomas",,
previous_attribution,34049,2,American School (?),American School (?),Bd. Tr. approval 5/6/1964,""
previous_attribution,34049,1,John James Audubon (?),"Audubon, John James, (?)","Attribution at time of gift.  1980 American painting summary catalogue publishes the original attribution without the ""?"", but the accession card and other documents in the object indicate that the attribution was questioned at the time of the gift.",
previous_attribution,34053,1,Charles Loring Elliott,"Elliott, Charles Loring",Attribution at time of gift,
previous_attribution,34057,1,William Sidney Mount,"Mount, William Sidney",Attribution at time of acquisition,
previous_attribution,34058,2,Rembrandt Peale (?),"Peale, Rembrandt (?)",Bd. Tr. approval 4/30/69,1969-04-30
previous_attribution,34058,1,Charles Willson Peale,"Peale, Charles Willson",Attribution at time of gift,
previous_attribution,34063,4,Anonymous Unknown Nationality 18th Century,Anonymous Unknown Nationality 18th Century,Change memo 11/14/83,1983-11-14
previous_attribution,34063,2,English School (?),English School (?),"Bd. Tr. approval 4/30/69; list reads ""Artist Unknown"", but original change proposal was annotated by W.P. Campbell to read ""English School (?), mid-eighteenth century"".",1969-04-30
previous_attribution,34063,1,John Hesselius,"Hesselius, John",Attribution at time of gift,
previous_attribution,34063,5,Attributed to British 18th Century,"British 18th Century, Attributed to",Bd. Tr. approval 10/5/89,1989-10-05
previous_attribution,34063,3,American School (?),American School (?),This attribution assigned at an unknown date.,
previous_attribution,34067,2,American School (?),American School (?),Bd. Tr. approval 5/6/1964,""
previous_attribution,34067,1,Washington Allston,"Allston, Washington",Attribution at time of gift,
previous_attribution,34067,3,European 19th Century,European 19th Century,"Changed to this attribution on unknown date, per accession card and notation on 1964 change proposal.",
previous_attribution,34069,1,Joseph Alexander Ames,"Ames, Joseph Alexander",Attribution at time of gift,
previous_attribution,34070,2,American School (?),American School (?),"Bd. Tr. approval 4/30/69; list reads ""Artist Unknown"", but original change proposal was annotated by W.P. Campbell to read ""American School (?), second quarter 18th century"".",1969-04-30
previous_attribution,34070,3,Anonymous Unknown Nationality 18th Century,Unknown 18th Century,Change memo 11/14/83,1983-11-14
previous_attribution,34070,1,Joseph Badger,"Badger, Joseph",Attribution at time of gift,
previous_attribution,34070,4,Attributed to British 18th Century,"British 18th Century, Attributed to",Bd. Tr. approval 10/5/89,1989-10-05
previous_attribution,34072,1,Henry Benbridge,"Benbridge, Henry",Attribution at time of gift,
previous_attribution,34074,4,Anonymous Unknown Nationality 18th Century,Anonymous Unknown Nationality 18th Century,Change memo 11/14/1983,1983-11-14
previous_attribution,34074,1,Charles Bridges,"Bridges, Charles",Attribution at time of gift,
previous_attribution,34074,2,School of Sir Godfrey Kneller,"Kneller, Sir Godfrey, School of",Bd. Tr. approval 5/6/1964,1964-05-06
previous_attribution,34074,3,Unknown European 18th Century,Unknown European 18th Century,5/6/1964 change of attribution became Unknown European 18th Century,1964-05-06
previous_attribution,34075,1,Charles Bridges,"Bridges, Charles",Attribution at time of gift,
previous_attribution,34075,4,Unknown Nationality 18th Century,Unknown Nationality 18th Century,Change memo10/5/89,1989-10-05
previous_attribution,34075,2,School of Sir Godfrey Kneller,"Kneller, Sir Godfrey, School of","Bd. Tr. approval 4/30/69; list reads ""Artist Unknown"", but original change proposal was annotated by W.P. Campbell to read ""School of Kneller, British (1646-1723)"".",1969-04-30
previous_attribution,34075,3,American School (?),American School (?),This attribution assigned at an unknown date.,
previous_attribution,34077,2,Attributed to Mather Brown,"Brown, Mather, Attributed to",Bd. Tr. approval 4/30/69,
previous_attribution,34077,1,Mather Brown,"Brown, Mather",Attribution at time of gift,
previous_attribution,34079,2,American School (?),American School (?),"Bd. Tr. approval 4/30/69; list reads ""Artist Unknown"", but original change proposal was annotated by W.P. Campbell twice, first to read ""English School, mid 18th century"", then to read ""American (?)"".",
previous_attribution,34079,1,James Claypoole,"Claypoole, James",Attribution at time of gift,
previous_attribution,34079,3,Anonymous Unknown Nationality 18th Century,Anonymous Unknown Nationality 18th Century,Change memo 11/14/83,
previous_attribution,34079,4,Attributed to British 18th Century,"British 18th Century, Attributed to",Bd. Tr. approval 5/4/89,
previous_attribution,34080,2,European 18th Century,European 18th Century,"Bd. Tr. approval 4/30/69; original change proposal was annotated by W.P. Campbell to read ""British School"", but another marginal note reads ""filed 'European'"", list reads ""European of Unknown Nationality"" and existing attribution on 11/14/83 memo reads ""Unknown European 18th C."".",
previous_attribution,34080,1,John Singleton Copley,"Copley, John Singleton",Attribution at time of gift,
previous_attribution,34081,1,Henri Couturier,"Couturier, Henri",Attribution at time of gift,
previous_attribution,34081,2,European 18th Century,European 18th Century,Bd. Tr. approval 4/30/69,
previous_attribution,34082,3,Unknown 17th Century,Unknown 17th Century,Change memo 11/14/1983,
previous_attribution,34082,1,Henri Couturier,"Couturier, Henri",Attribution at time of gift,
previous_attribution,34082,2,European 17th Century,European 17th Century,Bd. Tr. approval 4/30/1969,1969-04-30
previous_attribution,34083,2,American School (?),American School (?),Bd. Tr. approval 5/6/64,
previous_attribution,34083,1,Abraham Delanoy,"Delanoy, Abraham",Attribution at time of gift,
previous_attribution,34084,1,William Dunlap,"Dunlap, William",Attribution at time of acquisition,
previous_attribution,34085,1,Asher Brown Durand,"Durand, Asher Brown",Attribution at time of gift,
previous_attribution,34086,2,European 18th Century,European 18th Century,Bd. Tr. approval 4/30/69,
previous_attribution,34086,1,Evert Duyckinck I,"Duyckinck I, Evert",Attribution at time of gift,
previous_attribution,34087,3,Anonymous Unknown Nationality 18th Century,Anonymous Unknown Nationality 18th Century,Change memo 11/14/83,
previous_attribution,34087,2,European 18th Century,European 18th Century,"Bd. Tr. approval 4/30/69; original change proposal was annotated by W.P. Campbell twice, first to read ""American School (?), first quarter 18th century"", then ""European of indeterminate origin, c. 1700"".",
previous_attribution,34087,1,Evert Duyckinck III,"Duyckinck III, Evert",Attribution at time of gift,
previous_attribution,34088,1,Gerardus Duyckinck,"Duyckinck, Gerardus",Attribution at time of gift,
previous_attribution,34088,2,European 18th Century,European 18th Century,Bd. Tr. approval 4/30/69,
previous_attribution,34089,3,American School (?),American School (?),This attribution assigned at an unkown date.,
previous_attribution,34089,2,School of Sir Godfrey Kneller,"Kneller, Sir Godfrey, School of","Bd. Tr. approval 4/30/69; list reads ""Artist Unknown"", but original change proposal was annotated by W.P. Campbell twice, first to read ""American School (?), first third 18th century"", then ""School of Kneller, British, 1646-1723"".",
previous_attribution,34089,1,Gerrit Duyckinck,"Duyckinck, Gerrit",Attribution at time of gift,
previous_attribution,34089,5,Attributed to British 18th Century,"British 18th Century, Attributed to",Bd. Tr. approval 10/5/89,
previous_attribution,34089,4,Anonymous Unknown Nationality 18th Century,Anonymous Unknown Nationality 18th Century,"Change memo 11/14/83; list reads ""17th Century"", but this was a mistaken assignment to match the date of a false inscription; error was corrected and attribution changed to 18th Century in 1986.",
previous_attribution,34091,1,Edward Truman,"Truman, Edward",Attribution at time of gift,
previous_attribution,34091,3,Anonymous Unknown Nationality 18th Century,Anonymous Unknown Nationality 18th Century,Change memo 11/14/83,
previous_attribution,34091,2,American School (?),American School (?),"Bd. Tr. approval 4/30/69; list reads ""Artist Unknown"", but original change proposal was annotated to indicate that the painting was published under the ""American (?)"" section of the catalogue.",
previous_attribution,34092,1,Ralph Earl,"Earl, Ralph",Attribution at time of gift,
previous_attribution,34094,1,John Vanderlyn,"Vanderlyn, John",Attribution at time of gift,
previous_attribution,34095,2,European 18th Century,European 18th Century,Bd. Tr. approval 4/30/69,
previous_attribution,34095,1,Nathaniel Emmons,"Emmons, Nathaniel",Attribution at time of gift,
previous_attribution,34096,1,Robert Feke,"Feke, Robert",Attribution at time of gift,
previous_attribution,34096,2,American School (?),American School (?),"Bd. Tr. approval 4/30/69; list reads ""Artist Unknown"", but original change proposal was annotated by W.P. Campbell to read ""American School (?), third quarter 18th century"".",
previous_attribution,34097,1,Robert Feke,"Feke, Robert",Attribution at time of gift,
previous_attribution,34099,1,Robert Fulton,"Fulton, Robert",Attribution at time of gift,
previous_attribution,34100,2,American 19th Century,American 19th Century,"Bd. Tr. approval 4/30/69; list reads ""Artist Unknown"", but original change proposal was annotated by W.P. Campbell to read ""American School (?), about 1810"".",
previous_attribution,34100,1,Robert Fulton,"Fulton, Robert",Attribution at time of gift,
previous_attribution,34101,2,American 19th Century,American 19th Century,"Bd. Tr. approval 4/30/69; list reads ""Artist Unknown"", but original change proposal was annotated by W.P. Campbell to read ""American School (?), about 1810"".",
previous_attribution,34101,1,Robert Fulton,"Fulton, Robert",Attribution at time of gift,
previous_attribution,34103,2,"Artist Unknown, copy after Robert M. Sully","Artist Unknown, copy after Robert M. Sully",Bd. Tr. approval 4/30/69,1969-04-30
previous_attribution,34103,1,James Herring,"Herring, James",Attribution at time of gift,
previous_attribution,34106,1,Henry Inman,"Inman, Henry",Attribution at time of gift,
previous_attribution,34107,1,Henry Inman,"Inman, Henry",Attribution at time of gift,
previous_attribution,34108,1,Henry Inman,"Inman, Henry",Attribution at time of acquisition,
previous_attribution,34109,1,John Wesley Jarvis,"Jarvis, John Wesley",Attribution at time of gift,
previous_attribution,34112,2,School of Sir Godfrey Kneller,"Kneller, Sir Godfrey, School of","Bd. Tr. approval 4/30/69; list reads ""Artist Unknown"", but original change proposal was annotated by W.P. Campbell to read ""School of Sir Godfrey Kneller, British School (1646-1723)"".",
previous_attribution,34112,4,Anonymous Unknown Nationality 17th Century,Anonymous Unknown Nationality 17th Century,"Change memo 11/14/83; list reads ""18th Century"", but this was a mistaken assignment to match the date of a false inscription; error was corrected and attribution changed to 17th Century in 1986.",
previous_attribution,34112,3,American School (?),American School (?),This attribution assigned at an unknown date.,
previous_attribution,34112,1,Henrietta Deering Johnston,"Johnston, Henrietta Deering",Attribution at time of gift,
previous_attribution,34114,2,Artist Unknown,Artist Unknown,Bd. Tr. approval 4/30/1969,
previous_attribution,34114,1,Charles Bird King,"King, Charles Bird",Attribution at time of gift,
previous_attribution,34115,1,James Reid Lambdin,"Lambdin, James Reid",Attribution at time of gift,
previous_attribution,34117,1,Edward Greene Malbone,"Malbone, Edward Greene",Attribution at time of acquisition,
previous_attribution,34118,1,Edward D. Marchant,"Marchant, Edward D.",Attribution at time of gift,
previous_attribution,34119,3,Attributed to John Mare,"Mare, John, Attributed to",See 8/17/83 and 8/23/83 memos on computer artist file,
previous_attribution,34119,2,John Mare (?),"Mare, John (?)",Bd. Tr. approval 4/30/69,
previous_attribution,34119,1,John Mare,"Mare, John",Attribution at time of gift,
previous_attribution,34120,1,Eliab Metcalf,"Metcalf, Eliab",Attribution at time of acquisition,
previous_attribution,34121,2,Unknown Artist,Unknown Artist,Bd. Tr. approval 5/6/1964,""
previous_attribution,34121,1,Samuel Finley Breese Morse,"Morse, Samuel Finley Breese",Attribution at time of gift,
previous_attribution,34122,1,Pieter Vanderlyn,"Vanderlyn, Pieter",Attribution at time of gift,
previous_attribution,34122,2,Artist Unknown,Artist Unknown,"Bd. Tr. approval 4/30/69; original change proposal by W.P. Campbell reads ""Hudson Valley Artist, American School, 1719"".",
previous_attribution,34123,1,Samuel Finley Breese Morse,"Morse, Samuel Finley Breese",Attribution at time of gift,
previous_attribution,34124,1,John Neagle,"Neagle, John",Attribution at time of gift,
previous_attribution,34127,1,John Neagle,"Neagle, John",Attribution at time of gift,
previous_attribution,34127,2,Artist Unknown,Artist Unknown,Bd. Tr. approval 4/30/69,1969-04-30
previous_attribution,34128,1,John Neagle,"Neagle, John",Attribution at time of gift,
previous_attribution,34128,2,Artist Unknown,Artist Unknown,Bd. Tr. approval 4/30/69,1969-04-30
previous_attribution,34130,3,American 19th Century,American 19th Century,This attribution assigned at an unknown date.,
previous_attribution,34130,2,Unknown Artist,Unknown Artist,Bd. Tr. approval 4/30/69,
previous_attribution,34130,1,John Neagle,"Neagle, John",Attribution at time of gift,
previous_attribution,34131,4,Attributed to British 18th Century,"British 18th Century, Attributed to",Bd. Tr. approval 10/5/1989,1989-10-05
previous_attribution,34131,3,Anonymous Unknown Nationality 19th Century,Anonymous Unknown Nationality 19th Century,Change memo 11/14/1983,1983-11-14
previous_attribution,34131,1,James Peale,"Peale, James",Attribution at time of gift,
previous_attribution,34131,2,American School (?),American School (?),"Bd. Tr. approval 4/30/1969; list reads ""Artist Unknown"", but original change proposal was annotated by W.P. Campbell to read ""American (?), second half 18th century (but could be European as well)"".",1969-04-30
previous_attribution,34132,1,Rembrandt Peale,"Peale, Rembrandt",Attribution at time of acquisition,
previous_attribution,34134,5,Attributed to British 18th Century,"British 18th Century, Attributed to",Bd. Tr. approval 10/5/89,
previous_attribution,34134,1,John Watson,"Watson, John",Attribution at time of gift,
previous_attribution,34134,4,Anonymous Unknown Nationality 18th Century,Anonymous Unknown Nationality 18th Century,Change memo 11/14/83,
previous_attribution,34134,2,School of Sir Godfrey Kneller,"Kneller, Sir Godfrey, School of","Bd. Tr. approval 4/30/69; list reads ""Artist Unknown"", but original change proposal was annotated by W.P. Campbell to read ""School of Sir Godfrey Kneller, British, 1646-1723"".",
previous_attribution,34134,3,American School (?),American School (?),This attribution assigned at an unknown date.,
previous_attribution,34135,3,American School (?),American School (?),This attribution assigned at an unknown date.,
previous_attribution,34135,5,Attributed to British 18th Century,"British 18th Century, Attributed to",Bd. Tr. approval 10/5/89,
previous_attribution,34135,2,School of Sir Godfrey Kneller,"Kneller, Sir Godfrey, School of","Bd. Tr. approval 4/30/69; list reads ""Artist Unknown"", but original change proposal was annotated by W.P. Campbell to read ""School of Sir Godfrey Kneller, British School, 1646-1723"".",
previous_attribution,34135,4,Anonymous Unknown Nationality 18th Century,Anonymous Unknown Nationality 18th Century,Change memo 11/14/83,
previous_attribution,34135,1,Peter Pelham,"Pelham, Peter",Attribution at time of gift,
previous_attribution,34136,2,American School (?),American School (?),"Bd. Tr. approval 4/30/69; list reads ""Artist Unknown"", but original change proposal was annotated by W.P. Campbell to read first ""European, second quarter 18th century"", then ""American School (?)"".",
previous_attribution,34136,4,Attributed to British 18th Century,"British 18th Century, Attributed to",Bd. Tr. approval 10/5/89,
previous_attribution,34136,3,Anonymous Unknown Nationality 18th Century,Anonymous Unknown Nationality 18th Century,Change memo 11/14/83,
previous_attribution,34136,1,Peter Pelham,"Pelham, Peter",Attribution at time of gift,
previous_attribution,34138,1,Matthew Pratt,"Pratt, Matthew",Attribution at time of gift,
previous_attribution,34138,3,American School (?),American School (?),This attribution assigned at an unknown date.,
previous_attribution,34138,2,British School (?),British School (?),"Bd. Tr. approval 4/30/69; list reads ""Artist Unknown"", but original change proposal was annotated by W.P. Campbell to read ""British School (?), about 1775"".",
previous_attribution,34139,3,European 17th Century,European 17th Century,This attribution assigned at an unknown date.,
previous_attribution,34139,4,Anonymous Unknown Nationality 17th Century,Anonymous Unknown Nationality 17th Century,Change memo 11/14/83,
previous_attribution,34139,1,William Read,"Read, William",Attribution at time of gift,
previous_attribution,34139,2,British School (?),British School (?),"Bd. Tr. approval 4/30/69; list reads ""European of Unknown Nationality"", but original change proposal was annotated by W.P. Campbell to read ""British School (?), mid-17th century"".",
previous_attribution,34140,1,John Smibert,"Smibert, John",Attribution at time of acquisition,
previous_attribution,34141,1,John Smibert,"Smibert, John",Attribution at time of gift,
previous_attribution,34141,2,American 18th Century,American 18th Century,"Bd. Tr. approval 4/30/1969; list reads ""Artist Unknown"", but original change proposal was annotated by W.P. Campbell to read ""American School (?), mid 18th century"".",
previous_attribution,34142,2,American School (?),American School (?),"Bd. Tr. approval 4/30/69; list reads ""Artist Unknown"", but original change proposal was annotated by W.P. Campbell to read ""American School (?), first quarter 18th century"".",
previous_attribution,34142,3,Anonymous Unknown Nationality 18th Century,Anonymous Unknown Nationality 18th Century,This attribution assigned at an unknown date; perhaps inadvertently left off 11/14/83 change memo.,
previous_attribution,34142,1,John Smibert,"Smibert, John",Attribution at time of gift,
previous_attribution,34143,2,American School,American School,"Bd. Tr. approval 4/30/1969; list reads ""Artist Unknown"", but original change proposal was annotated by W.P. Campbell to read ""American School, first third 18th century"".",1969-04-30
previous_attribution,34143,1,John Smibert,"Smibert, John",Attribution at time of gift,
previous_attribution,34145,1,Junius Brutus Stearns,"Stearns, Junius Brutus",Attribution at time of acquisition,
previous_attribution,34146,1,Jacobus Gerritsen Strycker,"Strycker, Jacobus Gerritsen",Attribution at time of gift,
previous_attribution,34147,1,Jacobus Gerritsen Strycker,"Strycker, Jacobus Gerritsen",Attribution at time of gift,
previous_attribution,34148,2,European 18th Century,European 18th Century,Bd. Tr. approval 4/30/69,
previous_attribution,34148,1,Adolph-Ulrich Wertmüller,"Wertmüller, Adolph-Ulrich",Attribution at time of gift,
previous_attribution,34150,1,Gilbert Stuart,"Stuart, Gilbert",Attribution at time of gift,
previous_attribution,34152,3,Attributed to Gilbert Stuart and Follower of Gilbert Stuart,"Stuart, Gilbert, Attributed to and Follower of Gilbert Stuart",See 8/17/83 and 8/23/83 memos on computer artist file,
previous_attribution,34152,2,Gilbert Stuart (?),"Stuart, Gilbert (?)","Bd. Tr. approval 4/30/69.  W. P. Campbell memo proposing change originally recommended a change to ""Artist(s) Unknown"".  On copy in object file, this has been crossed out and ""Gilbert Stuart (?)"" added.  At some later date the attribution was apparently considered to be ""Gilbert Stuart (?) and Unknown Artist"", because this is what was put in the new format in 1983.  Perhaps it was a combination of the two attributions indicated on the 1969 change memo.",
previous_attribution,34152,1,Gilbert Stuart,"Stuart, Gilbert",Attribution at time of gift,
previous_attribution,34154,1,Gilbert Stuart,"Stuart, Gilbert",Attribution at time of gift,
previous_attribution,34155,1,Gilbert Stuart,"Stuart, Gilbert",Attribution at time of gift,
previous_attribution,34157,1,Thomas Sully,"Sully, Thomas",Attribution at time of gift,
previous_attribution,34158,1,Thomas Sully,"Sully, Thomas",Attribution at time of gift,
previous_attribution,34159,2,American School after Gilbert Stuart,American School after Gilbert Stuart,"Bd. Tr. approval 4/30/69.  W. P. Campbell originally recommended a change to ""Copy after Gilbert Stuart"".  He then amended the proposal to make the attribution ""American School (Copy after Gilbert Stuart)"".",
previous_attribution,34159,1,Thomas Sully,"Sully, Thomas",Attribution at time of gift,
previous_attribution,34160,1,Jeremiah Theus,"Theus, Jeremiah",Attribution at time of gift,
previous_attribution,34161,1,Jeremiah Theus,"Theus, Jeremiah",Attribution at time of gift,
previous_attribution,34161,2,European 18th Century,European 18th Century,"Bd. Tr. approval 4/30/1969
",
previous_attribution,34162,1,British 16th Century,British 16th Century,Attribution at time of gift,
previous_title,34760,2,Moresques et Damasquines,,,
previous_title,34902,1,Self-Portrait,,,
previous_attribution,34907,1,Katharina Prestel after Allart van Everdingen,"Prestel, Katharina after Allart van Everdingen",,
previous_title,34908,2,A Quacksalver,,,
previous_title,34910,2,Walking Woman,,,
previous_title,34911,2,Peasant with Country Fair Singers,,,
previous_title,34917,2,Philosopher,,,
previous_title,34921,2,Wooded Landscape,,,
previous_title,34925,2,Mountain Landscape,,,
previous_title,34927,2,Virtue Overcoming Vice,,,
previous_title,34950,2,Under Cliff,,,
previous_attribution,35079,2,Giovanni Francesco Rustici,"Rustici, Giovanni Francesco",Bd. Tr. approval 5/5/76,
previous_attribution,35079,1,Attributed to Leone Leoni,"Leoni, Leone, Attributed to",Attribution at time of gift,
previous_attribution,35090,1,Francesco Guardi,"Guardi, Francesco",,
previous_attribution,35092,1,School of Claude Lorrain,"Claude Lorrain, School of",Attribution at time of gift,
previous_attribution,35108,1,Attributed to Claude Lorrain,"Claude Lorrain, Attributed to",,
previous_attribution,35137,1,Joseph Mallord William Turner,"Turner, Joseph Mallord William",,
previous_attribution,35141,1,(?) John Singer Sargent,"Sargent, John Singer, (?)",,
previous_attribution,35143,1,School of Claude Lorrain,"Claude Lorrain, School of",,
previous_attribution,35441,1,Alfred Stieglitz,"Stieglitz, Alfred",,
previous_title,36500,2,Chicken Vendors,,,
previous_title,36501,2,Going to the Sacrifice,,,
previous_title,36506,2,Camp Fire,,,
previous_attribution,36529,1,Follower of Lippo Vanni,"Vanni, Lippo, Follower of",,
previous_attribution,37004,1,Byzantine 13th Century,Byzantine 13th Century,Attribution at time of acquisition,1949
previous_attribution,37028,1,Attributed to Egyptian Ptolemaic Period,"Egyptian Ptolemaic Period, Attributed to",Attribution at time of gift,
previous_attribution,37028,2,Probably Egyptian Ptolemaic Period,"Egyptian Ptolemaic Period, Probably","Change memo 10/9/1991
",
previous_attribution,37044,1,Follower of Lorenzo Monaco,"Lorenzo Monaco, Follower of",Change of attribution reflects proposal of 5/08,2008-05-28
previous_attribution,37060,1,Attributed to Philip Galle after Pieter Bruegel the Elder,"Galle, Philip, Attributed to after Pieter Bruegel the Elder",attribution confirmed in Galle New Hollstein (2001),""
previous_attribution,37061,1,Attributed to Philip Galle after Pieter Bruegel the Elder,"Galle, Philip, Attributed to after Pieter Bruegel the Elder",attribution confirmed in Galle New Hollstein (2001),""
previous_attribution,37107,1,Hendrik Goltzius,"Goltzius, Hendrik",,
previous_attribution,37632,1,Attributed to Justus Sustermans,"Sustermans, Justus, Attributed to","Attribution at time of acquisition
",
previous_attribution,37633,1,Attributed to Martino di Bartolomeo di Biagio,"Martino di Bartolomeo di Biagio, Attributed to",Attribution at time of acquisition,1950
previous_attribution,37634,1,Attributed to Martino di Bartolomeo di Biagio,"Martino di Bartolomeo di Biagio, Attributed to",Attribution at time of acquistion,1950
previous_attribution,37635,1,Attributed to Martino di Bartolomeo di Biagio,"Martino di Bartolomeo di Biagio, Attributed to",Attribution at time of acquisition,1950
previous_attribution,38272,1,H. Grotius,"Grotius, H.",Grotius's name appears on the print as the author of the verses below the portrait.,""
previous_attribution,38307,1,H. Grotius,"Grotius, H.",Grotius's name appears on the print as the author of the verses below the portrait.,""
previous_attribution,38386,1,Isaak Beckett,"Beckett, Isaak",,
previous_title,38834,2,Paolo Caliari,,,
previous_title,38930,3,Untitled,,,
previous_title,39246,2,Still Life IV,,,
previous_attribution,39553,1,Otto Müller,"Müller, Otto",,
previous_attribution,39554,1,Otto Müller,"Müller, Otto",,
previous_attribution,39555,1,Otto Müller,"Müller, Otto",,
previous_attribution,39556,1,Otto Müller,"Müller, Otto",,
previous_attribution,39557,1,Otto Müller,"Müller, Otto",,
previous_attribution,39558,1,Otto Müller,"Müller, Otto",,
previous_attribution,39559,1,Otto Müller,"Müller, Otto",,
previous_attribution,39560,1,Otto Müller,"Müller, Otto",,
previous_attribution,39561,1,Otto Müller,"Müller, Otto",,
previous_attribution,39562,1,Otto Müller,"Müller, Otto",,
previous_attribution,39563,1,Otto Müller,"Müller, Otto",,
previous_attribution,39564,1,Otto Müller,"Müller, Otto",,
previous_attribution,39565,1,Otto Müller,"Müller, Otto",,
previous_attribution,39566,1,Otto Müller,"Müller, Otto",,
previous_attribution,39567,1,Otto Müller,"Müller, Otto",,
previous_attribution,39568,1,Otto Müller,"Müller, Otto",,
previous_attribution,39569,1,Otto Müller,"Müller, Otto",,
previous_attribution,39570,1,Otto Müller,"Müller, Otto",,
previous_attribution,39571,1,Otto Müller,"Müller, Otto",,
previous_attribution,39734,1,Augustin Hirschvogel,"Hirschvogel, Augustin",,
previous_attribution,39735,1,Augustin Hirschvogel,"Hirschvogel, Augustin",,
previous_attribution,39741,1,French 18th Century,French 18th Century,Attribution at time of gift,1951      
previous_attribution,39762,1,Joseph Highmore,"Highmore, Joseph",Attribution at time of gift,
previous_attribution,39764,1,John James Audubon,"Audubon, John James",Attribution at time of gift,
previous_attribution,39765,2,Attributed to John James Audubon,"Audubon, John James, Attributed to",Bd. Tr. approval 10/15/51,
previous_attribution,39765,1,John James Audubon,"Audubon, John James",Attribution at time of gift,
previous_attribution,39767,1,John James Audubon,"Audubon, John James",Attribution at time of gift,
previous_attribution,39768,1,John James Audubon,"Audubon, John James",Attribution at time of gift,
previous_attribution,39769,1,John James Audubon,"Audubon, John James",Attribution at time of gift,
previous_attribution,39770,1,John James Audubon,"Audubon, John James",Attribution at time of gift,
previous_attribution,39771,1,John James Audubon,"Audubon, John James",Attribution at time of gift,
previous_attribution,39772,1,John James Audubon,"Audubon, John James",Attribution at time of gift,
previous_attribution,39794,1,Italian 13th Century,Italian 13th Century,,
previous_title,39852,2,Barbarroxa,,,
previous_title,40013,2,"Cathedral Repairs, Mexico City",,,
previous_attribution,40147,1,Otto Müller,"Müller, Otto",,
previous_attribution,40148,1,Otto Müller,"Müller, Otto",,
previous_attribution,40149,1,Otto Müller,"Müller, Otto",,
previous_attribution,40150,1,Otto Müller,"Müller, Otto",,
previous_attribution,40151,1,Otto Müller,"Müller, Otto",,
previous_title,40177,2,Marcella and Franzi in a Hammock,,,
previous_attribution,40934,1,Josiah English,"English, Josiah",,
previous_attribution,41314,1,Jacopo Tintoretto,"Tintoretto, Jacopo",Attribution at time of gift,
previous_attribution,41314,2,School of Jacopo Tintoretto,"Tintoretto, Jacopo, School of",Bd. Tr. approval 1/19/65,
previous_title,41331,2,Way Through the Woods,,,
previous_attribution,41472,1,British 19th Century,British 19th Century,,
previous_attribution,41473,1,British 19th Century,British 19th Century,Attribution change approved 12/22/93,
previous_attribution,41475,1,British 19th Century,British 19th Century,,
previous_attribution,41495,1,Attributed to John Sell Cotman,"Cotman, John Sell, Attributed to",,
previous_attribution,41499,1,Attributed to John Sell Cotman,"Cotman, John Sell, Attributed to",,
previous_attribution,41501,1,Attributed to John Sell Cotman,"Cotman, John Sell, Attributed to",,
previous_attribution,41506,1,Attributed to John Sell Cotman,"Cotman, John Sell, Attributed to",,
previous_attribution,41507,1,Follower of John Sell Cotman,"Cotman, John Sell, Follower of","This work was called School of John Sell Cotman until 1983, when the National Gallery adopted the attribution terminology developed by the Curatorial Committee for a Catalogue Raisonné, see memorandum on revised attribution terms from Suzannah Fabing to J. Carter Brown of 11/14/83.",
previous_attribution,41508,1,Follower of John Sell Cotman,"Cotman, John Sell, Follower of","This work was called School of John Sell Cotman until 1983, when the National Gallery adopted the attribution terminology developed by the Curatorial Committee for a Catalogue Raisonné, see memorandum on revised attribution terms from Suzannah Fabing to J. Carter Brown of 11/14/83.",
previous_attribution,41511,1,British 19th Century,British 19th Century,,
previous_attribution,41512,1,British 19th Century,British 19th Century,,
previous_attribution,41514,1,British 19th Century,British 19th Century,,
previous_attribution,41516,1,British 19th Century,British 19th Century,,
previous_attribution,41520,1,Honoré Daumier,"Daumier, Honoré",Attribution at time of gift,
previous_attribution,41521,1,Honoré Daumier,"Daumier, Honoré",Attribution at time of gift,
previous_attribution,41590,1,Venetian School (Possibly Giorgione),Venetian School (Possibly Giorgione),Attribution at time of gift,
previous_attribution,41594,2,Titian,Titian,Attribution at time of acquisition,1942
previous_attribution,41596,1,Master of Saint Giles,Master of Saint Giles,Attribution at time of gift,
previous_attribution,41601,2,Antwerp School,Antwerp School,Bd. Tr. approval 5/5/76,
previous_attribution,41601,1,"Pieter Bruegel, the Elder","Bruegel, Pieter, the Elder",Attribution at time of gift,
previous_attribution,41602,1,"Pieter Bruegel, the Elder",N/A,Attribution at time of gift,
previous_attribution,41604,1,Nicolas Poussin,"Poussin, Nicolas","Attribution at time of acquisition
",
previous_attribution,41609,2,Giovanni Andrea Donducci,"Donducci, Giovanni Andrea",Bd. Tr. approval 10/4/84,
previous_attribution,41609,1,School of Parmigianino,"Parmigianino, School of",Attribution at time of gift,
previous_attribution,41610,3,British 18th Century,British 18th Century,See 8/17/83 and 8/23/83 memos on computer artist file,
previous_attribution,41610,2,English School,English School,Bd. Tr. approval 4/30/69,
previous_attribution,41610,1,William Hogarth,"Hogarth, William",Attribution at time of gift,
previous_attribution,41612,1,Luca Signorelli,"Signorelli, Luca",Attribution at time of gift,
previous_attribution,41628,1,Orcagna and Jacopo di Cione,Orcagna and Jacopo di Cione,Attribution at time of acquisition,1952
previous_attribution,41629,3,Workshop of Piero della Francesca,"Piero della Francesca, Workshop of","See 8/17/1983 and 8/23/1983 memos on computer artist file
",
previous_attribution,41629,1,Piero della Francesca,Piero della Francesca,Attribution at time of gift,
previous_attribution,41629,2,Assistant of Piero della Francesca,"Piero della Francesca, Assistant of","Bd. Tr. approval 1/19/1971
",
previous_attribution,41630,2,Sassetta,Sassetta,Attribution at time of acquisition,1952
previous_attribution,41630,1,Sassetta and Assistants,Sassetta and Assistants,"This change was made while the painting was on loan to the NGA from the Kress Foundation, after consultations between the institutions.  See letters, of 11/8/1951 from John Walker and 11/14/1951 from Guy Emerson, in NGA curatorial files.",1951
previous_attribution,41630,3,Sassetta and Workshop,Sassetta and Workshop,Change made at unknown date; published with this attribution in 1985 summary catalogue.,1985
previous_attribution,41631,2,Sassetta and Assistant,Sassetta and Assistant,Bd. approval 1/9/1964,1964-01-09
previous_attribution,41631,1,Sassetta,Sassetta,Attribution at time of acquisition,1952
previous_attribution,41631,3,Sassetta and Workshop,Sassetta and Workshop,Change made at unknown date; published with this attribution in 1985 summary catalogue.,1985
previous_attribution,41633,1,Workshop of Simone Martini,"Simone Martini, Workshop of",Bd. Tr. approval 10/4/1984,1984-10-04
previous_attribution,41633,2,Simone Martini and Assistants,Simone Martini and Assistants,Attribution at time of gift,1952
previous_attribution,41634,2,Workshop of Simone Martini,"Simone Martini, Workshop of",Bd. Tr. approval 10/4/84,1984-10-04
previous_attribution,41634,1,Simone Martini and Assistants,Simone Martini and Assistants,Attribution at time of gift,1952
previous_attribution,41635,2,Workshop of Simone Martini,"Simone Martini, Workshop of",Bd. Tr. approval 10/4/84,1984-10-04
previous_attribution,41635,1,Simone Martini and Assistants,Simone Martini and Assistants,Attribution at time of gift,1952
previous_attribution,41636,2,Workshop of Simone Martini,"Simone Martini, Workshop of",Bd. Tr. approval 10/4/84,1984-10-04
previous_attribution,41636,1,Simone Martini and Assistants,Simone Martini and Assistants,Attribution at time of gift,1952
previous_attribution,41637,1,Circle of Tintoretto (Probably Lambert Sustris),Circle of Tintoretto (Probably Lambert Sustris),Bd. Tr. 1/25/2018 ,2018-01-25
previous_attribution,41641,1,Albrecht Altdorfer,"Altdorfer, Albrecht",Attribution at time of gift,
previous_attribution,41642,1,Albrecht Altdorfer,"Altdorfer, Albrecht",Attribution at time of gift,
previous_attribution,41643,1,Albrecht Altdorfer,"Altdorfer, Albrecht",Attribution at time of gift,
previous_attribution,41644,1,School of Amiens,School of Amiens,Attribution at time of gift,
previous_attribution,41654,1,Hispano-Dutch School,Hispano-Dutch School,Attribution at time of gift,
previous_attribution,41658,1,Studio of Simon Marmion,"Marmion, Simon, Studio of",Attribution at time of acquisition,
previous_attribution,41664,1,Nicolas Poussin,"Poussin, Nicolas",Attribution at time of acquisition,
previous_attribution,41675,2,Attributed to Cimabue,"Cimabue, Attributed to",Bd. Tr. approval 1/9/1964,1964-01-09
previous_attribution,41675,1,Cimabue,Cimabue,Attribution at time of gift,1952
previous_attribution,41677,1,Domenico Ghirlandaio,"Ghirlandaio, Domenico","Attribution at time of acquisition
",
previous_attribution,41680,2,Circle of Andrea del Verrocchio (Possibly Leonardo da Vinci),"Verrocchio, Andrea del, Circle of (Possibly Leonardo da Vinci)","Date of change unknown, but published with this attribution in 1965 summary catalogue.
",
previous_attribution,41680,1,Attributed to Leonardo da Vinci,"Leonardo da Vinci, Attributed to",Attribution at time of gift,
previous_attribution,41680,3,Workshop of Andrea del Verrocchio (Possibly Leonardo da Vinci),"Verrocchio, Andrea del, Workshop of (Possibly Leonardo da Vinci)","Change memo 11/14/1983, where change was incorrectly listed as to ""Attributed to Leonardo da Vinci"" (the attribution at time of acquisition); published with this attribution in 1985 summary catalogue.
",""
previous_attribution,41681,1,Studio of Leonardo da Vinci,"Leonardo da Vinci, Studio of","Attribution at time of acquisition
",
previous_attribution,41683,1,Master of the Life of Saint John the Baptist,Master of the Life of Saint John the Baptist,Attribution at time of acquisition,1952
previous_attribution,41685,2,Francesco Polazzo,"Polazzo, Francesco",Change made on accession card 3/12/1956; there is no reference in Acquisition Committee or Board of Trustee minutes to this change of attribution.,
previous_attribution,41685,1,Giovanni Battista Piazzetta,"Piazzetta, Giovanni Battista",Attribution at time of acquisition,
previous_attribution,41685,3,Giovanni Battista Piazzetta,"Piazzetta, Giovanni Battista","Change memo 9/27/1957, from the Chief Curator to the Registrar; there is no reference in Acquisition Committee or Board of Trustee minutes to this change of attribution.",
previous_attribution,41686,1,North Italian 15th Century,North Italian 15th Century,Attribution at time of gift,
previous_attribution,41687,1,Circle of Raphael,"Raphael, Circle of",Attribution at time of gift,
previous_attribution,41688,2,Sassetta and Assistant,Sassetta and Assistant,"This change was made while the painting was on loan to the NGA from the Kress Foundation, after consultations between the institutions.  See letters, of 11/8/1951 from John Walker and 11/14/1951 from Guy Emerson, in NGA curatorial files.  Although the correspondence indicates the attribution will use the plural ""assistants"" the attribution was published with the singular ""assistant"" in the 1965 and 1975 NGA summary catalogues.",
previous_attribution,41688,3,Sassetta and Workshop,Sassetta and Workshop,Change made at unknown date; published with this attribution in 1985 summary catalogue.,
previous_attribution,41688,1,Master of the Osservanca Altarpiece,Master of the Osservanca Altarpiece,Attribution at time of gift,
previous_attribution,41696,1,Umbrian School (Possibly Raphael),Umbrian School (Possibly Raphael),Attribution at time of gift,
previous_attribution,41696,2,Umbrian School,Umbrian School,Bd. Tr. approval 5/5/1971,2009-07-10
previous_attribution,41699,1,German 16th Century,German 16th Century,Attribution at time of gift,
previous_attribution,41700,1,German 16th Century,German 16th Century,Attribution at time of gift,
previous_attribution,41702,1,Paolo Veneziano,Paolo Veneziano,Attribution at time of acquisition,1952
previous_attribution,41703,1,Francisco de Zurbarán,"Zurbarán, Francisco de",Attribution at time of gift,
previous_attribution,41704,1,"Hellenistic School, Egypt","Hellenistic School, Egypt",Attribution at time of gift,
previous_attribution,41705,1,Lombard School,Lombard School,Attribution at time of gift,
previous_attribution,41706,1,Lombard School,Lombard School,Attribution at time of gift,
previous_attribution,41707,2,Follower of Gian Lorenzo Bernini,"Bernini, Gian Lorenzo, Follower of",Change memo 11/14/83,
previous_attribution,41707,1,School of Gian Lorenzo Bernini,"Bernini, Gian Lorenzo, School of",Attribution at time of gift,
previous_attribution,41709,1,Elia Candido,"Candido, Elia",Attribution at time of gift,
previous_attribution,41710,2,French 19th Century,French 19th Century,Bd. Tr. approval 10/19/1978,1978-10-19
previous_attribution,41710,1,Clodion,Clodion,Attribution at time of gift,
previous_attribution,41711,1,Clodion,Clodion,Attribution at time of gift,
previous_attribution,41712,1,Clodion,Clodion,Attribution at time of gift,
previous_attribution,41715,1,Desiderio da Settignano,Desiderio da Settignano,Attribution at time of acquistion,1952
previous_attribution,41717,1,Franco-Portuguese 16th Century,Franco-Portuguese 16th Century,Attribution at time of gift,1952
previous_attribution,41719,1,Leone Leoni,"Leoni, Leone",Attribution at time of acquisition,
previous_attribution,41721,1,Robert Le Lorrain,"Le Lorrain, Robert",Attribution at time of gift,
previous_title,41819,3,"Helios IV, red and black",,,
previous_attribution,42278,1,Jacques Callot,"Callot, Jacques",,
previous_attribution,42279,1,Jacques Callot,"Callot, Jacques",,
previous_attribution,42280,1,Jacques Callot,"Callot, Jacques",,
previous_attribution,42281,1,Jacques Callot,"Callot, Jacques",,
previous_attribution,42282,1,Jacques Callot,"Callot, Jacques",,
previous_attribution,42390,1,English 14th Century,English 14th Century,Attribution at time of gift,
previous_attribution,42395,2,Antwerp School (?),Antwerp School (?),"Bd. Tr. approval 5/2/84.  Published in Hand/Wolff 1986 as ""Antwerp Artist (?)"".",
previous_attribution,42395,1,Ambrosius Benson,"Benson, Ambrosius",Attribution at time of gift,
previous_attribution,42396,2,Antwerp School (?),Antwerp School (?),"Bd. Tr. approval 5/2/84.  Published in Hand/Wolff 1986 as ""Antwerp Artist (?)"".",
previous_attribution,42396,1,Ambrosius Benson,"Benson, Ambrosius",Attribution at time of gift,
previous_attribution,42397,1,Ambrosius Benson,"Benson, Ambrosius",Attribution at time of gift,
previous_attribution,42397,2,Antwerp School (?),Antwerp School (?),"Bd. Tr. approval 5/2/84.  Published in Hand/Wolff 1986 as ""Antwerp Artist (?)"".",
previous_attribution,42398,1,"Bartholomaeus Bruyn, the Elder",N/A,Attribution at time of gift,
previous_attribution,42427,1,American School,American School,Attribution at time of gift,
previous_attribution,42438,1,American School,American School,Attribution at time of gift,
previous_attribution,42438,2,Denison Limner,Denison Limner,Bd. Tr. approval 9/29/82,
previous_attribution,42441,1,Unknown Artist,Unknown Artist,Attribution at time of gift,
previous_attribution,42444,2,Attributed to Benjamin Greenleaf,"Greenleaf, Benjamin, Attributed to",Bd. Tr. approval 10/2/80,
previous_attribution,42444,1,Unknown Artist,Unknown Artist,Attribution at time of gift,
previous_attribution,42445,1,American School,American School,Original Garbisch Collection attribition,
previous_attribution,42446,1,American School,American School,Attribution at time of gift,
previous_attribution,42447,1,Unknown American,Unknown American,Attribution at time of gift,
previous_attribution,42448,1,Unknown American,Unknown American,Attribution at time of gift,
previous_attribution,42453,1,Unknown Artist,Unknown Artist,Attribution at time of gift,
previous_attribution,42454,1,Unknown Artist,Unknown Artist,Attribution at time of gift,
previous_attribution,42455,1,Unknown 19th Century or The Borden Limner,Unknown 19th Century or The Borden Limner,,
previous_attribution,42456,1,Unknown 19th Century or The Borden Limner,Unknown 19th Century or The Borden Limner,,
previous_attribution,42457,1,Unknown Artist,Unknown Artist,Attribution at time of gift,
previous_attribution,42460,1,American School,American School,Attribution at time of gift,
previous_attribution,42461,1,American School,American School,Attribution at time of gift,
previous_attribution,42461,2,Attributed to William Matthew Prior,"Prior, William Matthew, Attributed to",Bd. Tr. approval 9/29/82,
previous_attribution,42462,1,American School,American School,Attribution at time of gift,
previous_attribution,42469,1,American School,American School,Attribution at time of gift,
previous_attribution,42470,2,Attributed to William Matthew Prior,"Prior, William Matthew, Attributed to",Bd. Tr. approval 9/29/82,
previous_attribution,42470,1,American School,American School,Attribution at time of gift,
previous_attribution,42473,2,Attributed to Sturtevant J. Hamblin,"Hamblin, Sturtevant J., Attributed to",Bd. Tr. approval 9/29/82,
previous_attribution,42473,1,American School,American School,Attribution at time of gift,
previous_attribution,42490,1,Daisy C. Miller,"Miller, Daisy C.","Attribution at time of gift.  This is the name of the dealer who originally found the painting in Hampden, Maine, and who was erroneously associated with it as the artist.",          
previous_attribution,42498,2,Attributed to Charles S. Humphreys,"Humphreys, Charles S., Attributed to",Bd. Tr. approval 4/30/69,
previous_attribution,42498,1,Artist Unknown,Artist Unknown,Attribution at time of gift,
previous_attribution,42499,1,American 19th Century,American 19th Century,Attribution at time of gift,
previous_attribution,42505,1,American 19th Century,American 19th Century,,
previous_attribution,42529,1,American 19th Century,American 19th Century,,
previous_attribution,42536,1,American 19th Century,American 19th Century,,
previous_attribution,42537,1,American 19th Century,American 19th Century,,
previous_attribution,42811,1,Emile Bernard,"Bernard, Emile",,
previous_title,42817,4,Waiting Women,,,
previous_attribution,42850,1,Honoré Daumier,"Daumier, Honoré",Attribution at time of gift,
previous_attribution,42911,1,François Boucher,"Boucher, François",Attribution at time of gift,
previous_attribution,42911,2,School of Louis Michel Vanloo,"Vanloo, Louis Michel, School of",Bd. Tr. approval 1/19/65,
previous_attribution,42914,2,James Reid Lambdin (?),"Lambdin, James Reid (?)",Bd. Tr. approval 4/30/69,
previous_attribution,42914,1,James Reid Lambdin,"Lambdin, James Reid",Attribution at time of gift,
previous_attribution,42916,1,Henry Benbridge,"Benbridge, Henry",Attribution at time of gift,
previous_attribution,42916,2,European 18th Century,European 18th Century,Bd. Tr. approval 4/30/1969,1969-04-30
previous_attribution,42917,2,American School (?),American School (?),Bd. Tr. approval 5/6/64,
previous_attribution,42917,1,Ralph Earl,"Earl, Ralph",Attribution at time of gift,
previous_attribution,42917,3,Unknown Nationality 18th Century,Unknown Nationality 18th Century,Change made for publication in 1985 European Paintings Summary Catalogue.  Attribution text is format at time of change.,
previous_attribution,42919,1,Samuel Finley Breese Morse,"Morse, Samuel Finley Breese",Attribution at time of gift,
previous_attribution,42920,2,European 18th Century (?),European 18th Century (?),"Bd. Tr. approval 4/30/69; list reads ""Artist Unknown"", but original change proposal was annotated by W.P. Campbell to read ""European (?), about 1785"".",
previous_attribution,42920,1,Henry Pelham,"Pelham, Henry",Attribution at time of gift,
previous_attribution,42920,3,Anonymous Unknown Nationality 18th Century,Anonymous Unknown Nationality 18th Century,This attribution assigned at an unkown date; perhaps inadvertently left off 11/14/83 change memo.,
previous_attribution,42921,1,Gilbert Stuart,"Stuart, Gilbert",Attribution at time of gift,
previous_attribution,42922,1,Gilbert Stuart,"Stuart, Gilbert",Attribution at time of gift,
previous_attribution,42924,2,British 18th Century,British 18th Century,Bd. Tr. approval 4/30/69,
previous_attribution,42924,1,Gilbert Stuart,"Stuart, Gilbert",Attribution at time of gift,
previous_attribution,42926,1,Franz Xaver Winterhalter,"Winterhalter, Franz Xaver",Title at time of acquisition,
previous_attribution,42937,1,Sir Henry Raeburn,"Raeburn, Sir Henry",Attribution at time of gift,
previous_attribution,42941,1,Attributed to Francisco de Goya,"Goya, Francisco de, Attributed to",Attribution at time of gift,
previous_attribution,43132,1,Netherlandish 15th Century,Netherlandish 15th Century,,
previous_attribution,43133,1,Netherlandish 15th Century,Netherlandish 15th Century,,
previous_attribution,43199,1,Honoré Daumier,"Daumier, Honoré",Attribution at time of gift,
previous_attribution,43200,1,Honoré Daumier,"Daumier, Honoré",Attribution at time of gift,
previous_attribution,43262,1,Jean-Baptiste Joseph Pater,"Pater, Jean-Baptiste Joseph",Attribution at time of gift,
previous_attribution,43263,1,Rosalba Carriera,"Carriera, Rosalba",Attribution at time of gift,
previous_attribution,43314,1,Andrea Mantegna,"Mantegna, Andrea",,
previous_attribution,43428,1,Attributed to François-Hubert Drouais,"Drouais, François-Hubert, Attributed to","Attribution at time of acquisition
",
previous_attribution,43434,1,Unknown American,Unknown American,Attribution at time of gift,
previous_attribution,43438,2,Unknown Artist,Unknown Artist,Bd. Tr. approval 5/2/1985,""
previous_attribution,43438,1,Susane Walters,"Walters, Susane",Attribution at time of gift,
previous_attribution,43439,1,Unknown Artist,Unknown Artist,Attribution at time of gift,
previous_attribution,43448,2,Artist Unknown,Artist Unknown,Bd. Tr. approval 4/30/69,1969-04-30
previous_attribution,43448,1,Attributed to Samuel Enredy Stettinius,"Stettinius, Samuel Enredy, Attributed to",Attribution at time of gift,
previous_attribution,43449,2,Artist Unknown,Artist Unknown,Bd. Tr. approval 4/30/69,1969-04-30
previous_attribution,43449,1,Attributed to Samuel Enredy Stettinius,"Stettinius, Samuel Enredy, Attributed to",Attribution at time of gift,
previous_attribution,43454,1,American 19th Century,American 19th Century,Attribution at time of gift,1955-12-21
previous_attribution,43512,3,Style of Rembrandt van Rijn,"Rembrandt van Rijn, Style of",See 8/17/1983 memo on computer artist file,          
previous_attribution,43512,1,Rembrandt van Rijn,Rembrandt van Rijn,Attribution at time of gift,
previous_attribution,43512,2,Manner of Rembrandt van Rijn,"Rembrandt van Rijn, Manner of",Bd. Tr. approval 1/25/1973,          
previous_attribution,43513,3,after Andrea del Verrocchio,"Verrocchio, Andrea del, after",Bd. Tr. approval 5/5/1976,1976-05-05
previous_attribution,43513,1,Attributed to Andrea del Verrocchio,"Verrocchio, Andrea del, Attributed to","Attribution at time of gift; however there is confusion in the records as to exactly the attribution when the gift was made.  The attribution in all actions by the NGA Board of Trustees related to the gift is ""Attributed to Verrocchio,"" and this is the attribution used on the accession card, and recorded here.  The attribution in all the deeds of gifts and all acknowledgements and correspondence from the Gallery to the donor and her representative refer to the relief as ""by Verrocchio.""  A memo of 3 June 1959 to all staff from Perry Cott directs a ""change of attribution"" from ""Attributed to Verrocchio"" to ""Andrea del Verrocchio.""  There appears to be no Board action taken on this ""change"", which was made on the accession card.  The 5 May 1976 Board action approved a change of attribution to ""After Andrea del Verrocchio.""",
previous_attribution,43513,2,Andrea del Verrocchio,"Verrocchio, Andrea del",Change memo 3 June 1959 (no Board action; see Remark under attribution at time of gift),1959-06-03
previous_attribution,43514,2,French School,French School,Bd. Tr. approval 1/19/65,
previous_attribution,43514,1,Jean-Honoré Fragonard,"Fragonard, Jean-Honoré",Attribution at time of gift,
previous_attribution,43515,1,Flemish School,Flemish School,Attribution at time of gift,
previous_attribution,43516,1,Jacopo Tintoretto,"Tintoretto, Jacopo",,
previous_title,43571,2,"Between Rounds, No.1",,,
previous_title,43572,2,"Between Rounds, No.2",,,
previous_title,43573,2,"Counted Out, No.1",,,
previous_title,43574,2,"Counted Out, No.2",,,
previous_title,43579,2,"Introducing the Champion, No.1",,,
previous_title,43580,2,"Introducing the Champion, No.2",,,
previous_title,43582,2,Preliminaries to the Big Bout,,,
previous_title,43588,2,Cornelia van de Capelle,,,
previous_attribution,43595,1,Thomas Gainsborough,"Gainsborough, Thomas",Attribution at time of gift,
previous_attribution,43597,1,John Hoppner,"Hoppner, John",Attribution at time of gift,
previous_attribution,43598,2,British School,British School,Bd. Tr. approval 1/19/65,
previous_attribution,43598,1,Sir Martin Archer Shee,"Shee, Sir Martin Archer",Attribution at time of gift,
previous_attribution,43598,3,British 18th Century,British 18th Century,See 8/17/83 and 8/23/83 memos on computer artist file,
previous_attribution,43599,3,British 18th Century,British 18th Century,See 8/17/83 and 8/23/83 memos on computer artist file,
previous_attribution,43599,2,British School,British School,Bd. Tr. approval 1/19/65,
previous_attribution,43599,1,Sir Martin Archer Shee,"Shee, Sir Martin Archer",Attribution at time of gift,
previous_attribution,43600,1,Jean-Honoré Fragonard,"Fragonard, Jean-Honoré",,
previous_attribution,43601,1,Gabriel Jacques de Saint-Aubin,"Saint-Aubin, Gabriel Jacques de",,
previous_attribution,43602,1,Willem van de Velde II,"Velde II, Willem van de",,
previous_attribution,43603,1,Willem van de Velde II,"Velde II, Willem van de",,
previous_attribution,43604,1,Willem van de Velde II,"Velde II, Willem van de",,
previous_attribution,43611,1,Canaletto,Canaletto,,
previous_attribution,43612,1,Francesco Guardi,"Guardi, Francesco",,
previous_attribution,43613,1,Francesco Guardi,"Guardi, Francesco",,
previous_attribution,43614,1,Francesco Guardi,"Guardi, Francesco",,
previous_attribution,43615,1,Francesco Guardi,"Guardi, Francesco",,
previous_attribution,43616,1,Jean Siméon Chardin,"Chardin, Jean Siméon",,
previous_attribution,43617,1,Giovanni Battista Tiepolo,"Tiepolo, Giovanni Battista",,
previous_attribution,43618,1,Giovanni Battista Tiepolo,"Tiepolo, Giovanni Battista",,
previous_attribution,43622,1,Gabriel Jacques de Saint-Aubin,"Saint-Aubin, Gabriel Jacques de",,
previous_attribution,43625,1,Francisco de Goya,"Goya, Francisco de",,
previous_attribution,43626,1,Greco-Egyptian,Greco-Egyptian,Attribution at time of gift,
previous_attribution,43636,1,Unknown Artist,Unknown Artist,Attribution at time of gift,
previous_attribution,43637,1,Reuben Moulthrop,"Moulthrop, Reuben",Attribution at time of gift,
previous_attribution,43639,1,Unknown Artist,Unknown Artist,Attribution at time of gift,
previous_attribution,43642,2,Artist Unknown,Artist Unknown,Bd. Tr. approval 4/30/69,
previous_attribution,43642,1,Attributed to Pieter Vanderlyn,"Vanderlyn, Pieter, Attributed to",Attribution at time of gift,
previous_attribution,43682,1,French 18th Century,French 18th Century,"Attribution at time of acquisition
",
previous_attribution,43683,1,French 18th Century,French 18th Century,"Attribution at time of acquisition
",
previous_attribution,43684,1,French 18th Century,French 18th Century,"Attribution at time of acquisition
",
previous_attribution,43685,1,French 18th Century,French 18th Century,"Attribution at time of acquisition
",
previous_attribution,43686,1,French 18th Century,French 18th Century,"Attribution at time of acquisition
",
previous_attribution,43687,1,French 18th Century,French 18th Century,"Attribution at time of acquisition
",
previous_attribution,43688,1,French 18th Century,French 18th Century,"Attribution at time of acquisition
",
previous_attribution,43689,1,French 18th Century,French 18th Century,Attribution at time of gift,
previous_attribution,43690,1,French 18th Century,French 18th Century,Attribution at time of gift,
previous_attribution,43691,1,French 18th Century,French 18th Century,Attribution at time of gift,
previous_attribution,43692,1,French 18th Century,French 18th Century,Attribution at time of gift,
previous_attribution,43693,1,French 18th Century,French 18th Century,Attribution at time of gift,
previous_attribution,43696,1,French 18th Century,French 18th Century,Attribution at time of gift,
previous_attribution,43697,1,French 18th Century,French 18th Century,Attribution at time of gift,
previous_attribution,43698,1,French 18th Century,French 18th Century,Attribution at time of gift,
previous_attribution,43699,1,French 18th Century,French 18th Century,Attribution at time of gift,
previous_attribution,43700,1,French 18th Century,French 18th Century,Attribution at time of gift,
previous_attribution,43701,1,French 18th Century,French 18th Century,Attribution at time of gift,
previous_attribution,43704,1,Paolo Veronese,Paolo Veronese,Attribution at time of gift,
previous_attribution,43704,2,School of Paolo Veronese,"Veronese, School of Paolo",Bd. Tr. approval 1/19/1965,""
previous_attribution,43715,1,Unknown Artist,Unknown Artist,Attribution at time of gift,
previous_attribution,43722,1,Titian,Titian,Attribution at time of acquisition,1957
previous_attribution,43726,2,"after the Antique, Roman 18th Century","after the Antique, Roman 18th Century",Reported to Bd. Tr. 10/31/85,
previous_attribution,43726,1,Florentine 16th Century,Florentine 16th Century,Attribution at time of gift,
previous_attribution,43727,1,Sienese 15th Century,Sienese 15th Century,Attribution at time of gift,
previous_attribution,43728,2,Vecchietta,Vecchietta,Bd. Tr. approval 5/5/1976,1976-05-05
previous_attribution,43728,1,Attributed to Francesco di Giorgio Martini,"Francesco di Giorgio Martini, Attributed to",Attribution at time of gift,
previous_attribution,43733,1,Donatello,Donatello,Attribution at time of gift,
previous_attribution,43734,2,North Italian 16th Century,North Italian 16th Century,Reported to Bd. Tr. 5/4/1983,
previous_attribution,43734,1,Florentine 15th Century,Florentine 15th Century,Attribution at time of gift,
previous_attribution,43735,4,Probably Italian 15th Century,"Italian 15th Century, Probably","Reported to Bd. Tr. 10/10/1991
",
previous_attribution,43735,1,Andrea del Verrocchio,"Verrocchio, Andrea del",Attribution at time of gift,
previous_attribution,43735,3,Attributed to North Italian 15th or 16th Century,"North Italian 15th or 16th Century, Attributed to","See 8/17/1983 and 8/23/1983 memos on computer artist file; ""(?)"" changed to ""Attributed to""
",
previous_attribution,43735,2,North Italian (?) 15th or 16th Century,North Italian (?) 15th or 16th Century,"Reported to Bd. Tr. 5/4/1983
",
previous_attribution,43736,2,North Italian (Ferrarese?) 15th or 16th century,North Italian (Ferrarese?) 15th or 16th Century,Reported to Bd. Tr. 5/4/83,
previous_attribution,43736,1,Florentine 15th Century,Florentine 15th Century,Attribution at time of gift,
previous_attribution,43737,2,Attributed to Severo da Ravenna,"Severo da Ravenna, Attributed to",Reported to Bd. Tr. 5/4/1983,          
previous_attribution,43737,1,Andrea Riccio,"Riccio, Andrea",Attribution at time of gift,
previous_attribution,43738,1,Andrea Riccio,"Riccio, Andrea",Attribution at time of gift,
previous_attribution,43739,1,Andrea Riccio,"Riccio, Andrea",Attribution at time of gift,
previous_attribution,43739,2,Severo da Ravenna,Severo da Ravenna,Reported to Bd. Tr. 5/4/1983,
previous_attribution,43741,1,Andrea Riccio,"Riccio, Andrea",Attribution at time of gift,
previous_attribution,43743,1,Italian 16th Century,Italian 16th Century,Attribution at time of gift,
previous_attribution,43744,1,Italian 16th Century,Italian 16th Century,Attribution at time of gift,
previous_attribution,43744,3,Probably French 17th Century (Possibly Barthélemy Prieur),"French 17th Century, Probably (Possibly Barthélemy Prieur)","Reported to Bd. Tr. 10/10/1991
",
previous_attribution,43744,2,Italo-Netherlandish or Italo-French 16th Century,Italo-Netherlandish or Italo-French 16th Century,"Bd. Tr. approval 1/14/1981
",
previous_attribution,43745,1,Italian 16th Century,Italian 16th Century,Attribution at time of gift,
previous_attribution,43745,2,Italian 16th Century (Florentine 16th Century ?),Italian 16th Century (Florentine 16th Century ?),Reported to Bd. Tr. 5/4/83,
previous_attribution,43746,3,Attributed to Vincenzo Danti,"Danti, Vincenzo, Attributed to",Change memo 11/14/1983,
previous_attribution,43746,2,Circle of Vincenzo Danti,"Danti, Vincenzo, Circle of",Bd. Tr. approval 1/14/1981,
previous_attribution,43746,1,Florentine 16th Century,Florentine 16th Century,Attribution at time of gift,
previous_attribution,43747,1,Italian 16th Century,Italian 16th Century,Attribution at time of gift,
previous_attribution,43748,1,Italian 16th Century,Italian 16th Century,Attribution at time of gift,
previous_attribution,43750,1,French 15th Century,French 15th Century,,
previous_attribution,43752,1,Andrea Riccio,"Riccio, Andrea",Attribution at time of gift,
previous_attribution,43754,1,Andrea Riccio,"Riccio, Andrea",Attribution at time of gift,
previous_attribution,43755,2,"Workshop of Andrea Briosco, called Riccio","Briosco, Andrea, called Riccio, Workshop of",Reported to Bd. Tr. 5/4/1983,
previous_attribution,43755,1,Andrea Riccio,"Riccio, Andrea",Attribution at time of gift,
previous_attribution,43758,2,Venetian 15th Century,Venetian 15th Century,Reported to Bd. Tr. 5/4/1983,
previous_attribution,43758,1,Italian 15th Century,Italian 15th Century,Attribution at time of gift,
previous_attribution,43759,2,Venetian 15th Century,Venetian 15th Century,Reported to Bd. Tr. 5/4/1983,
previous_attribution,43759,1,Italian 15th Century,Italian 15th Century,Attribution at time of gift,
previous_attribution,43760,2,"German 16th Century, probably Nuremberg","German 16th Century, probably Nuremberg",Reported to Bd. Tr. 5/4/83,1983-05-04
previous_attribution,43760,1,Italian 15th Century,Italian 15th Century,Attribution at time of gift,
previous_attribution,43761,1,Italian 15th Century,Italian 15th Century,Attribution at time of gift,
previous_attribution,43762,1,Peter Vischer I,"Vischer I, Peter",Attribution at time of gift,
previous_attribution,43762,2,Attributed to Master of the Apollo Fountain,"Master of the Apollo Fountain, Attributed to",Reported to Bd. Tr. 5/4/83,
previous_attribution,43763,3,German 16th Century (Possibly Southern),German 16th Century (Possibly Southern),Change made for publication of 1993 Sculpture Summary Catalogue.,
previous_attribution,43763,2,Attributed to South German 16th Century,"South German 16th Century, Attributed to",Reported to Bd. Tr. 5/4/1983,
previous_attribution,43763,1,Italian 16th Century,Italian 16th Century,Attribution at time of acquisition,
previous_attribution,43764,1,Italian 16th Century,Italian 16th Century,Attribution at time of acquisition,
previous_attribution,43765,1,Italian 16th Century,Italian 16th Century,Attribution at time of gift,
previous_attribution,43766,1,Italian 16th Century,Italian 16th Century,Attribution at time of acquisition,
previous_attribution,43769,1,Italian 16th Century,Italian 16th Century,Attribution at time of gift,
previous_attribution,43770,2,Venetian 16th Century,Venetian 16th Century,Reported to Bd. Tr. 5/4/83,
previous_attribution,43770,1,Italian 16th Century,Italian 16th Century,Attribution at time of gift,
previous_attribution,43771,1,Italian 16th Century,Italian 16th Century,Attribution at time of gift,
previous_attribution,43771,2,Hellenistic or Roman 2nd Century B.C./1st Century A.D.,Hellenistic or Roman 2nd Century B.C./1st Century A.D.,Bd. Tr. approval 1/14/81,
previous_attribution,43772,1,Italian 16th Century,Italian 16th Century,Attribution at time of gift,
previous_attribution,43772,2,Hellenistic or Roman 2nd Century B.C./1st Century A.D.,Hellenistic or Roman 2nd Century B.C./1st Century A.D.,Bd. Tr. approval 1/14/81,
previous_attribution,43773,1,North Italian 16th Century,North Italian 16th Century,Attribution at time of gift,
previous_attribution,43774,1,Paduan 16th Century,Paduan 16th Century,Attribution at time of gift,
previous_attribution,43778,1,Paduan 16th Century,Paduan 16th Century,Attribution at time of gift,
previous_attribution,43778,2,"Workshop of Andrea Briosco, called Riccio","Briosco, Andrea, called Riccio, Workshop of",Reported to Bd. Tr. 5/4/1983,
previous_attribution,43780,1,North Italian 16th Century,North Italian 16th Century,Reported to Bd. Tr. 5/4/1983,2009-10-19
previous_attribution,43780,2,Paduan 16th Century,Paduan 16th Century,Attribution at time of gift,
previous_attribution,43783,1,Paduan 16th Century,Paduan 16th Century,Attribution at time of gift,
previous_attribution,43786,1,Paduan School,Paduan School,Attribution at time of gift,
previous_attribution,43788,2,"Workshop of Andrea Briosco, called Riccio","Briosco, Andrea, called Riccio, Workshop of",Reported to Bd. Tr. 5/4/1983,
previous_attribution,43788,1,Paduan 16th Century,Paduan 16th Century,Attribution at time of gift,
previous_attribution,43793,1,Florentine 15th Century,Florentine 15th Century,Attribution at time of gift,
previous_attribution,43794,1,Andrea Riccio,"Riccio, Andrea",,
previous_attribution,43795,1,Andrea Riccio,"Riccio, Andrea",Attribution at time of gift,
previous_attribution,43796,1,Andrea Riccio,"Riccio, Andrea",Attribution at time of gift,
previous_attribution,43796,2,Attributed to Italian or Netherlandish or German 16th Century,"Italian or Netherlandish or German 16th Century, Attributed to",Reported to Bd. Tr. 10/4/84,
previous_attribution,43798,2,German 16th Century,German 16th Century,Reported to Bd. Tr. 5/4/1983,
previous_attribution,43798,3,German 16th Century (Possibly Nuremberg),German 16th Century (Possibly Nuremberg),Change made for publication of 1993 Sculpture Summary Catalogue.,
previous_attribution,43798,1,Paduan (or South German ?) 16th Century,Paduan (or South German ?) 16th Century,Attribution at time of gift,
previous_attribution,43801,1,Paduan 16th Century,Paduan 16th Century,Attribution at time of gift,
previous_attribution,43805,1,Caspar Gras,"Gras, Caspar",Attribution at time of acquisition,
previous_attribution,43806,2,Paduan 15th or 16th Century,Paduan 15th or 16th Century,Reported to Bd. Tr. 5/4/1983,
previous_attribution,43806,1,Andrea Riccio,"Riccio, Andrea",Attribution at time of gift,
previous_attribution,43807,1,"Andrea Briosco, called Riccio","Briosco, Andrea, called Riccio",Attribution at time of acquisition,
previous_attribution,43809,1,"Attributed to Workshop of Andrea Briosco, called Riccio","Briosco, Andrea, called Riccio, Attributed to Workshop of",Reported to Bd. Tr. 5/4/1983,
previous_attribution,43809,1,Paduan 16th Century,Paduan 16th Century,Attribution at time of gift,
previous_attribution,43815,1,North Italian 15th Century,North Italian 15th Century,Attribution at time of gift,
previous_attribution,43816,2,Hatim (Mamluk-Syrian?),Hatim (Mamluk-Syrian?),Reported to Bd. Tr. 5/4/1983,2009-04-13
previous_attribution,43816,1,Veneto-Saracenic 16th Century,Veneto-Saracenic 16th Century,Attribution at time of gift,
previous_attribution,43817,2,Attributed to Venetian 16th Century,"Venetian 16th Century, Attributed to",Reported to Bd. Tr. 5/4/83,
previous_attribution,43817,1,Italian 16th Century,Italian 16th Century,Attribution at time of gift,
previous_attribution,43823,2,Attributed to Venetian 16th Century,"Venetian 16th Century, Attributed to",Reported to Bd. Tr. 5/4/83,
previous_attribution,43823,1,Italian 16th Century,Italian 16th Century,Attribution at time of gift,
previous_attribution,43830,1,Giovanni Alberghetti I,"Alberghetti I, Giovanni",Bd. Tr. approval 1/14/1981,          
previous_attribution,43830,2,Lombard 15th Century,Lombard 15th Century,Attribution at time of gift,
previous_attribution,43831,1,North Italian 16th Century,North Italian 16th Century,Attribution at time of gift,
previous_attribution,43832,2,Attributed to Venetian 16th Century,"Venetian 16th Century, Attributed to",Reported to Bd. Tr. 5/4/83,
previous_attribution,43832,1,North Italian 16th Century,North Italian 16th Century,Attribution at time of gift,
previous_attribution,43833,1,North Italian 16th Century,North Italian 16th Century,Attribution at time of gift,
previous_attribution,43835,2,Attributed to Venetian 16th Century,"Venetian 16th Century, Attributed to",Reported to Bd. Tr. 5/4/83,
previous_attribution,43835,1,North Italian 16th Century,North Italian 16th Century,Attribution at time of gift,
previous_attribution,43836,2,Attributed to Paduan 15th or 16th Century,"Paduan 15th or 16th Century, Attributed to",Reported to Bd. Tr. 5/4/83,
previous_attribution,43836,1,North Italian 16th Century,North Italian 16th Century,Attribution at time of gift,
previous_attribution,43839,1,Italian 16th Century (Venetian?),Italian 16th Century (Venetian?),Attribution at time of gift,
previous_attribution,43847,1,after Mantuan 19th Century,"Mantuan 19th Century, after",Bd. Tr. approval 1/25/1984,1984-01-25
previous_attribution,43847,2,Donatello,Donatello,Attribution at time of gift,1957
previous_attribution,43848,1,Mantuan 15th Century,Mantuan 15th Century,Reported to Bd. Tr. 5/4/1983,1983-05-04
previous_attribution,43848,2,Attributed to Donatello,"Donatello, Attributed to",Attribution at time of gift,
previous_attribution,43849,1,Mantuan 15th Century,Mantuan 15th Century,Reported to Bd. Tr. 5/4/1983,1983-05-04
previous_attribution,43849,2,Attributed to Donatello,"Donatello, Attributed to",Attribution at time of acquisition,1957
previous_attribution,43850,1,Attributed to Donatello,"Donatello, Attributed to",Attribution at time of gift,
previous_attribution,43851,1,Attributed to Donatello,"Donatello, Attributed to",Attribution at time of gift,
previous_attribution,43852,1,Attributed to Donatello,"Donatello, Attributed to",Attribution at time of gift,
previous_attribution,43853,3,Veneto region 16th Century,Veneto region 16th Century,Change proposal approved 5/6/2009,2009-05-06
previous_attribution,43853,2,North Italian 15th Century,North Italian 15th Century,Reported to Bd. Tr. 5/4/1983,1983-05-14
previous_attribution,43853,1,Attributed to Donatello,"Donatello, Attributed to",Attribution at time of gift,1957-12-05
previous_attribution,43854,1,Donatello,Donatello,Attribution at time of acquisition,1957
previous_attribution,43855,1,Donatello,Donatello,"Title at time of acquisition; published with the attribution ""Attributed to Donatello"" in 1951 NGA publication _Renaissance Bronzes, Statuettes, Reliefs and Plaquettes, Medals and Coins from the Kress Collection_.",
previous_attribution,43856,1,North Italian 16th Century,North Italian 16th Century,Reported to Bd. Tr. 5/4/1983,1983-05-04
previous_attribution,43856,2,Attributed to Donatello,"Donatello, Attributed to",Attribution at time of gift,1957
previous_attribution,43857,1,Donatello,Donatello,Attribution at time of acquisition,1957
previous_attribution,43863,1,Florentine 15th Century,Florentine 15th Century,Attribution at time of gift,
previous_attribution,43864,1,Florentine 15th Century,Florentine 15th Century,Attribution at time of gift,
previous_attribution,43868,1,Florentine 15th Century,Florentine 15th Century,Attribution at time of gift,
previous_attribution,43868,2,"Florentine 15th Century, after the Antique","Florentine 15th Century, after the Antique",Reported to Bd. Tr. 5/4/83,
previous_attribution,43869,1,Florentine 15th Century,Florentine 15th Century,Attribution at time of gift,
previous_attribution,43870,1,Florentine 15th Century,Florentine 15th Century,Attribution at time of gift,
previous_attribution,43872,1,Florentine 15th Century,Florentine 15th Century,Attribution at time of gift,
previous_attribution,43874,1,Florentine 15th Century,Florentine 15th Century,Attribution at time of gift,
previous_attribution,43875,1,Florentine 15th Century,Florentine 15th Century,Attribution at time of gift,
previous_attribution,43876,1,Florentine 15th Century,Florentine 15th Century,Attribution at time of gift,
previous_attribution,43879,1,Florentine 15th Century,Florentine 15th Century,Attribution at time of gift,
previous_attribution,43880,1,Florentine 15th Century,Florentine 15th Century,Attribution at time of gift,
previous_attribution,43881,1,Florentine 15th Century,Florentine 15th Century,Attribution at time of gift,
previous_attribution,43881,2,"Italian 15th Century, after the Antique","Italian 15th Century, after the Antique",Reported to Bd. Tr. 5/4/83,
previous_attribution,43882,1,Florentine 15th Century,Florentine 15th Century,Attribution at time of gift,
previous_attribution,43883,1,Florentine 15th Century,Florentine 15th Century,Attribution at time of gift,
previous_attribution,43884,1,Florentine 15th Century,Florentine 15th Century,Attribution at time of gift,
previous_attribution,43886,1,Italian 16th Century,Italian 16th Century,Attribution at time of gift,
previous_attribution,43887,1,Florentine 15th Century,Florentine 15th Century,Attribution at time of gift,
previous_attribution,43888,1,Florentine 15th Century,Florentine 15th Century,Attribution at time of gift,
previous_attribution,43889,1,Florentine 15th Century,Florentine 15th Century,Attribution at time of gift,
previous_attribution,43890,1,Florentine 15th Century,Florentine 15th Century,Attribution at time of gift,
previous_attribution,43891,1,Florentine 15th Century,Florentine 15th Century,Attribution at time of gift,
previous_attribution,43895,1,Florentine 15th Century,Florentine 15th Century,Attribution at time of gift,
previous_attribution,43896,1,Florentine 15th Century,Florentine 15th Century,Attribution at time of gift,
previous_attribution,43897,1,Florentine 15th Century,Florentine 15th Century,Attribution at time of gift,
previous_attribution,43898,1,Florentine 15th Century,Florentine 15th Century,Attribution at time of gift,
previous_attribution,43900,1,Cristoforo di Geremia,Cristoforo di Geremia,Attribution at time of gift,
previous_attribution,43901,1,Pietro da Milano,Pietro da Milano,Attribution at time of gift,
previous_attribution,43909,1,Gianfrancesco Enzola,"Enzola, Gianfrancesco",Attribution at time of gift,
previous_attribution,43916,1,Pseudo Melioli,Pseudo Melioli,Attribution at time of gift,
previous_attribution,43920,1,Pseudo Melioli,Pseudo Melioli,Attribution at time of gift,
previous_attribution,43935,1,Italian 15th Century,Italian 15th Century,Attribution at time of gift,
previous_attribution,43936,1,Milanese 15th Century,Milanese 15th Century,Attribution at time of gift,
previous_attribution,43937,1,Milanese 15th Century,Milanese 15th Century,Attribution at time of gift,
previous_attribution,43938,1,Milanese 15th Century,Milanese 15th Century,Attribution at time of gift,
previous_attribution,43954,1,Master of the Orpheus Legend,Master of the Orpheus Legend,Attribution at time of acquisition,1957
previous_attribution,43966,1,Pseudo Antonio da Brescia,Pseudo Antonio da Brescia,Attribution at time of gift,
previous_attribution,43968,1,L' Antico,"Antico, L'",Attribution at time of gift,
previous_attribution,43987,1,Andrea Riccio,"Riccio, Andrea",Attribution at time of gift,
previous_attribution,44024,1,Moderno,Moderno,Attribution at time of gift,
previous_attribution,44027,1,Moderno,Moderno,Attribution at time of gift,
previous_attribution,44042,1,Moderno,Moderno,Attribution at time of gift,
previous_attribution,44044,1,Moderno,Moderno,Attribution at time of gift,
previous_attribution,44049,1,Moderno,Moderno,Attribution at time of gift,
previous_attribution,44053,1,Moderno,Moderno,Attribution at time of gift,
previous_attribution,44054,1,Moderno,Moderno,Attribution at time of gift,
previous_attribution,44056,1,Moderno,Moderno,Attribution at time of gift,
previous_attribution,44058,1,Moderno,Moderno,Attribution at time of gift,
previous_attribution,44060,1,Moderno (?),Moderno (?),Attribution at time of gift,
previous_attribution,44062,1,Moderno,Moderno,Attribution at time of gift,
previous_attribution,44064,1,Moderno,Moderno,Attribution at time of gift,
previous_attribution,44068,1,Master L.C.R.I.I.S.,Master L.C.R.I.I.S.,Attribution at time of gift,
previous_attribution,44069,1,Master of Semneklopia,Master of Semneklopia,Attribution at time of gift,
previous_attribution,44070,1,Master of Semneklopia,Master of Semneklopia,Attribution at time of gift,
previous_attribution,44071,1,Master I.S.A.,Master I.S.A.,Attribution at time of gift,
previous_attribution,44072,1,Master I.S.A.,Master I.S.A.,Attribution at time of gift,
previous_attribution,44073,1,Master I.S.A.,Master I.S.A.,Attribution at time of gift,
previous_attribution,44074,1,Master I.S.A.,Master I.S.A.,Attribution at time of gift,
previous_attribution,44080,1,Giovanni da Pisa,Giovanni da Pisa,Attribution at time of gift,
previous_attribution,44089,3,Attributed to Ferrarese 15th Century,"Ferrarese 15th Century, Attributed to",See 8/17/83 memo on computer artist file,
previous_attribution,44089,1,Paduan 15th Century,Paduan 15th Century,Attribution at time of gift,
previous_attribution,44089,2,Italian 15th Century (Ferrarese ?),Italian 15th Century (Ferrarese ?),Reported to Bd. Tr. 5/4/83,
previous_attribution,44090,1,Paduan 15th Century,Paduan 15th Century,Attribution at time of gift,
previous_attribution,44091,1,Paduan 15th Century,Paduan 15th Century,Attribution at time of gift,
previous_attribution,44092,1,Paduan 15th Century,Paduan 15th Century,Attribution at time of gift,
previous_attribution,44093,1,Paduan 15th Century,Paduan 15th Century,Attribution at time of gift,
previous_attribution,44094,1,Paduan 15th Century,Paduan 15th Century,Attribution at time of gift,
previous_attribution,44097,1,Paduan 15th Century,Paduan 15th Century,Attribution at time of gift,
previous_attribution,44099,1,Paduan 15th Century,Paduan 15th Century,Attribution at time of gift,
previous_attribution,44110,1,Paduan 16th Century,Paduan 16th Century,Attribution at time of gift,
previous_attribution,44111,1,Paduan 16th Century,Paduan 16th Century,Attribution at time of gift,
previous_attribution,44112,1,Paduan 16th Century,Paduan 16th Century,Attribution at time of gift,
previous_attribution,44117,1,Venetian 15th Century,Venetian 15th Century,Attribution at time of gift,
previous_attribution,44118,1,Venetian 15th Century,Venetian 15th Century,Attribution at time of gift,
previous_attribution,44121,1,Venetian 15th Century,Venetian 15th Century,Attribution at time of gift,
previous_attribution,44128,1,North Italian 15th Century,North Italian 15th Century,Attribution at time of gift,
previous_attribution,44135,1,North Italian 16th Century,North Italian 16th Century,Attribution at time of gift,
previous_attribution,44136,1,North Italian 16th Century,North Italian 16th Century,Attribution at time of gift,
previous_attribution,44137,1,North Italian 16th Century,North Italian 16th Century,Attribution at time of gift,
previous_attribution,44138,1,North Italian 16th Century,North Italian 16th Century,Attribution at time of gift,
previous_attribution,44142,1,North Italian 16th Century,North Italian 16th Century,Attribution at time of gift,
previous_attribution,44148,1,North Italian 16th Century,North Italian 16th Century,Attribution at time of gift,
previous_attribution,44151,1,North Italian 16th Century,North Italian 16th Century,Attribution at time of gift,
previous_attribution,44153,1,North Italian 16th Century,North Italian 16th Century,Attribution at time of gift,
previous_attribution,44155,1,North Italian 16th Century,North Italian 16th Century,Attribution at time of gift,
previous_attribution,44156,1,North Italian 16th Century,North Italian 16th Century,Attribution at time of gift,
previous_attribution,44159,1,North Italian 16th Century,North Italian 16th Century,Attribution at time of gift,
previous_attribution,44160,1,North Italian 16th Century,North Italian 16th Century,Attribution at time of gift,
previous_attribution,44160,2,Attributed to Italian 16th Century,"Italian 16th Century, Attributed to",Reported to Bd. Tr. 5/4/83,1983-05-04
previous_attribution,44161,1,North Italian 16th Century,North Italian 16th Century,Attribution at time of gift,
previous_attribution,44162,1,North Italian 16th Century,North Italian 16th Century,Attribution at time of gift,
previous_attribution,44165,1,North Italian 16th Century,North Italian 16th Century,Attribution at time of gift,
previous_attribution,44166,1,North Italian 16th Century,North Italian 16th Century,Attribution at time of gift,
previous_attribution,44166,2,Attributed to Venetian 16th Century,"Venetian 16th Century, Attributed to",Reported to Bd. Tr. 5/4/83,1983-05-04
previous_attribution,44185,2,Attributed to Milanese or Roman 16th Century,"Milanese or Roman 16th Century, Attributed to",Reported to Bd. Tr. 5/4/83,1983-05-04
previous_attribution,44185,1,Italian 16th Century,Italian 16th Century,Attribution at time of gift,
previous_attribution,44205,1,Valerio Belli,"Belli, Valerio",Attribution at time of gift,
previous_attribution,44216,1,Valerio Belli,"Belli, Valerio",Attribution at time of gift,
previous_attribution,44219,1,Valerio Belli,"Belli, Valerio",Attribution at time of gift,
previous_attribution,44223,1,Valerio Belli,"Belli, Valerio",Attribution at time of gift,
previous_attribution,44224,2,Attributed to Florentine 16th Century,"Florentine 16th Century, Attributed to",Reported to Bd. Tr. 5/4/83,
previous_attribution,44224,1,Valerio Belli,"Belli, Valerio",Attribution at time of gift,
previous_attribution,44236,1,Giovanni Desiderio Bernardi,"Bernardi, Giovanni Desiderio",Attribution at time of gift,
previous_attribution,44241,1,Giovanni Desiderio Bernardi,"Bernardi, Giovanni Desiderio",Attribution at time of gift,
previous_attribution,44253,1,Italian 16th Century,Italian 16th Century,Attribution at time of gift,
previous_attribution,44257,1,Italian 16th Century,Italian 16th Century,Attribution at time of gift,
previous_attribution,44261,1,Italian 16th Century,Italian 16th Century,Attribution at time of gift,
previous_attribution,44262,1,Italian 16th Century,Italian 16th Century,Attribution at time of gift,
previous_attribution,44262,2,German 16th or 17th Century,German 16th or 17th Century,Reported to Bd. Tr. 5/4/83,1983-05-04
previous_attribution,44263,1,Italian 16th Century,Italian 16th Century,Attribution at time of gift,
previous_attribution,44263,2,German 16th or 17th Century,German 16th or 17th Century,Reported to Bd. Tr. 5/4/83,1983-05-04
previous_attribution,44266,1,Italian 16th Century,Italian 16th Century,Attribution at time of gift,
previous_attribution,44268,1,Italian 16th Century,Italian 16th Century,Attribution at time of gift,
previous_attribution,44269,1,Italian 16th Century,Italian 16th Century,Attribution at time of gift,
previous_attribution,44275,1,Attributed to French 16th Century,"French 16th Century, Attributed to",Attribution at time of gift,
previous_attribution,44276,1,Flemish 15th Century,Flemish 15th Century,Attribution at time of gift,
previous_attribution,44277,1,Netherlandish 15th Century,Netherlandish 15th Century,Attribution at time of gift,
previous_attribution,44281,1,Flemish 16th Century,Flemish 16th Century,Attribution at time of gift,
previous_attribution,44282,1,Netherlandish 16th Century,Netherlandish 16th Century,Attribution at time of gift,
previous_attribution,44284,1,Flemish 16th Century,Flemish 16th Century,Attribution at time of gift,
previous_attribution,44285,1,Peter Vischer I,"Vischer I, Peter",Attribution at time of gift,
previous_attribution,44291,1,Master P.G.,Master P.G.,Attribution at time of gift,
previous_attribution,44291,2,"German 16th Century, probably Nuremberg","German 16th Century, probably Nuremberg",Reported to Bd. Tr. 5/4/83,
previous_attribution,44292,1,Master F. Mar,Master F. Mar,Attribution at time of gift,
previous_attribution,44298,1,German 16th Century,German 16th Century,Attribution at time of gift,
previous_attribution,44299,1,German 16th Century,German 16th Century,Attribution at time of gift,
previous_attribution,44300,1,German 16th Century,German 16th Century,Attribution at time of gift,
previous_attribution,44302,1,German 16th Century,German 16th Century,Attribution at time of gift,
previous_attribution,44303,1,German 16th Century,German 16th Century,Attribution at time of gift,
previous_attribution,44304,1,German 16th Century,German 16th Century,Attribution at time of gift,
previous_attribution,44307,1,German 16th Century,German 16th Century,Attribution at time of gift,
previous_attribution,44308,1,German 16th Century,German 16th Century,Attribution at time of gift,
previous_attribution,44310,2,Attributed to Flemish 17th Century,"Flemish 17th Century, Attributed to",Reported to Bd. Tr. 5/4/83,1983-05-04
previous_attribution,44310,1,Italian 16th Century,Italian 16th Century,Attribution at time of gift,
previous_attribution,44374,1,Antonio Marescotti,"Marescotti, Antonio",Attribution at time of acquisition,""
previous_attribution,44375,1,Antonio Marescotti,"Marescotti, Antonio",Attribution at time of acquisition,""
previous_title,44385,2,"Acarino d'Este, Legendary Ancestor of the Estensi",,,
previous_attribution,44390,1,Ferrarese 15th Century,Ferrarese 15th Century,Attribution at time of acquisition,""
previous_attribution,44391,1,Ferrarese 15th Century,Ferrarese 15th Century,Attribution at time of acquisition,""
previous_attribution,44392,1,Ferrarese 15th Century,Ferrarese 15th Century,Attribution at time of acquisition,""
previous_attribution,44446,1,Manner of L' Antico,"Antico, L', Manner of",Attribution at time of acquisition,
previous_attribution,44446,2,Style of L' Antico,"Antico, L', Style of",,
previous_attribution,44447,1,Manner of L' Antico,"Antico, L', Manner of",Attribution at time of acquisition,
previous_attribution,44447,1,Style of L' Antico,"Antico, L', Style of",,
previous_attribution,44452,1,Neighborhood of Giancristoforo Romano,"Romano, Giancristoforo, Neighborhood of",Attribution at time of gift,
previous_attribution,44452,2,Circle of Giancristoforo Romano,"Romano, Giancristoforo, Circle of",Reported to Bd. Tr. 5/4/1983,""
previous_attribution,44453,1,Circle of Giancristoforo Romano,"Romano, Giancristoforo, Circle of",Attribution at time of gift,
previous_attribution,44454,1,Circle of Giancristoforo Romano,"Romano, Giancristoforo, Circle of",Attribution at time of gift,
previous_attribution,44455,1,Circle of Giancristoforo Romano,"Romano, Giancristoforo, Circle of",Attribution at time of gift,
previous_attribution,44456,1,Circle of Giancristoforo Romano,"Romano, Giancristoforo, Circle of",Attribution at time of gift,
previous_attribution,44457,1,Circle of Giancristoforo Romano,"Romano, Giancristoforo, Circle of",Attribution at time of gift,
previous_attribution,44458,1,Circle of Giancristoforo Romano,"Romano, Giancristoforo, Circle of",Attribution at time of gift,
previous_attribution,44459,1,Circle of Giancristoforo Romano,"Romano, Giancristoforo, Circle of",Attribution at time of gift,
previous_attribution,44460,2,Attributed to Giancristoforo Romano,"Romano, Giancristoforo, Attributed to",Reported to Bd. Tr. 10/4/1984,""
previous_attribution,44460,1,Circle of Giancristoforo Romano,"Romano, Giancristoforo, Circle of",Attribution at time of gift,
previous_attribution,44572,1,after Giovanni Boldù,"Boldù, Giovanni, after",Reported to Bd. Tr. 5/4/1983,1983-05-04
previous_attribution,44572,2,Giovanni Boldù,"Boldù, Giovanni",Attribution at time of gift,
previous_attribution,44573,1,after Giovanni Boldù,"Boldù, Giovanni, after",Reported to Bd. Tr. 5/4/1983,1983-05-04
previous_attribution,44573,2,Giovanni Boldù,"Boldù, Giovanni",Attribution at time of gift,
previous_attribution,44588,1,Vittore Gambello,"Gambello, Vittore",Attribution at time of gift,
previous_attribution,44590,1,Style of Vittore Gambello,"Gambello, Vittore, Style of",Attribution at time of acquisition,""
previous_attribution,44591,1,Style of Vittore Gambello,"Gambello, Vittore, Style of",Attribution at time of acquisition,""
previous_attribution,44592,1,Circle of Camelio (Vittore Gambello),"Camelio (Vittore Gambello), Circle of",Reported to Bd. Tr. 10/31/1985,1985-10-31
previous_attribution,44592,2,Style of Camelio,"Camelio, Style of",Attribution at time of gift,
previous_attribution,44593,1,Circle of Camelio (Vittore Gambello),"Camelio (Vittore Gambello), Circle of",Reported to Bd. Tr. 10/31/1985,1985-10-31
previous_attribution,44593,2,Style of Camelio,Style of Camelio,Attribution at time of gift,
previous_attribution,44594,1,Style of Vittore Gambello,"Gambello, Vittore, Style of",Attribution at time of acquisition,""
previous_attribution,44595,1,Style of Vittore Gambello,"Gambello, Vittore, Style of",Attribution at time of acquisition,""
previous_attribution,44596,1,Style of Vittore Gambello,"Gambello, Vittore, Style of",Attribution at time of acquisition,""
previous_attribution,44597,1,Style of Vittore Gambello,"Gambello, Vittore, Style of",Attribution at time of acquisition,""
previous_attribution,44617,1,Venetian 16th Century,Venetian 16th Century,Attribution at time of acquisition,""
previous_attribution,44648,1,Giovanni Maria Pomedelli,"Pomedelli, Giovanni Maria",Attribution at time of acquisition,""
previous_attribution,44649,1,Giovanni Maria Pomedelli,"Pomedelli, Giovanni Maria",Attribution at time of acquisition,""
previous_attribution,44652,1,Attributed to Francesco Francia,"Francia, Francesco, Attributed to",Attribution at time of acquisition,""
previous_attribution,44653,1,Attributed to Francesco Francia,"Francia, Francesco, Attributed to",Attribution at time of acquisition,""
previous_attribution,44654,1,after Francesco Francia,"Francia, Francesco, after",Change memo 11/14/83,1983-11-14
previous_attribution,44654,2,School of Francesco Francia,"Francia, Francesco, School of",Attribution at time of gift,
previous_attribution,44655,1,after Francesco Francia,"Francia, after Francesco",Change memo 11/14/83,1983-11-14
previous_attribution,44655,2,School of Francesco Francia,"Francia, Francesco, School of",Attribution at time of gift,
previous_attribution,44656,1,School of Francesco Francia,"Francia, Francesco, School of",Attribution at time of gift,
previous_attribution,44657,1,School of Francesco Francia,"Francia, Francesco, School of",Attribution at time of gift,
previous_attribution,44660,1,Caradosso Foppa,"Foppa, Caradosso",Attribution at time of acquisition,""
previous_attribution,44661,1,Caradosso Foppa,"Foppa, Caradosso",Attribution at time of acquisition,""
previous_attribution,44662,1,Caradosso Foppa,"Foppa, Caradosso",Attribution at time of acquisition,""
previous_attribution,44663,1,Caradosso Foppa,"Foppa, Caradosso",Attribution at time of acquisition,""
previous_attribution,44664,1,Caradosso Foppa,"Foppa, Caradosso",Attribution at time of acquisition,""
previous_attribution,44665,1,Caradosso Foppa,"Foppa, Caradosso",Attribution at time of acquisition,""
previous_attribution,44666,1,Caradosso Foppa,"Foppa, Caradosso",Attribution at time of acquisition,""
previous_attribution,44667,1,Caradosso Foppa,"Foppa, Caradosso",Attribution at time of acquisition,""
previous_attribution,44668,1,Caradosso Foppa,"Foppa, Caradosso",Attribution at time of acquisition,""
previous_attribution,44669,1,Caradosso Foppa,"Foppa, Caradosso",Attribution at time of acquisition,""
previous_attribution,44670,1,Caradosso Foppa,"Foppa, Caradosso",Attribution at time of acquisition,""
previous_attribution,44671,1,Caradosso Foppa,"Foppa, Caradosso",Attribution at time of acquisition,""
previous_attribution,44672,1,Caradosso Foppa,"Foppa, Caradosso",Attribution at time of acquisition,""
previous_attribution,44673,1,Caradosso Foppa,"Foppa, Caradosso",Attribution at time of acquisition,""
previous_attribution,44679,1,Savoy 16th Century,Savoy 16th Century,Attribution at time of acquisition,""
previous_attribution,44682,2,Medalist of the Roman Emperors (Possibly Filarete),Medalist of the Roman Emperors (Possibly Filarete),Reported to Bd. Tr. 10/4/1984,
previous_attribution,44682,1,Medalist of the Roman Emperors,Medalist of the Roman Emperors,Attribution at time of gift,
previous_attribution,44683,1,Medalist of the Roman Emperors,Medalist of the Roman Emperors,Attribution at time of gift,
previous_attribution,44683,2,Medalist of the Roman Emperors (Possibly Filarete),Medalist of the Roman Emperors (Possibly Filarete),Reported to Bd. Tr. 10/4/1984,
previous_attribution,44684,2,Medalist of the Roman Emperors (Possibly Filarete),Medalist of the Roman Emperors (Possibly Filarete),Reported to Bd. Tr. 10/4/1984,
previous_attribution,44684,1,Medalist of the Roman Emperors,Medalist of the Roman Emperors,Attribution at time of gift,
previous_attribution,44685,1,Medalist of the Roman Emperors,Medalist of the Roman Emperors,Attribution at time of gift,
previous_attribution,44685,2,Medalist of the Roman Emperors (Possibly Filarete),Medalist of the Roman Emperors (Possibly Filarete),Reported to Bd. Tr. 10/4/1984,
previous_attribution,44686,1,Medalist of the Roman Emperors,Medalist of the Roman Emperors,Attribution at time of gift,
previous_attribution,44686,2,Medalist of the Roman Emperors (Possibly Filarete),Medalist of the Roman Emperors (Possibly Filarete),Reported to Bd. Tr. 10/4/1984,
previous_attribution,44687,2,Medalist of the Roman Emperors (Possibly Filarete),Medalist of the Roman Emperors (Possibly Filarete),Reported to Bd. Tr. 10/4/1984,
previous_attribution,44687,1,Medalist of the Roman Emperors,Medalist of the Roman Emperors,Attribution at time of gift,
previous_attribution,44688,1,Filarete,Filarete,Change memo 3/30/2002,2002-03-30
previous_attribution,44688,2,Medalist of the Roman Emperors,Medalist of the Roman Emperors,Attribution at time of gift,
previous_attribution,44688,3,Medalist of the Roman Emperors (Possibly Filarete),Medalist of the Roman Emperors (Possibly Filarete),Reported to Bd. Tr. 10/4/1984,1984-10-04
previous_attribution,44689,1,Filarete,Filarete,Change memo 3/30/2002,2002-03-30
previous_attribution,44689,2,Medalist of the Roman Emperors,Medalist of the Roman Emperors,Attribution at time of gift,
previous_attribution,44689,3,Medalist of the Roman Emperors (Possibly Filarete),Medalist of the Roman Emperors (Possibly Filarete),Reported to Bd. Tr. 10/4/1984,1984-10-04
previous_attribution,44690,1,Filarete,Filarete,Change memo 3/30/2002,2002-03-30
previous_attribution,44690,3,Medalist of the Roman Emperors (Possibly Filarete),Medalist of the Roman Emperors (Possibly Filarete),Reported to Bd. Tr. 10/4/1984,1984-10-04
previous_attribution,44690,2,Medalist of the Roman Emperors,Medalist of the Roman Emperors,Attribution at time of gift,
previous_attribution,44691,1,Filarete,Filarete,Change memo 3/30/2002,2002-03-30
previous_attribution,44691,3,Medalist of the Roman Emperors (Possibly Filarete),Medalist of the Roman Emperors (Possibly Filarete),Reported to Bd. Tr. 10/4/1984,1984-10-04
previous_attribution,44691,2,Medalist of the Roman Emperors,Medalist of the Roman Emperors,Attribution at time of gift,
previous_title,44700,2,"Alfonso V of Aragon, 1396-1458, King of Naples and Sicily, Established in Naples 1442 [obverse]",,Birth date corrected from 1394 to 1396 on 8/20/2002,
previous_attribution,44710,1,Roman 15th Century,Roman 15th Century,Attribution at time of acquisition,""
previous_attribution,44711,1,Roman 15th Century,Roman 15th Century,Attribution at time of acquisition,""
previous_attribution,44724,1,Attributed to Giovanni Candida,"Candida, Giovanni, Attributed to",Reported to Bd. Tr. 5/4/1983,1983-05-04
previous_attribution,44724,2,Giovanni Candida (?),"Candida (?), Giovanni",Attribution at time of gift,
previous_attribution,44725,1,Giovanni Candida,"Candida, Giovanni",Attribution at time of acquisition,""
previous_attribution,44726,1,Giovanni Candida,"Candida, Giovanni",Attribution at time of acquisition,""
previous_attribution,44727,1,Giovanni Candida (?),"Candida (?), Giovanni",Attribution at time of gift,
previous_attribution,44728,1,Giovanni Candida (?),"Candida (?), Giovanni",Attribution at time of gift,
previous_attribution,44729,1,Giovanni Candida (?),"Candida (?), Giovanni",Attribution at time of gift,
previous_attribution,44730,1,Giovanni Candida (?),"Candida (?), Giovanni",Attribution at time of gift,
previous_attribution,44731,1,Giovanni Candida,"Candida, Giovanni",Attribution at time of acquisition,""
previous_attribution,44732,1,Giovanni Candida,"Candida, Giovanni",Attribution at time of acquisition,""
previous_attribution,44733,1,Giovanni Candida (?),"Candida (?), Giovanni",Attribution at time of gift,
previous_attribution,44734,1,Giovanni Candida (?),"Candida (?), Giovanni",Attribution at time of gift,
previous_attribution,44735,1,Attributed to Giovanni Candida,"Candida, Giovanni, Attributed to",Reported to Bd. Tr. 5/4/1983,1983-05-04
previous_attribution,44735,2,Giovanni Candida (?),"Candida (?), Giovanni",Attribution at time of gift,
previous_attribution,44736,1,Attributed to Giovanni Candida,"Candida, Giovanni, Attributed to",Reported to Bd. Tr. 5/4/1983,1983-05-04
previous_attribution,44736,2,Giovanni Candida (?),"Candida (?), Giovanni",Attribution at time of gift,
previous_attribution,44737,1,Giovanni Candida (?),"Candida (?), Giovanni",Attribution at time of gift,
previous_attribution,44738,1,Giovanni Candida (?),"Candida (?), Giovanni",Attribution at time of gift,
previous_attribution,44739,1,Giovanni Candida (?),"Candida (?), Giovanni",Attribution at time of gift,
previous_attribution,44740,1,Giovanni Candida (?),"Candida (?), Giovanni",Attribution at time of gift,
previous_attribution,44743,2,School of Giovanni Candida,"Candida, Giovanni, School of",Reported to Bd. Tr. 5/4/83,
previous_attribution,44743,1,Giovanni Candida (?),"Candida (?), Giovanni",Attribution at time of gift,
previous_attribution,44744,2,School of Giovanni Candida,"Candida, Giovanni, School of",Reported to Bd. Tr. 5/4/83,
previous_attribution,44744,1,Giovanni Candida (?),"Candida (?), Giovanni",Attribution at time of gift,
previous_attribution,44749,1,Roman 15th Century,Roman 15th Century,"Given the date of 1493/1522 this attribution should have been Roman 15th or 16th Century, so this was not an attribution change, only a correction.",""
previous_attribution,44750,1,Roman 15th Century,Roman 15th Century,"Given the date 1493/1522 this attribution should have been Roman 15th or 16th Century, so this is not an attibution change but a correction.",""
previous_attribution,44753,1,Giovanni Candida,"Candida, Giovanni",Attribution at time of acquisition,""
previous_attribution,44754,1,Giovanni Candida,"Candida, Giovanni",Attribution at time of acquisition,""
previous_attribution,44755,1,Giovanni Candida,"Candida, Giovanni",Attribution at time of gift,
previous_attribution,44756,1,Giovanni Candida,"Candida, Giovanni",Attribution at time of gift,
previous_attribution,44767,1,Roman 16th Century,Roman 16th Century,Attribution at time of acquisition,""
previous_attribution,44768,1,Roman 16th Century,Roman 16th Century,Attribution at time of acquisition,""
previous_attribution,44785,1,Bertoldo di Giovanni,Bertoldo di Giovanni,Attribution at time of acquisition,""
previous_attribution,44786,1,Bertoldo di Giovanni,Bertoldo di Giovanni,Attribution at time of acquisition,""
previous_attribution,44787,1,Bertoldo di Giovanni,Bertoldo di Giovanni,Attribution at time of acquisition,""
previous_attribution,44788,1,Bertoldo di Giovanni,Bertoldo di Giovanni,Attribution at time of acquisition,""
previous_attribution,44789,1,Bertoldo di Giovanni (?),Bertoldo di Giovanni (?),Attribution at time of gift,
previous_attribution,44790,1,Bertoldo di Giovanni (?),Bertoldo di Giovanni (?),Attribution at time of gift,
previous_attribution,44794,1,Niccolò Fiorentino (?),Niccolò Fiorentino (?),Attribution at time of gift,
previous_attribution,44795,1,Niccolò Fiorentino (?),Niccolò Fiorentino (?),Attribution at time of gift,
previous_attribution,44818,2,Attributed to Niccolò Fiorentino,"Niccolò Fiorentino, Attributed to",Change memo 4/12/2001,2001-04-12
previous_attribution,44818,3,Manner of Niccolò Fiorentino,"Niccolò Fiorentino, Manner of",Attribution at time of acquisition,
previous_attribution,44818,1,Style of Niccolò Fiorentino,"Niccolò Fiorentino, Style of",Per 2007 systematic catalogue of NGA medals,""
previous_attribution,44819,2,Attributed to Niccolò Fiorentino,"Niccolò Fiorentino, Attributed to",Change memo 4/12/2001,2001-04-12
previous_attribution,44819,3,Manner of Niccolò Fiorentino,"Niccolò Fiorentino, Manner of",Attribution at time of acquisition,
previous_attribution,44819,1,Style of Niccolò Fiorentino,"Niccolò Fiorentino, Style of",Per 2007 systematic catalogue of NGA medals,""
previous_attribution,44849,1,Attributed to Niccolò Fiorentino,"Niccolò Fiorentino, Attributed to",Change memo 4/12/2001,2001-04-12
previous_attribution,44849,3,Style of Niccolò Fiorentino,"Niccolò Fiorentino, Style of",Per 2007 systematic catalogue of NGA medals,""
previous_attribution,44849,2,Manner of Niccolò Fiorentino,"Niccolò Fiorentino, Manner of",Attribution at time of acquisition,
previous_attribution,44850,1,Attributed to Niccolò Fiorentino,"Niccolò Fiorentino, Attributed to",Change memo 4/12/2001,2001-04-12
previous_attribution,44850,2,Manner of Niccolò Fiorentino,"Niccolò Fiorentino, Manner of",Attribution at time of acquisition,
previous_attribution,44850,3,Style of Niccolò Fiorentino,"Niccolò Fiorentino, Style of",Per 2007 systematic catalogue of NGA medals,""
previous_attribution,44864,2,Attributed to Niccolò Fiorentino,"Niccolò Fiorentino, Attributed to",Change memo 4/12/2001,2001-04-12
previous_attribution,44864,3,Manner of Niccolò Fiorentino,"Niccolò Fiorentino, Manner of",Attribution at time of acquisition,
previous_attribution,44864,1,Style of Niccolò Fiorentino,"Niccolò Fiorentino, Style of",Per 2007 systematic catalogue of NGA medals,""
previous_attribution,44865,2,Attributed to Niccolò Fiorentino,"Niccolò Fiorentino, Attributed to",Change memo 4/12/2001,2001-04-12
previous_attribution,44865,3,Manner of Niccolò Fiorentino,"Niccolò Fiorentino, Manner of",Attribution at time of acquisition,
previous_attribution,44865,1,Style of Niccolò Fiorentino,"Niccolò Fiorentino, Style of",Per 2007 systematic catalogue of NGA medals,""
previous_attribution,44873,1,Florentine 15th Century,Florentine 15th Century,Reported to Bd. Tr. 5/4/1983,1983-05-04
previous_attribution,44873,2,Italian 16th Century,Italian 16th Century,Attribution at time of gift,
previous_attribution,44881,1,Italian 16th Century,Italian 16th Century,Attribution at time of acquisition,
previous_attribution,44882,1,Italian 16th Century,Italian 16th Century,Attribution at time of acquisition,
previous_attribution,44939,1,Master R.C.,Master R.C.,Attribution at time of acquisition,          
previous_attribution,44940,1,Master R.C.,Master R.C.,Attribution at time of acquisition,          
previous_attribution,44972,1,Giovanni Bernardi,"Bernardi, Giovanni",Attribution at time of acquisitioin,""
previous_attribution,45000,1,Giovanni Paladino,"Paladino, Giovanni",Attribution at time of gift,
previous_attribution,45001,1,Giovanni Paladino,"Paladino, Giovanni",Attribution at time of gift,
previous_attribution,45006,1,Italian 16th Century,Italian 16th Century,Attribution at time of acquisition,""
previous_attribution,45007,1,Italian 16th Century,Italian 16th Century,Attribution at time of acquisition,""
previous_attribution,45074,1,after Danese Cattaneo,"Cattaneo, Danese, after",Reported to Bd. Tr. 5/4/1983,1983-05-04
previous_attribution,45074,2,Danese Cattaneo,"Cattaneo, Danese",Attribution at time of gift,
previous_attribution,45075,1,after Danese Cattaneo,"Cattaneo, Danese, after",Reported to Bd. Tr. 5/4/1983,1983-05-04
previous_attribution,45075,2,Danese Cattaneo,"Cattaneo, Danese",Attribution at time of gift,
previous_attribution,45080,1,Italian 16th Century (Attributed to Benvenuto Cellini),Italian 16th Century (Attributed to Benvenuto Cellini),Reported to Bd. Tr. 5/4/1983,1983-05-04
previous_attribution,45080,2,Milanese 16th Century,Milanese 16th Century,Attribution at time of gift,
previous_attribution,45081,1,Italian 16th Century (Attributed to Benvenuto Cellini),Italian 16th Century (Attributed to Benvenuto Cellini),Reported to Bd. Tr. 5/4/1983,1983-05-04
previous_attribution,45081,2,Milanese 16th Century,Milanese 16th Century,Attribution at time of gift,
previous_attribution,45090,1,Attributed to Leone Leoni,"Leoni, Leone, Attributed to",Reported to Bd. Tr. 5/4/1983,1983-05-04
previous_attribution,45090,2,Leone Leoni,"Leoni, Leone",Attribution at time of gift,
previous_attribution,45091,1,Attributed to Leone Leoni,"Leoni, Leone, Attributed to",Reported to Bd. Tr. 5/4/1983,1983-05-04
previous_attribution,45091,2,Leone Leoni,"Leoni, Leone",Attribution at time of gift,
previous_attribution,45105,1,Leone Leoni,"Leoni, Leone",Attribution at time of acquisition,""
previous_title,45105,2,"Gianello della Torre of Cremona, 1500-1585, Engineer in the Service of Charles V [obverse]",,Change memo 11/24/1984,
previous_attribution,45143,1,Emilian 16th Century,Emilian 16th Century,Attribution at time of acquisition,""
previous_attribution,45144,1,Emilian 16th Century,Emilian 16th Century,Attribution at time of acquisition,""
previous_attribution,45145,1,Emilian 16th Century,Emilian 16th Century,Attribution at time of acquisition,""
previous_title,45173,2,Paula Carlina,,Title at time of acquisition,
previous_attribution,45183,1,Italian 16th Century,Italian 16th Century,Attribution at time of gift,
previous_attribution,45184,1,Italian 16th Century,Italian 16th Century,Attribution at time of gift,
previous_attribution,45185,1,Attributed to Pier Paolo Galeotti,"Galeotti, Pier Paolo, Attributed to",Attribution at time of acquisition,""
previous_attribution,45186,1,Attributed to Pier Paolo Galeotti,"Galeotti, Pier Paolo, Attributed to",Attribution at time of acquisition,""
previous_attribution,45187,1,Attributed to Leone Leoni,"Leoni, Leone, Attributed to",Reported to Bd. Tr. 5/4/1983,1983-05-04
previous_attribution,45187,2,Manner of Leone Leoni,"Leoni, Leone, Manner of",Attribution at time of gift,
previous_attribution,45188,1,Attributed to Leone Leoni,"Leoni, Leone, Attributed to",Reported to Bd. Tr. 5/4/1983,1983-05-04
previous_attribution,45188,2,Manner of Leone Leoni,"Leoni, Leone, Manner of",Attribution at time of gift,
previous_attribution,45189,1,Attributed to Gianpaolo Poggini,"Poggini, Gianpaolo, Attributed to",Date at time of acquisition and in 2007 systematic catalogue of NGA medals,""
previous_attribution,45193,1,Giovanni da Cavino,"Cavino, Giovanni da",Attribution at time of acquisition,""
previous_attribution,45194,1,Giovanni da Cavino,"Cavino, Giovanni da",Attribution at time of acquisition,""
previous_attribution,45195,2,"Pier Paolo Galeotti, called Romano (?)","Galeotti, Pier Paolo, called Romano (?)",This change made at an unknown date.,
previous_attribution,45195,1,Italian 16th Century,Italian 16th Century,Attribution at time of gift,
previous_attribution,45196,1,Italian 16th Century,Italian 16th Century,Attribution at time of gift,
previous_attribution,45196,2,"Pier Paolo Galeotti, called Romano (?)","Galeotti, Pier Paolo, called Romano (?)",This change made at an unknown date.,
previous_attribution,45205,1,Jacopo Sansovino (?),"Sansovino, Jacopo (?)",Attribution at time of gift,
previous_attribution,45206,1,Jacopo Sansovino (?),"Sansovino, Jacopo (?)",Attribution at time of gift,
previous_attribution,45207,1,Jacopo Sansovino (?),"Sansovino, Jacopo (?)",Attribution at time of gift,
previous_attribution,45208,1,Jacopo Sansovino (?),"Sansovino, Jacopo (?)",Attribution at time of gift,
previous_attribution,45209,1,Jacopo Sansovino (?),"Sansovino, Jacopo (?)",Attribution at time of gift,
previous_attribution,45210,1,Jacopo Sansovino (?),"Sansovino, Jacopo (?)",Attribution at time of gift,
previous_attribution,45223,1,Attributed to Alessandro Vittoria,"Vittoria, Alessandro, Attributed to",Reported to Bd. Tr. 5/4/1983,1983-05-04
previous_attribution,45223,2,Alessandro Vittoria (?),"Vittoria, Alessandro (?)",Attribution at time of gift,
previous_attribution,45224,1,Attributed to Alessandro Vittoria,"Vittoria, Alessandro, Attributed to",Reported to Bd. Tr. 5/4/1983,1983-05-04
previous_attribution,45224,2,Alessandro Vittoria (?),"Vittoria, Alessandro (?)",Attribution at time of gift,
previous_attribution,45232,1,Italian 16th Century,Italian 16th Century,Attribution at time of acquisition,""
previous_attribution,45234,1,Probably Italian 16th Century,"Italian 16th Century, Probably",Change memo 10/9/91,1991-10-09
previous_attribution,45234,2,Attributed to Italian 16th Century,"Italian 16th Century, Attributed to",Reported to Bd. Tr. 10/4/84,1984-10-04
previous_attribution,45234,3,Italian 16th Century,Italian 16th Century,Attribution at time of gift,
previous_attribution,45235,1,Probably Italian 16th Century,"Italian 16th Century, Probably",Change memo 10/9/91,1991-10-09
previous_attribution,45235,3,Italian 16th Century,Italian 16th Century,Attribution at time of gift,
previous_attribution,45235,2,Attributed to Italian 16th Century,"",Reported  to Bd. Tr. 10/4/84,1984-10-04
previous_attribution,45236,1,Italian 16th Century,Italian 16th Century,Attribution at time of gift,
previous_attribution,45237,1,Italian 16th Century,Italian 16th Century,Attribution at time of gift,
previous_attribution,45238,1,Probably Italian 16th Century,"Italian 16th Century, Probably",Change memo 10/9/1991,1991-10-09
previous_attribution,45238,2,Attributed to Italian 16th Century,"Italian 16th Century, Attributed to",Attribution at time of gift,
previous_attribution,45239,1,Probably Italian 16th Century,"Italian 16th Century, Probably",Change memo 10/9/1991,1991-10-09
previous_attribution,45239,2,Attributed to Italian 16th Century,"Italian 16th Century, Attributed to",Attribution at time of gift,
previous_attribution,45240,1,Probably Italian 16th Century,"Italian 16th Century, Probably",Change memo 10/9/1991,1991-10-09
previous_attribution,45240,2,Attributed to Italian 16th Century,"Italian 16th Century, Attributed to",Attribution at time of gift,
previous_attribution,45241,1,Probably Italian 16th Century,"Italian 16th Century, Probably",Change memo 10/9/1991,1991-10-09
previous_attribution,45241,2,Attributed to Italian 16th Century,"Italian 16th Century, Attributed to",Attribution at time of gift,
previous_attribution,45242,1,Probably Italian 16th Century,"Italian 16th Century, Probably",Change memo 10/9/1991,1991-10-09
previous_attribution,45242,2,Attributed to Italian 16th Century,"Italian 16th Century, Attributed to",Attribution at time of gift,
previous_attribution,45243,1,Probably Italian 16th Century,"Italian 16th Century, Probably",Change memo 10/9/1991,1991-10-09
previous_attribution,45243,2,Attributed to Italian 16th Century,"Italian 16th Century, Attributed to",Attribution at time of gift,
previous_attribution,45244,1,Probably Italian 16th Century,"Italian 16th Century, Probably",Change memo 10/9/1991,1991-10-09
previous_attribution,45244,2,Attributed to Italian 16th Century,"Italian 16th Century, Attributed to",Attribution at time of gift,
previous_attribution,45245,1,Probably Italian 16th Century,"Italian 16th Century, Probably",Change memo 10/9/1991,1991-10-09
previous_attribution,45245,2,Attributed to Italian 16th Century,"Italian 16th Century, Attributed to",Attribution at time of gift,
previous_attribution,45246,1,Probably Italian 16th Century,"Italian 16th Century, Probably",Change memo 10/9/1991,1991-10-09
previous_attribution,45246,2,Attributed to Italian 16th Century,"Italian 16th Century, Attributed to",Attribution at time of gift,
previous_attribution,45247,1,Style of Niccolò Fiorentino,"Niccolò Fiorentino, Style of",Attribution at time of acquisition,""
previous_attribution,45248,1,Burgundian or North French 14th Century,Burgundian or North French 14th Century,Attribution at time of gift,
previous_attribution,45249,1,Burgundian or North French 14th Century,Burgundian or North French 14th Century,Attribution at time of gift,
previous_attribution,45250,1,Burgundian or North French 14th Century,Burgundian or North French 14th Century,Attribution at time of gift,
previous_attribution,45251,1,Burgundian or North French 14th Century,Burgundian or North French 14th Century,Attribution at time of gift,
previous_attribution,45266,1,French 16th Century (Italian 16th Century ?),French 16th Century (Italian 16th Century ?),Attribution at time of gift,
previous_attribution,45267,1,French 16th Century (Italian 16th Century ?),French 16th Century (Italian 16th Century ?),Attribution at time of gift,
previous_attribution,45269,1,Master L.N.,Master L.N.,Attribution at time of gift,
previous_attribution,45270,1,Master L.N.,Master L.N.,Attribution at time of gift,
previous_attribution,45271,3,Italian or French 16th Century,Italian or French 16th Century,Reported to Bd. Tr. 5/4/83,
previous_attribution,45271,2,French 16th Century,French 16th Century,This change made at an unknown date.,
previous_attribution,45271,1,Unattributed,Unattributed,Attribution at time of gift,
previous_attribution,45272,1,Unattributed,Unattributed,Attribution at time of gift,
previous_attribution,45272,2,French 16th Century,French 16th Century,This change made at an unknown date.,
previous_attribution,45272,3,Italian or French 16th Century,Italian or French 16th Century,Reported to Bd. Tr. 5/4/83,
previous_attribution,45288,1,French 16th Century,French 16th Century,Attribution at time of gift,
previous_attribution,45305,2,Manner of Guillaume Dupré,"Dupré, Guillaume, Manner of",Reported to Bd. Tr. 5/4/83,1983-05-04
previous_attribution,45305,1,Guillaume Dupré,"Dupré, Guillaume",Attribution at time of gift,
previous_attribution,45310,1,Guillaume Dupré,"Dupré, Guillaume",Attribution at time of gift,
previous_attribution,45322,1,Guillaume Dupré,"Dupré, Guillaume",Attribution at time of gift,
previous_attribution,45323,1,Guillaume Dupré,"Dupré, Guillaume",Attribution at time of gift,
previous_title,45346,2,"Albertine de Nivenheim, of a Gelders Family, Married (1) M. Pater, separated 1765, (2) Marquis de Champcenetz 1777",,Change memo 11/27/1984,
previous_title,45381,2,"Wenzeslaus Beyer, 1488-1526, State Physician in Bohemia 1526 [obverse]",,Change memo 11/27/1984,
previous_attribution,45403,1,Nuremberg Master,Nuremberg Master,Attribution at time of gift,
previous_attribution,45416,1,German or Austrian 16th Century,German or Austrian 16th Century,Attribution at time of gift,
previous_attribution,45417,1,German or Austrian 16th Century,German or Austrian 16th Century,Attribution at time of gift,
previous_attribution,45424,1,Pseudo Durer,Pseudo Durer,Attribution at time of acquisition,          
previous_attribution,45445,1,Savoy 16th Century,Savoy 16th Century,Attribution at time of gift,
previous_attribution,45446,1,Savoy 16th Century,Savoy 16th Century,Attribution at time of gift,
previous_attribution,45447,1,Savoy 16th Century,Savoy 16th Century,Attribution at time of gift,
previous_attribution,45448,1,Savoy 16th Century,Savoy 16th Century,Attribution at time of gift,
previous_title,45477,2,"Ercole I d'Este, 1431-1505, 2nd Duke of Ferrara 1471 [obverse]",,Change memo 11/27/1984,
previous_attribution,45481,1,Antignate School,Antignate School,Attribution at time of gift,
previous_attribution,45482,1,Antignate School,Antignate School,Attribution at time of gift,
previous_attribution,45489,1,Florentine 16th Century,Florentine 16th Century,Attribution at time of gift,
previous_attribution,45490,1,Florentine 16th Century,Florentine 16th Century,Attribution at time of gift,
previous_attribution,45501,1,Italian 16th Century,Italian 16th Century,Attribution at time of acquisition,""
previous_title,45507,2,"Galeazzo Maria Sforza, 1444-1476, 5th Duke of Milan 1466 [obverse]",,Change memo 11/27/1984,
previous_attribution,45509,1,Attributed to Niccolò Fiorentino,"Niccolò Fiorentino, Attributed to",Attribution at time of acquisition,""
previous_attribution,45510,1,Attributed to Niccolò Fiorentino,"Niccolò Fiorentino, Attributed to",Attribution at time of acquisition,""
previous_attribution,45530,1,British 17th Century,British 17th Century,,
previous_attribution,45531,1,British 17th Century,British 17th Century,,
previous_attribution,45532,1,Niccolò Fiorentino,Niccolò Fiorentino,Attribution at time of acquisition,""
previous_attribution,45533,1,Niccolò Fiorentino,Niccolò Fiorentino,Attribution at time of acquisition,""
previous_attribution,45546,1,German 16th Century,German 16th Century,Attribution at time of gift,
previous_attribution,45547,1,German 16th Century,German 16th Century,Attribution at time of gift,
previous_attribution,45549,1,Matthes Gebel (?) or Peter Flötner (?),"Gebel, Matthes (?) or Peter Flötner (?)",Attribution at time of gift,
previous_attribution,45550,1,Matthes Gebel (?) or Peter Flötner (?),"Gebel, Matthes (?) or Peter Flötner (?)",Attribution at time of gift,
previous_attribution,45553,1,Master L,Master L,Attribution at time of gift,
previous_attribution,45554,1,Master L,Master L,Attribution at time of gift,
previous_attribution,45560,1,French 17th Century,French 17th Century,Attribution at time of acquisition,""
previous_attribution,45565,1,Attributed to Matthes Gebel,"Gebel, Matthes, Attributed to",Attribution at time of gift,
previous_attribution,45566,1,Attributed to Matthes Gebel,"Gebel, Matthes, Attributed to",Attribution at time of gift,
previous_attribution,45596,1,Pietro Torrigiano,"Torrigiano, Pietro",Attribution at time of acquisition,""
previous_attribution,45597,1,Pietro Torrigiano,"Torrigiano, Pietro",Attribution at time of acquistion,""
previous_attribution,45599,1,Danese Cattaneo,"Cattaneo, Danese",Attribution at time of acquisition,""
previous_attribution,45600,1,Danese Cattaneo,"Cattaneo, Danese",Attribution at time of acquisition,""
previous_attribution,45644,2,School of Francesco Guardi,"Guardi, Francesco, School of",Bd. Tr. approval 1/19/65,
previous_attribution,45644,1,Francesco Guardi,"Guardi, Francesco",Attribution at time of gift,
previous_attribution,45645,1,Honoré Daumier,"Daumier, Honoré",Attribution at time of gift,
previous_attribution,45646,1,Honoré Daumier,"Daumier, Honoré",Attribution at time of gift,
previous_attribution,45750,1,Italian 15th Century,Italian 15th Century,,
previous_attribution,45858,1,American 19th Century,American 19th Century,Attribution at time of gift,
previous_attribution,45863,1,Unknown American,Unknown American,Attribution at time of gift,
previous_attribution,45882,1,after Ludwig van Schoor,"Schoor, Ludwig van, after",Attribution at time of gift,2009-04-10
previous_attribution,45888,1,Master of Flémalle and assistants,Master of Flémalle and assistants,Attribution at time of gift,
previous_attribution,45893,1,Garo Antreasian,"Antreasian, Garo",,
previous_attribution,45963,1,Unknown Artist,Unknown Artist,Attribution at time of gift,
previous_attribution,45965,1,American 19th Century,American 19th Century,Attribution at time of gift,
previous_attribution,45966,2,Attributed to Benjamin Greenleaf,"Greenleaf, Benjamin, Attributed to",Bd. Tr. approval 5/4/83,
previous_attribution,45966,1,American School,American School,Attribution at time of gift,
previous_title,45979,2,Bringing the Goats to Market Sacrifice (Trinidad),,,
previous_attribution,46001,1,German 15th Century,German 15th Century,,
previous_attribution,46011,1,Cristoforo Solari,"Solari, Cristoforo","Attribution at time of acquisition
",
previous_attribution,46017,1,"Florentine 19th Century, after Master of the Marble Madonnas","Florentine 19th Century, after Master of the Marble Madonnas",Bd. Tr. approval 10/10/1991,1991-10-10
previous_attribution,46017,2,Tommaso Fiamberti,"Fiamberti, Tommaso",Attribution at time of gift,
previous_attribution,46018,1,Master of the Mascoli Altar,Master of the Mascoli Altar,Attribution at time of gift,
previous_attribution,46019,1,Master of the Mascoli Altar,Master of the Mascoli Altar,Attribution at time of gift,
previous_attribution,46020,1,Master of the Mascoli Altar,Master of the Mascoli Altar,Attribution at time of gift,
previous_attribution,46021,1,Master of the Mascoli Altar,Master of the Mascoli Altar,Attribution at time of gift,
previous_attribution,46022,2,Attributed to Pisan 14th Century,"Pisan 14th Century, Attributed to",Bd. Tr. approval 10/1/87,
previous_attribution,46022,1,Orcagna,Orcagna,Attribution at time of gift,
previous_attribution,46023,1,Orcagna,Orcagna,Attribution at time of gift,
previous_attribution,46023,2,Attributed to Pisan 14th Century,"Pisan 14th Century, Attributed to",Bd. Tr. approval 10/1/87,
previous_attribution,46025,1,Attributed to Giovanni Bellini,"Bellini, Giovanni, Attributed to",Attribution at time of gift,
previous_attribution,46026,1,François Boucher,"Boucher, François",Attribution at time of gift,
previous_attribution,46029,1,Attributed to Correggio,"Correggio, Attributed to",Attribution at time of gift,
previous_attribution,46030,2,Circle of Francis Cotes,"Cotes, Francis, Circle of",Bd. Tr. approval 1/25/73,
previous_attribution,46030,1,Francis Cotes,"Cotes, Francis",Attribution at time of gift,
previous_attribution,46031,1,Francis Cotes,"Cotes, Francis",Attribution at time of gift,
previous_attribution,46031,2,Circle of Francis Cotes,"Cotes, Francis, Circle of",Bd. Tr. approval 1/25/73,
previous_attribution,46034,1,"Dutch School, after Gerard Terborch II","Dutch School, after Gerard Terborch II",Attribution at time of gift,
previous_attribution,46034,2,School of Gerard Terborch II,"Terborch II, Gerard, School of",Bd. Tr. approval 1/19/65,
previous_attribution,46035,1,Manner of Sir Anthony van Dyck,"Dyck, Sir Anthony van, Manner of",Attribution at time of gift,
previous_attribution,46038,1,French School after Jean-Baptiste Joseph Pater,French School after Jean-Baptiste Joseph Pater,Attribution at time of gift,
